id,entry_type,bibkey,options,shorthand,date_year,pubstate,title_latex,title_unicode,booktitle_latex,booktitle_unicode,crossref,journal_key,volume,number,pages,start_page,eid,series_key,address,institution_key,school_key,publisher_key,type_field,edition,note_latex,note_unicode,issuetitle_latex,issuetitle_unicode,extra_note_latex,extra_note_unicode,urn,eprint,doi,url,langid,is_translation,epoch,license,author_keys,editor_keys,guesteditor_keys,keyword_keys
37190,book,czajka_a-isyar:2014,,,2014,,Europe after Derrida: Crisis and Potentiality,Europe after Derrida: Crisis and Potentiality,Europe after Derrida: Crisis and Potentiality,Europe after Derrida: Crisis and Potentiality,,,,,,,,,Edinburgh,,,edinburgh-university-press,,,,,,,,,,,10.3366/edinburgh/9780748683369.001.0001,,english,false,,,,czajka_a;isyar_b,,
37191,incollection,czaniera:1995,,,1995,,"Kurt Baier: \emph{The Rational and the Moral Order.~The Social Roots of Reason and Morality}, Chicago 1995.","Kurt Baier: The Rational and the Moral Order. The Social Roots of Reason and Morality, Chicago 1995.",,,,,,,306--309,306,,,,,,,,,,,,,,,,,,,english,false,,,czaniera,,,1:complexity
37192,book,czaniera:2001,,,2001,,Gibt es moralisches Wissen? Die Kognitivismusdebatte in der analytischen Moralphilosophie,Gibt es moralisches Wissen? Die Kognitivismusdebatte in der analytischen Moralphilosophie,,,,,,,,,,,Paderborn,,,mentis-verlag,,,,,,,,,,,,,ngerman,false,,,czaniera,,,1:ethics;2:epistemology_of_morality;3:ethical_cognitivism
37193,incollection,czaniera:2003,,,2003,,The Neutrality of Meta-Ethics Revisited -- How to Draw on Einstein and the Vienna Circle in Developing an Adequate Account of Morals,The Neutrality of Meta-Ethics Revisited – How to Draw on Einstein and the Vienna Circle in Developing an Adequate Account of Morals,,,,,,,313--322,313,,,,,,,,,,,,,,,,,,,english,false,,,czaniera,,,1:ethics
37194,incollection,czarnawska:1995,,,1995,,The Way from Concept to Thought.~Does it Exist in Ajdukiewicz's Semantical Theory?,The Way from Concept to Thought. Does it Exist in Ajdukiewicz's Semantical Theory?,,,,,,,75--82,75,,,,,,,,,,,,,,,,,,,english,false,,,czarnawska,,,1:representation;2:concepts
37195,book,czarnecki_t-etal:2010,,,2010,,The Analytical Way: Proceedings of the 6th European Congress of Analytic Philosophy,The Analytical Way: Proceedings of the 6th European Congress of Analytic Philosophy,The Analytical Way: Proceedings of the 6th European Congress of Analytic Philosophy,The Analytical Way: Proceedings of the 6th European Congress of Analytic Philosophy,,,,25,,,,studies_in_logic,London,,,college-publications,,,,,,,,,,,,,english,false,,,,czarnecki_t;kijaniaplacek;poller_o;wolenski,,1:logic
37196,incollection,czarnecki_t:1998,,,1998,,On Ajdukiewicz's Empirical Meaning-Rule and Wittgenstein's Defining Criterion,On Ajdukiewicz's Empirical Meaning-Rule and Wittgenstein's Defining Criterion,,,,,,,35--42,35,,,,,,,,,,,,,,,,,,,english,false,,,czarnecki_t,,,1:representation;2:meaningfulness;3:verificationist_criterion_of_meaningfulness
37197,article,czarnecki_t:2002,,,2002,,G.E.~Moore on Logical Possibility,G.E. Moore on Logical Possibility,,,,logic-and-logical-philosophy,10,,7--19,7,,,,,,,,,,,,,,,,,,,english,false,,,czarnecki_t,,,1:modality;2:types_of_necessity;3:logical_necessity
37198,incollection,czarnecki_t:2003,,,2003,,Adjukiewicz on Language Change and Truth,Adjukiewicz on Language Change and Truth,,,,,,,131--149,131,,,,,,,,,,,,,,,,,,,english,false,,,czarnecki_t,,,1:time;2:change
37199,incollection,czarnecki_t:2005,,,2005,,The Closure Principle and the Ignoring of Possibilities,The Closure Principle and the Ignoring of Possibilities,,,,,,,69--82,69,,,,,,,,,,,,,,,,,,,english,false,,,czarnecki_t,,,1:epistemology;2:epistemic_closure
37200,incollection,czarniawska:2015,,,2015,,The Rhetoric of Emotions,The Rhetoric of Emotions,,,,,,,67--78,67,,,,,,,,,,,,,,,,,,,english,false,,,czarniawska,,,1:feeling;2:emotions
37201,incollection,czarnik:2002,,,2002,,Is Freedom a Condition of Responsibility? An Analysis based on Roman Ingarden's Notion of Freedom,Is Freedom a Condition of Responsibility? An Analysis based on Roman Ingarden's Notion of Freedom,,,,,,,281--288,281,,,,,,,,,,,,,,,,,,,english,false,,,czarnik,,,
37202,incollection,czarnik:2004,,,2004,,Causality and Freedom in Roman Ingarden,Causality and Freedom in Roman Ingarden,,,,,,,603--610,603,,,,,,,,,,,,,,,,,,,english,false,,,czarnik,,,1:determinism
37203,incollection,czarnocka_m-zytkow:1982,,,1982,,Difficulties with the Reduction of Classical to Relativistic Mechanics,Difficulties with the Reduction of Classical to Relativistic Mechanics,,,,,,,319--334,319,,,,,,,,,,,,,,,,,,,english,false,,,czarnocka_m;zytkow_jm,,,1:space_spacetime;2:relativity_theory
37204,book,czarnocka_m:2018,,,2018,,A Path to a Conception for Symbolic Truth,A Path to a Conception for Symbolic Truth,,,,,,,,,,towards_a_universal_civilization,Frankfurt a.M.,,,peter-lang,,,,,,,,,,,,,english,false,,,czarnocka_m,,,1:truth;2:correspondence_theory_of_truth
37205,incollection,czelakowski-pigozzi:1999,,,1999,,Amalgamation and Interpolation in Abstract Algebraic Logic,Amalgamation and Interpolation in Abstract Algebraic Logic,,,,,,,187--266,187,,,,,,,,,,,,,,,,,,,english,false,,,czelakowski;pigozzi_d,,,1:logic;2:algebraic_logic
37206,incollection,czelakowski:1981,,,1981,,Partial Referential Matrices for Quantum Logics,Partial Referential Matrices for Quantum Logics,,,,,,,131--146,131,,,,,,,,,,,,,,,,,,,english,false,,,czelakowski,,,1:quantum_mechanics;2:quantum_logic
37207,article,czelakowski:1995,,,1995,,Logics and Operators,Logics and Operators,,,,logic-and-logical-philosophy,3,,87--100,87,,,,,,,,,,,,,,,,,,,english,false,,,czelakowski,,,1:science;2:scientific_realism;3:operationalism
37208,incollection,czelakowski:1996,,,1996,,Elements of Formal Action Theory,Elements of Formal Action Theory,,,,,,,3--62,3,,,,,,,,,,,,,,,,,,,english,false,,,czelakowski,,,1:action;2:action_formalisms
37209,incollection,czelakowski:2009,,,2009,,"Monotone Relations, Fixed Points and Recursive Definitions","Monotone Relations, Fixed Points and Recursive Definitions",,,,,,,125--163,125,,,,,,,,,,,,,,,,,,,english,false,,,czelakowski,,,
37210,incollection,czelakowski:2016,,,2016,,Probabilistic Interpretations of Predicates,Probabilistic Interpretations of Predicates,,,,,,,247--278,247,,,,,,,,,,,,,,,,,,,english,false,,,czelakowski,,,1:semantics;2:predicates
37211,incollection,czempiel_eo:2016,,,2016,,Der Friedensbegriff in der Friedensforschung,Der Friedensbegriff in der Friedensforschung,,,,,,,83--94,83,,,,,,,,,,,,,,,,,,,ngerman,false,,,czempiel_eo,,,1:social_philosophy;2:war
37212,incollection,czermak_h-weingartner_p:1983,,,1983,,Criteria for Distinguishing Logically Necessary Propositions,Criteria for Distinguishing Logically Necessary Propositions,,,,,,,48--51,48,,,,,,,,,,,,,,,,,,,english,false,,,czermak_h;weingartner_p,,,1:modality
37213,article,czermak_j:1974,,,1974,,A Logical Calculus with Descriptions,A Logical Calculus with Descriptions,,,,journal-of-philosophical-logic,3,3,211--228,211,,,,,,,,,,,,,,,,,,,english,false,,,czermak_j,,,1:reference;2:definite_descriptions
37214,incollection,czermak_j:1975,,,1975,,Interpolation Theorem for Some Modal Logics,Interpolation Theorem for Some Modal Logics,,,,,,,381--393,381,,,,,,,,,,,,,,,,,,,english,false,,,czermak_j,,,1:logic;2:modal_logic
37215,article,czermak_j:1977,,,1977,,A Remark on Gentzen's Calculus of Sequents,A Remark on Gentzen's Calculus of Sequents,,,,notre-dame-journal-of-formal-logic,18,,471--474,471,,,,,,,,,,,,,,,,,,,english,false,,,czermak_j,,,1:logic;2:natural_deduction;3:gentzen
37216,incollection,czermak_j:1978,,,1978,,The Reducibility of a Logical Space with Many-Valued Dimensions,The Reducibility of a Logical Space with Many-Valued Dimensions,,,,,,,171--173,171,,,,,,,,,,,,,,,,,,,english,false,,,czermak_j,,,1:properties;2:universals;3:property_space
37217,incollection,czerniawski_j:1998,,,1998,,On What There Is Not -- A Vindication of Reism,On What There Is Not – A Vindication of Reism,,,,,,,313--318,313,,,,,,,,,,,,,,,,,,,english,false,,,czerniawski_j,,,1:exemplification;2:reism
37218,incollection,czerniawski_j:2002,,,2002,,Flow of Time as a Selection Rule in General Relativity,Flow of Time as a Selection Rule in General Relativity,,,,,,,57--72,57,,,,,,,,,,,,,,,,,,,english,false,,,czerniawski_j,,,1:space_spacetime;2:physical_time;3:time_in_relativity_theory
37219,incollection,czerwinski:1977,,,1977,,The Problem of Probabilistic Justification of Enumerative Induction,The Problem of Probabilistic Justification of Enumerative Induction,,,,,,,65--80,65,,,,,,,,,,,,,,,,,,,english,false,,,czerwinski,,,1:method;2:induction
37220,incollection,czerwinski:1977a,,,1977,,Enumerative Induction and the Theory of Games,Enumerative Induction and the Theory of Games,,,,,,,81--92,81,,,,,,,,,,,,,,,,,,,english,false,,,czerwinski,,,1:method;2:induction
37221,article,czezowski:1948,,,1948,,Quelques probl{\`e}mes anciens sous la forme moderne,Quelques problèmes anciens sous la forme moderne,,,,studia-philosophica-commentarii-societatis-philosophicae-polonorum,3,,101--113,101,,,,,,,,,,,,,,,,,,,french,false,,,czezowski,,,1:properties;2:property_nominalism
37222,book,czezowski:1949,,,1949,,Logika.~Podr{\c{e}}cznik dla studiuj{\k{a}}cych nauki filozoficzne,Logika. Podrȩcznik dla studiujących nauki filozoficzne,,,,,,,,,,,Warszawa,,,panstwow-wydawnictwo-naukowe-pwn,,2,,,,,,,,,,,polish,false,,,czezowski,,,1:logic;2:logic_course
37223,book,czezowski:1958,,,1958,,Odczyty Filozoficzne [Lectures on Philosophy],Odczyty Filozoficzne [Lectures on Philosophy],Odczyty Filozoficzne [Lectures on Philosophy],Odczyty Filozoficzne [Lectures on Philosophy],,,,,,,,,?,,,torun-scientific-society,,,,,,,,,,,,,polish,false,,,czezowski,,,1:varia
37224,incollection,czezowski:1958a,,,1958,,Nazwy okazjonalne oraz imiona w{\l}asne [Token-reflexive Words versus Proper Names],Nazwy okazjonalne oraz imiona własne [Token-reflexive Words versus Proper Names],,,,,,,,,,,,,,,,,Translated in \citet[65--72]{pelc_j:1979},Translated in Pelc (1979),,,,,,,,,polish,false,,,czezowski,,,1:reference;2:names
37225,book,czezowski:1965,,,1965,,Filozofia na rozdro{\d{z}}u [Philosophy at the Crossroads],Filozofia na rozdroẓu [Philosophy at the Crossroads],Filozofia na rozdro{\d{z}}u [Philosophy at the Crossroads],Filozofia na rozdroẓu [Philosophy at the Crossroads],,,,,,,,,Warszawa,,,panstwow-wydawnictwo-naukowe-pwn,,,,,,,,,,,,,polish,false,,,czezowski,,,1:metaphilosophy
37226,incollection,czezowski:1965a,,,1965,,Konotacja i denotacja [Connotation and Denotation],Konotacja i denotacja [Connotation and Denotation],,,,,,,,,,,,,,,,,Translated in \citet[73--80]{pelc_j:1979},Translated in Pelc (1979),,,,,,,,,polish,false,,,czezowski,,,1:reference
37227,incollection,czezowski:1977,,,1977,,On Testability in Empirical Sciences,On Testability in Empirical Sciences,,,,,,,93--110,93,,,,,,,,,,,,,,,,,,,english,false,,,czezowski,,,1:science;2:experimentation
37228,article,czezowski:1984,,,1984,,The Problem of Induction,The Problem of Induction,,,,dialectics-and-humanism,11,2/3,257--264,257,,,,,,,,,,,,,,,,,,,english,false,,,czezowski,,,1:method;2:induction
37229,book,czezowski:2000,,,2000,,"Knowledge, Science, and Values: A Program for Scientific Philosophy","Knowledge, Science, and Values: A Program for Scientific Philosophy",,,,,,68,,,,pozna_n_studies_in_the_philosophy_of_the_sciences_and_the_humanities,Amsterdam,,,rodopi,,,,,,,,,,,,,english,false,,,czezowski,,,1:science
