id,entry_type,bibkey,options,shorthand,date_year,pubstate,title_latex,title_unicode,booktitle_latex,booktitle_unicode,crossref,journal_key,volume,number,pages,start_page,eid,series_key,address,institution_key,school_key,publisher_key,type_field,edition,note_latex,note_unicode,issuetitle_latex,issuetitle_unicode,extra_note_latex,extra_note_unicode,urn,eprint,doi,url,langid,is_translation,epoch,license,author_keys,editor_keys,guesteditor_keys,keyword_keys
44366,article,dougherty_rc:1969,,,1969,,An Interpretive Theory of Pronominal Reference,An Interpretive Theory of Pronominal Reference,,,,foundations-of-language,5,,488--519,488,,,,,,,,,,,,,,,,,,,english,false,,,dougherty_rc,,,1:reference;2:anaphora
44367,article,dougherty_rc:1973,,,1973,,A Survey of Linguistic Methods and Arguments,A Survey of Linguistic Methods and Arguments,,,,foundations-of-language,10,3,423--490,423,,,,,,,,,,,,,,,,,,,english,false,,,dougherty_rc,,,1:linguistics;2:grammar;3:generative_grammar
44368,article,dougherty_rc:1974,,,1974,,The Syntax and Semantics of `Each Other' Constructions,The Syntax and Semantics of ‘Each Other' Constructions,,,,foundations-of-language,12,,1--47,1,,,,,,,,,,,,,,,,,,,english,false,,,dougherty_rc,,,1:language;2:reciprocal_constructions
44369,incollection,dougherty_rc:1974a,,,1974,,What Explanation Is and Isn't,What Explanation Is and Isn't,,,,,,,125--151,125,,,,,,,,,,,,,,,,,,,english,false,,,dougherty_rc,,,1:explanation;2:explanation_in_linguistics
44370,incollection,dougherty_rc:1975,,,1975,,Harris and Chomsky at the Syntax-Semantics Boundary,Harris and Chomsky at the Syntax-Semantics Boundary,,,,,,,137--194,137,,,,,,,,,,,,,,,,,,,english,false,,,dougherty_rc,,,1:linguistics
44371,incollection,dougherty_rc:1976,,,1976,,Argument Invention: The Linguist's `Feel' for Science,Argument Invention: The Linguist's ‘Feel' for Science,,,,,,,111--165,111,,,,,,,,,,,,,,,,,,,english,false,,,dougherty_rc,,,1:linguistics
44372,book,dougherty_rc:1995,,,1995,,Natural Language Computing,Natural Language Computing,,,,,,,,,,,"Mahwah, New Jersey",,,lawrence-erlbaum-associates-inc,,,,,,,,,,,,,english,false,,,dougherty_rc,,,1:linguistics;2:linguistics_as_a_science;3:mathematical_linguistics
44373,incollection,dougherty_t-gage:2015,,,2015,,New Atheist Approaches to Religion,New Atheist Approaches to Religion,,,,,,,51--62,51,,,,,,,,,,,,,,,,,,,english,false,,,dougherty_t;gage_lp,,,1:religion;2:atheism
44374,book,dougherty_t-mcbrayer:2014,,,2014,,Skeptical Theism: New Essays,Skeptical Theism: New Essays,Skeptical Theism: New Essays,Skeptical Theism: New Essays,,,,,,,,,Oxford,,,oxford-university-press,,,,,,,,,,,,,english,false,,,,dougherty_t;mcbrayer,,1:religion
44375,incollection,dougherty_t-pruss:2014,,,2014,,Evil and the Problem of Anomaly,Evil and the Problem of Anomaly,,,,,,,49--87,49,,,,,,,,,,,,,,,,,,,english,false,,,dougherty_t;pruss,,,1:religion;2:problem_of_evil
44376,article,dougherty_t-rysiew:2009,,,2009,,"Fallibilism, Epistemic Possibility, and Concessive Knowledge Attributions","Fallibilism, Epistemic Possibility, and Concessive Knowledge Attributions",,,,philosophy-and-phenomenological-research,78,1,123--132,123,,,,,,,,,,,,,,,,,,,english,false,,,dougherty_t;rysiew,,,1:epistemology;2:fallibilism
44377,article,dougherty_t-rysiew:2011,,,2011,,Clarity about Concessive Knowledge Attributions: Reply to Dodd,Clarity about Concessive Knowledge Attributions: Reply to Dodd,,,,synthese,181,3,395--403,395,,,,,,,,,,,,,,,,,,,english,false,,,dougherty_t;rysiew,,,1:knowledge;2:knowledge_ascription
44378,incollection,dougherty_t-rysiew:2014,,,2014,,What is Knowledge-First Epistemology?,What is Knowledge-First Epistemology?,,,,,,,10--16,10,,,,,,,,,,,,,,,,,,,english,false,,,dougherty_t;rysiew,,,1:knowledge;2:knowledge_first
44379,incollection,dougherty_t-rysiew:2014a,,,2014,,Experience First,Experience First,,,,,,,17--21,17,,,,,,,,,,,,,,,,,,,english,false,,,dougherty_t;rysiew,,,1:knowledge;2:knowledge_first
44380,incollection,dougherty_t-rysiew:2014b,,,2014,,Still Nowhere Else to Start [reply to \citet{williamson_t:2014e}],Still Nowhere Else to Start [reply to Williamson (2014)],,,,,,,25--26,25,,,,,,,,,,,,,,,,,,,english,false,,,dougherty_t;rysiew,,,1:knowledge;2:knowledge_first
44381,article,dougherty_t-tweedt:2015,,,2015,,Religious Epistemology,Religious Epistemology,,,,philosophy-compass,10,8,547--559,547,,,,,,,,,,,,,,,,,,,english,false,,,dougherty_t;tweedt_c,,,1:religion;2:epistemology_of_religion
44382,incollection,dougherty_t-walls:2013,,,2013,,Arguments from Evil,Arguments from Evil,,,,,,,369--382,369,,,,,,,,,,,,,,,,,,,english,false,,,dougherty_t;walls,,,1:religion;2:problem_of_evil
44383,book,dougherty_t:2011,,,2011,,Evidentialism and its Discontents,Evidentialism and its Discontents,Evidentialism and its Discontents,Evidentialism and its Discontents,,,,,,,,,Oxford,,,oxford-university-press,,,,,,,,,,,10.1093/acprof:oso/9780199563500.001.0001,,english,false,,,dougherty_t,,,1:epistemology;2:justification;3:evidentialism
44384,article,dougherty_t:2011a,,,2011,,Recent Work on the Problem of Evil,Recent Work on the Problem of Evil,,,,analysis,71,3,560--573,560,,,,,,,,,,,,,,,,,,,english,false,,,dougherty_t,,,1:religion;2:problem_of_evil
44385,incollection,dougherty_t:2011b,,,2011,,Introduction,Introduction,,,,,,,1--13,1,,,,,,,,,,,,,,,,,,,english,false,,,dougherty_t,,,1:epistemology
44386,incollection,dougherty_t:2011c,,,2011,,In Defense of Propositionalism about Evidence,In Defense of Propositionalism about Evidence,,,,,,,226--231,226,,,,,,,,,,,,,,,,,,,english,false,,,dougherty_t,,,1:epistemology;2:justification;3:evidence
44387,incollection,dougherty_t:2011d,,,2011,,Fallibilism,Fallibilism,,,,,,,131--143,131,,,,,,,,,,,,,,,,,,,english,false,,,dougherty_t,,,1:epistemology
44388,article,dougherty_t:2011e,,,2011,,Re-Reducing Responsibility: Reply to \citet{axtell_g:2011a},Re-Reducing Responsibility: Reply to Axtell (2011),,,,logos-episteme,2,4,625--632,625,,,,,,,,,,,,,,,,,,,english,false,,,dougherty_t,,,1:action;2:responsibility
44389,article,dougherty_t:2012,,,2012,,Reducing Responsibility: An Evidentialist Account of Epistemic Blame,Reducing Responsibility: An Evidentialist Account of Epistemic Blame,,,,european-journal-of-philosophy,20,4,534--547,534,,,,,,,,,,,,,,,,,,,english,false,,,dougherty_t,,,1:ethics
44390,article,dougherty_t:2012a,,,2012,,Reconsidering the Parent Analogy: Unfinished Business for Skeptical Theists,Reconsidering the Parent Analogy: Unfinished Business for Skeptical Theists,,,,international-journal-for-philosophy-of-religion,72,1,17--25,17,,,,,,,,,,,,,,,,,,,english,false,,,dougherty_t,,,1:religion;2:epistemology_of_religion;3:religious_skepticism
44391,incollection,dougherty_t:2013,,,2013,,Dealing with Disagreement from the First-Person Perspective: A Probabilist Proposal,Dealing with Disagreement from the First-Person Perspective: A Probabilist Proposal,,,,,,,218--238,218,,,,,,,,,,,,,,,,,,,english,false,,,dougherty_t,,,1:rationality;2:disagreement
44392,book,dougherty_t:2014,,,2014,,The Problem of Animal Pain: A Theodicy for all Creatures Great and Small,The Problem of Animal Pain: A Theodicy for all Creatures Great and Small,,,,,,,,,,,London,,,palgrave-macmillan,,,,,,,,,,,,,english,false,,,dougherty_t,,,1:animals;2:animal_ethics
44393,incollection,dougherty_t:2014b,,,2014,,"Phenomenal Conservatism, Skeptical Theism, and Probabilistic Reasoning","Phenomenal Conservatism, Skeptical Theism, and Probabilistic Reasoning",,,,,,,21--31,21,,,,,,,,,,,,,,,,,,,english,false,,,dougherty_t,,,1:perception;2:appearances;3:phenomenal_conservatism
44394,article,dougherty_t:2014c,,,2014,,"Zagzebski, Authority, and Faith [on \citet{zagzebski:2012}]","Zagzebski, Authority, and Faith [on Zagzebski (2012)]",,,,european-journal-for-philosophy-of-religion,6,4,47--59,47,,,,,,,,,,,,,,,,,,,english,false,,,dougherty_t,,,1:epistemology;2:testimony;3:epistemic_authority
44395,incollection,dougherty_t:2014d,,,2014,,The `Ethics of Belief' is Ethics (Period): Reassigning Responsibilism,The ‘Ethics of Belief' is Ethics (Period): Reassigning Responsibilism,,,,,,,146--168,146,,,,,,,,,,,,,,,,,,,english,false,,,dougherty_t,,,2:epistemic_norms;3:norms_of_belief
44396,incollection,dougherty_t:2014e,,,2014,,"Faith, Trust, and Testimony: An Evidentialist Account","Faith, Trust, and Testimony: An Evidentialist Account",,,,,,,97--123,97,,,,,,,,,,,,,,,,,,,english,false,,,dougherty_t,,,1:religion;2:epistemology_of_religion
44397,incollection,dougherty_t:2016,,,2016,,Principles of Inferential Justification,Principles of Inferential Justification,,,,,,,127--143,127,,,,,,,,,,,,,,,,,,,english,false,,,dougherty_t,,,1:epistemology;2:epistemic_internalism_externalism
44398,article,dougherty_t:2016a,,,2016,,Reflections on the Deep Connection Between Problems of Evil and Problems of Divine Hiddenness,Reflections on the Deep Connection Between Problems of Evil and Problems of Divine Hiddenness,,,,european-journal-for-philosophy-of-religion,8,4,65--84,65,,,,,,,,,,,,,,,,,,,english,false,,,dougherty_t,,,1:religion;2:divine_attributes;3:divine_hiddenness
44399,article,dougherty_t:2017,,,2017,,Epistemic Norms [Review of \citet{littlejohn_c-turri:2014}],Epistemic Norms [Review of Littlejohn and Turri (2014)],,,,analysis,77,1,224--232,224,,,,,,,,,,,,,,,,,,,english,false,,,dougherty_t,,,2:epistemic_norms
44400,incollection,dougherty_t:2017a,,,2017,,Pain and the Divine,Pain and the Divine,,,,,,,297--306,297,,,,,,,,,,,,,,,,,,,english,false,,,dougherty_t,,,1:feeling;2:pain
44401,incollection,dougherty_t:2019,,,2019,,There are no Epistemic Virtues,There are no Epistemic Virtues,,,,,,,127--139,127,,,,,,,,,,,,,,,,,,,english,false,,,dougherty_t,,,1:epistemology;2:epistemic_virtues
44402,article,dougherty_t:2019a,,,2019,,Divine Union With and Without the Gospel: A Probabilistic Problem of Pluralism,Divine Union With and Without the Gospel: A Probabilistic Problem of Pluralism,,,,european-journal-for-philosophy-of-religion,11,1,135--143,135,,,,,,,,,,,,,,,,,,,english,false,,,dougherty_t,,,1:religion;2:religious_pluralism
44403,book,dougherty_t:2021,,,2021,,The Scope of Consent,The Scope of Consent,,,,,,,,,,,Oxford,,,oxford-university-press,,,,,,,,,,,10.1093/oso/9780192894793.001.0001,,english,false,,,dougherty_t,,,1:ethics;2:sexual_consent
44404,article,dougherty_to-etal:2015,,,2015,,Expecting the Unexpected [on \citet{paul_la:2015}],Expecting the Unexpected [on Paul (2015)],,,,res-philosophica,92,2,301--321,301,,,,,,,,,,,,,,,,,,,english,false,,,dougherty_to;horowitz_s;sliwa,,,1:persons;2:personal_identity;3:transformative_experience
44405,article,dougherty_to:2013,,,2013,,Agent-Neutral Deontology,Agent-Neutral Deontology,,,,philosophical-studies,163,2,527--537,527,,,,,,,,,,,,,,,,,10.1007/s11098-011-9829-8,,english,false,,,dougherty_to,,,1:ethics
44406,article,dougherty_to:2013a,,,2013,,Rational Numbers: A Non-Consequentialist Explanation of Why You should Save the Many and Not the Few,Rational Numbers: A Non-Consequentialist Explanation of Why You should Save the Many and Not the Few,,,,the-philosophical-quarterly,63,252,413--427,413,,,,,,,,,,,,,,,,,,,english,false,,,dougherty_to,,,1:ethics
44407,article,dougherty_to:2014,,,2014,,Fickle Consent,Fickle Consent,,,,philosophical-studies,167,1,25--40,25,,,,,,,,,,,,,,,,,10.1007/s11098-013-0230-7,,english,false,,,dougherty_to,,,1:representation;2:content
44408,article,dougherty_to:2014a,,,2014,,A Deluxe Money Pump,A Deluxe Money Pump,,,,thought,3,1,21--29,21,,,,,,,,,,,,,,,,,,,english,false,,,dougherty_to,,,1:probability
44409,article,dougherty_to:2015,,,2015,,Future-Bias and Practical Reason,Future-Bias and Practical Reason,,,,philosophers-imprint,15,30,,,,,,,,,,,,,,,,,,http://hdl.handle.net/2027/spo.3521354.0015.030,,http://hdl.handle.net/2027/spo.3521354.0015.030,english,false,,,dougherty_to,,,1:decision_theory
44410,article,dougherty_to:2016,,,2016,,The Burdens of Morality: Why Act-Consequentialism Demands Too Little,The Burdens of Morality: Why Act-Consequentialism Demands Too Little,,,,thought,5,1,82--85,82,,,,,,,,,,,,,,,,,,,english,false,,,dougherty_to,,,1:ethics;2:metaethics;3:ethical_consequentialism
44411,article,dougherty_to:2016a,,,2016,,"Moral Indeterminacy, Normative Powers and Convention","Moral Indeterminacy, Normative Powers and Convention",,,,ratio,29,4,448--465,448,,,,,,,,,,,,,,,,,,,english,false,,,dougherty_to,,,1:ethics
44412,incollection,dougherty_to:2018,,,2018,,Vagueness and Indeterminacy in Ethics,Vagueness and Indeterminacy in Ethics,,,,,,,185--193,185,,,,,,,,,,,,,,,,,,,english,false,,,dougherty_to,,,1:vagueness
44413,incollection,dougherty_to:2018a,,,2018,,Deception and Consent,Deception and Consent,,,,,,,164--173,164,,,,,,,,,,,,,,,,,,,english,false,,,dougherty_to,,,1:political_philosophy;2:authority;3:consent
44414,article,dougherty-rickabaugh:2017,,,2017,,"Natural Theology, Evidence, and Epistemic Humility","Natural Theology, Evidence, and Epistemic Humility",,,,european-journal-for-philosophy-of-religion,9,2,19--42,19,,,,,,,,,,,,,,,,,,,english,false,,,dougherty_t;rickabaugh,,,1:religion;2:theology;3:natural_theology
44415,article,douglas_a:2012,,,2012,,"Reconfiguring the World: Nature, God, and Human Understanding from the Middle Ages to Early Modern Europe","Reconfiguring the World: Nature, God, and Human Understanding from the Middle Ages to Early Modern Europe",,,,british-journal-for-the-history-of-philosophy,20,1,208--211,208,,,,,,,,,,,,,,,,,,,english,false,,,douglas_a,,,1:religion
44416,article,douglas_b:2012,,,2012,,Transsubstantiation: Rethinking by Anglicans?,Transsubstantiation: Rethinking by Anglicans?,,,,new-blackfriars,93,1046,426--445,426,,,,,,,,,,,,,,,,,,,english,false,,,douglas_b,,,1:religion;2:liturgy;3:eucharist
44417,incollection,douglas_c:2008,,,2008,,The Historical Context of Analytical Psychology,The Historical Context of Analytical Psychology,,,,,,,19--38,19,,,,,,,,,,,,,,,,,,,english,false,,,douglas_c,,,1:psychology;2:psychoanalysis
44418,book,douglas_d:1973,,,1973,,Linguistics and Mind,Linguistics and Mind,Linguistics and Mind,Linguistics and Mind,,,,,,,,,Sydney,,,sydney-university-extension-board,,,,,,,,,,,,,english,false,,,douglas_d,,,1:language
44419,article,douglas_g:1998,,,1998,,Why Pains are Not Mental Objects,Why Pains are Not Mental Objects,,,,philosophical-studies,91,2,127--148,127,,,,,,,,,,,,,,,,,10.1023/a:1004280711849,,english,false,,,douglas_g,,,1:feeling;2:pain
44420,article,douglas_h-magnus:2013,,,2013,,State of the Field: Why Novel Prediction Matters,State of the Field: Why Novel Prediction Matters,,,,studies-in-history-and-philosophy-of-science,44,4,580--589,580,,,,,,,,,,,,,,,,,,,english,false,,,douglas_h;magnus_pd,,,1:science;2:confirmation
44421,article,douglas_h:2003,,,2003,,The Moral Responsibilities of Scientists (Tensions between Autonomy and Responsibility),The Moral Responsibilities of Scientists (Tensions between Autonomy and Responsibility),,,,american-philosophical-quarterly,40,1,59--68,59,,,,,,,,,,,,,,,,,,,english,false,,,douglas_h,,,1:science;2:sociology_of_science
44422,book,douglas_h:2009,,,2009,,"Science, Policy, and the Value-Free Ideal","Science, Policy, and the Value-Free Ideal",,,,,,,,,,,"Pittsburgh, Pennsylvania",,,university-of-pittsburgh-press,,,,,,,,,,,,,english,false,,,douglas_h,,,1:science
44423,article,douglas_h:2014,,,2014,,The Moral Terrain of Science,The Moral Terrain of Science,,,,erkenntnis,79,"suppl., 5",961--979,961,,,,,,,,,,,,,,,,,,,english,false,,,douglas_h,,,1:science;2:ethics_of_science
44424,article,douglas_h:2014a,,,2014,,Pure Science and the Problem of Progress,Pure Science and the Problem of Progress,,,,studies-in-history-and-philosophy-of-science,46,,55--63,55,,,,,,,,,,,,,,,,,,,english,false,,,douglas_h,,,1:science;2:scientific_realism;3:scientific_progress
44425,incollection,douglas_h:2015,,,2015,,Values in Social Science,Values in Social Science,,,,,,,162--184,162,,,,,,,,,,,,,,,,,,,english,false,,,douglas_h,,,1:social_philosophy
44426,incollection,douglas_h:2017,,,2017,,Why Inductive Risk Requires Values in Science,Why Inductive Risk Requires Values in Science,,,,,,,81--93,81,,,,,,,,,,,,,,,,,,,english,false,,,douglas_h,,,1:method;2:induction
44427,incollection,douglas_h:2021,,,2021,,The Role of Scientific Expertise in Democracy,The Role of Scientific Expertise in Democracy,,,,,,,435--445,435,,,,,,,,,,,,,,,,,,,english,false,,,douglas_h,,,1:political_philosophy;2:democracy
44428,unpublished,douglas_k:2018,,,2018,,Armstrong's Metaphysics and Philosophy of Mathematics,Armstrong's Metaphysics and Philosophy of Mathematics,,,,,,,,,,,,,,,,,Unpublished manuscript,Unpublished manuscript,,,,,,,,http://www.philosopher-animal.com/papers/armstrong.pdf,english,false,,,douglas_k,,,1:mathematics
44429,article,douglas_m:1990,,,1990,,Risk as a Forensic Resource,Risk as a Forensic Resource,,,,daedalus,119,,1--16,1,,,,,,,,,,,,,,,,,,,english,false,,,douglas_m,,,1:decision_theory;2:risk
44430,incollection,douglas_ro:1995,,,1995,,Stochastically Branching Spacetime Topology,Stochastically Branching Spacetime Topology,,,,,,,173--189,173,,,,,,,,,,,,,,,,,,,english,false,,,douglas_ro,,,1:time;2:direction_of_time
44431,UNKNOWN,douglas_sp:2015,,,2015,,Words and the World: a Critique of Straight Solutions to Kripke's Meaning Scepticism,Words and the World: a Critique of Straight Solutions to Kripke's Meaning Scepticism,,,,,,,,,,,Newcastle,,philosophy_department_university_of_newcastle,,PhD dissertation,,,,,,,,,,,,english,false,,,douglas_sp,,,1:representation;2:meaning_skepticism
44432,article,douglas_t:2013,,,2013,,Human Enhancement and Supra-Personal Moral Status,Human Enhancement and Supra-Personal Moral Status,,,,philosophical-studies,162,3,473--497,473,,,,,,,,,,,,,,,,,10.1007/s11098-011-9778-2,,english,false,,,douglas_t,,,1:ethics
44433,article,douglas_t:2015,,,2015,,Parental Partiality and the Intergenerational Transmission of Advantage,Parental Partiality and the Intergenerational Transmission of Advantage,,,,philosophical-studies,172,10,2735--2756,2735,,,,,,,,,,,,,,,,,10.1007/s11098-015-0442-0,,english,false,,,douglas_t,,,1:political_philosophy
44434,incollection,douglas_to:2016,,,2016,,Taking Drugs to Help Others,Taking Drugs to Help Others,,,,,,,45--47,45,,,,,,,,,,,,,,,,,,,english,false,,,douglas_to,,,1:ethics;2:addiction;3:drugs
44435,incollection,douglass_dh-braginsky:1979,,,1979,,Gravitation-Radiation Experiments,Gravitation-Radiation Experiments,,,,,,,90--137,90,,,,,,,,,,,,,,,,,,,english,false,,,douglass_dh;braginsky,,,1:space_spacetime;2:relativity_theory;3:general_relativity
44436,book,douglass_r:2015,,,2015,,"Rousseau and Hobbes: Nature, Free Will, and the Passions","Rousseau and Hobbes: Nature, Free Will, and the Passions",,,,,,,,,,,Oxford,,,oxford-university-press,,,,,,,,,,,10.1093/acprof:oso/9780198724964.001.0001,,english,false,,,douglass_r,,,1:feeling;2:emotions
44437,incollection,douglass_s:2021,,,2021,,Biblical Hermeneutics,Biblical Hermeneutics,,,,,,,164--176,164,,,,,,,,,,,,,,,,,,,english,false,,,douglass_s,,,1:religion;3:bible
44438,incollection,doull_j:1985,,,1985,,Findlay and Plato,Findlay and Plato,,,,,,,250--262,250,,,,,,,,,,,,,,,,,,,english,false,,,doull_j,,,1:history_of_philosophy
44439,incollection,doull_j:1997,,,1997,,Neoplatonism and the Origin of the Older Modern Philosophy,Neoplatonism and the Origin of the Older Modern Philosophy,,,,,,,486--516,486,,,,,,,,,,,,,,,,,,,english,false,,,doull_j,,,1:history_of_philosophy
44440,incollection,doumas-hummel:2005,,,2005,,"Approaches to Modeling Human Mental Representations: What Works, What Doesn't, and Why","Approaches to Modeling Human Mental Representations: What Works, What Doesn't, and Why",,,,,,,73--91,73,,,,,,,,,,,,,,,,,,,english,false,,,doumas;hummel_je,,,1:representation
44441,incollection,dourley:2009,,,2009,,Tillich in Dialogue with Psychology,Tillich in Dialogue with Psychology,,,,,,,238--253,238,,,,,,,,,,,,,,,,,,,english,false,,,dourley,,,1:religion;2:theology
44442,incollection,dousa:2014,,,2014,,Documentary Languages and the Demarcation of Information Units in Textual Information: The Case of Julius O.~Kaiser's \emph{Systematic Indexing},Documentary Languages and the Demarcation of Information Units in Textual Information: The Case of Julius O. Kaiser's Systematic Indexing,,,,,,,297--324,297,,,,,,,,,,,,,,,,,,,english,false,,,dousa,,,1:information
44443,article,douskos:2013,,,2013,,The Linguistic Argument for Intellectualism,The Linguistic Argument for Intellectualism,,,,synthese,190,12,2325--2340,2325,,,,,,,,,,,,,,,,,,,english,false,,,douskos,,,
44444,article,douskos:2013a,,,2013,,Settling and Bodily Control [on \citet{steward_h:2012}],Settling and Bodily Control [on Steward (2012)],,,,inquiry,56,6,639--652,639,,,,,,,,,,,,,,,,,,,english,false,,,douskos,,,1:political_philosophy;2:liberty
44445,article,douskos:2017,,,2017,,`Learning (Not) To' and Practical Knowledge,‘Learning (Not) To' and Practical Knowledge,,,,grazer-philosophische-studien,94,4,495--523,495,,,,,,,,,,,,,,,,,,,english,false,,,douskos,,,1:knowledge;2:knowing_how
44446,article,douven-cuypers:2009,,,2009,,Fricker on Testimonial Justification,Fricker on Testimonial Justification,,,,studies-in-history-and-philosophy-of-science,40,1,36--44,36,,,,,,,,,,,,,,,,,,,english,false,,,douven;cuypers,,,1:epistemology;2:testimony
44447,article,douven-decock:2010,,,2010,,Identity and Similarity,Identity and Similarity,,,,philosophical-studies,151,1,59--78,59,,,,,,,,,,,,,,,,,10.1007/s11098-009-9415-5,,english,false,,,douven;decock_l,,,1:identity
44448,article,douven-decock:2017,,,2017,,What Verities May Be,What Verities May Be,,,,mind,126,502,385--428,385,,,,,,,,,,,,,,,,,,,english,false,,,douven;decock_l,,,1:truth
44449,article,douven-etal:2010,,,2010,,Probabilist Antirealism,Probabilist Antirealism,,,,pacific-philosophical-quarterly,91,,38--63,38,,,,,,,,,,,,,,,,,,,english,false,,,douven;horsten;romeijn,,,1:metaphysics;2:realism
44450,article,douven-etal:2013,,,2013,,Vagueness: A Conceptual Spaces Approach,Vagueness: A Conceptual Spaces Approach,,,,journal-of-philosophical-logic,42,1,137--160,137,,,,,,,,,,,,,,,,,,,english,false,,,douven;decock_l;dietz_r;egre,,,1:vagueness
44451,article,douven-etal:2023,,,2023,,Moral Bookkeeping,Moral Bookkeeping,,,,ergo,10,15,418--443,418,,,,,,,,,,,,,,,,,10.3998/ergo.4645,,english,false,,,douven;hindriks;wenmackers,,,
44452,incollection,douven-etal:2024,,,2024,,The Experimental Philosophy of Logic and Formal Epistemology: Conditionals,The Experimental Philosophy of Logic and Formal Epistemology: Conditionals,,,,,,,211--236,211,,,,,,,,,,,,,,,,,,,english,false,,,douven;elqayam;krzyzanowska,,,
44453,article,douven-hindriks:2005,,,2005,,Deflating the Correspondence Intuition,Deflating the Correspondence Intuition,,,,dialectica,59,3,315--329,315,,,,,,,,,,,,,,,,,10.1111/j.1746-8361.2005.01015.x,,english,false,,,douven;hindriks,,,1:truth;2:deflationism_about_truth
44454,article,douven-kelp:2011,,,2011,,"Truth Approximation, Social Epistemology, and Opinion Dynamics","Truth Approximation, Social Epistemology, and Opinion Dynamics",,,,erkenntnis,75,2,271--283,271,,,,,,,,,,,,,,,,,,,english,false,,,douven;kelp,,,1:truth;2:approximate_truth
44455,article,douven-kelp:2012,,,2012,,In Defense of the Rational Credibility Account: A Reply to Casalegno,In Defense of the Rational Credibility Account: A Reply to Casalegno,,,,dialectica,66,2,289--297,289,,,,,,,,,,,Paolo Casalegno's Good Points,Paolo Casalegno's Good Points,,,,,10.1111/j.1746-8361.2012.01302.x,,english,false,,,douven;kelp,,paganini_e,1:belief;2:credence
44456,article,douven-kelp:2013,,,2013,,Proper Bootstrapping,Proper Bootstrapping,,,,synthese,190,1,171--185,171,,,,,,,,,,,,,,,,,,,english,false,,,douven;kelp,,,1:epistemology;2:justification;3:bootstrapping
44457,article,douven-olders:2008,,,2008,,Unger's Argument for Skepticism Revisited,Unger's Argument for Skepticism Revisited,,,,theoria,74,3,239--250,239,,,,,,,,,,,,,,,,,,,english,false,,,douven;olders,,,1:skepticism
44458,article,douven-romeijn:2007,,,2007,,The Discursive Dilemma as a Lottery Paradox,The Discursive Dilemma as a Lottery Paradox,,,,economics-and-philosophy,23,3,301--319,301,,,,,,,,,,,,,,,,,,,english,false,,,douven;romeijn,,,1:economics
44459,article,douven-romeijn:2011,,,2011,,A New Resolution of the Judy Benjamin Problem,A New Resolution of the Judy Benjamin Problem,,,,mind,120,479,637--670,637,,,,,,,,,,,,,,,,,,,english,false,,,douven;romeijn,,,1:argumentation;2:paradoxes
44460,article,douven-schupbach:2017,,,2017,,Formal Epistemology,Formal Epistemology,,,,oxford-philosophy-handbooks-online,,,,,,,,,,,,,,,,,,,,,10.1093/oxfordhb/9780199935314.013.19,,english,false,,,douven;schupbach,,,1:epistemology
44461,article,douven-uffink:2012,,,2012,,Quantum Probabilities and the Conjunction Principle,Quantum Probabilities and the Conjunction Principle,,,,synthese,184,1,109--114,109,,,,,,,,,,,,,,,,,,,english,false,,,douven;uffink,,,1:quantum_mechanics
44462,article,douven-vanbrakel:1995,useprefix=true,,1995,,Is Scientific Realism an Empirical Hypothesis?,Is Scientific Realism an Empirical Hypothesis?,,,,dialectica,49,1,3--14,3,,,,,,,,,,,,,,,,,10.1111/j.1746-8361.1995.tb00112.x,,english,false,,,douven;vanbrakel,,,1:metaphysics;2:realism
44463,article,douven-vanbrakel:1998,useprefix=true,,1998,,Can the World Help Us in Fixing the Reference of Natural Kind Terms?,Can the World Help Us in Fixing the Reference of Natural Kind Terms?,,,,journal-for-general-philosophy-of-science-zeitschrift-fur-allgemeine-wissenschaftstheorie,29,1,59--70,59,,,,,,,,,,,,,,,,,,,english,false,,,douven;vanbrakel,,,1:causation;2:natural_kinds
44464,article,douven-williamson:2006,,,2006,,Generalizing the Lottery Paradox,Generalizing the Lottery Paradox,,,,the-british-journal-for-the-philosophy-of-science,57,4,755--779,755,,,,,,,,,,,,,,,,,,,english,false,,,douven;williamson_t,,,1:knowledge;2:reliabilism;3:lottery_paradox
