id,entry_type,bibkey,options,shorthand,date_year,pubstate,title_latex,title_unicode,booktitle_latex,booktitle_unicode,crossref,journal_key,volume,number,pages,start_page,eid,series_key,address,institution_key,school_key,publisher_key,type_field,edition,note_latex,note_unicode,issuetitle_latex,issuetitle_unicode,extra_note_latex,extra_note_unicode,urn,eprint,doi,url,langid,is_translation,epoch,license,author_keys,editor_keys,guesteditor_keys,keyword_keys
43973,incollection,donovan_d:2005,,,2005,,Revelation and Faith,Revelation and Faith,,,,,,,83--97,83,,,,,,,,,,,,,,,,,,,english,false,,,donovan_d,,,1:religion;2:epistemology_of_religion;3:religious_revelation
43974,incollection,donovan_s:2020,,,2020,,Engaging Cities at Home and Abroad: Connecting our Students with Urban Communities: An Interview with Sarah Donovan,Engaging Cities at Home and Abroad: Connecting our Students with Urban Communities: An Interview with Sarah Donovan,,,,,,,423--428,423,,,,,,,,,,,,,,,,,,,english,false,,,donovan_s,,,1:history_of_philosophy
43975,UNKNOWN,donze_b:1993,,,1993,,"``Nihil tam nihil quam divisum ab esse"" : {\'e}tude s{\'e}mantique des termes Nihil et nihilum dans l'oeuvre latine de Maître Eckhart","“Nihil tam nihil quam divisum ab esse"" : étude sémantique des termes Nihil et nihilum dans l'oeuvre latine de Maître Eckhart",,,,,,,,,,,Fribourg,,d_e_partement_de_philosophie_universit_e_de_fribourg,,Travail de licence,,,,,,,,,,,,french,false,,,donze_b,,,
43976,book,doody_ja-etal:2023,,,2023,,Augustine and Time,Augustine and Time,Augustine and Time,Augustine and Time,,,,,,,,,"Lanham, Maryland",,,lexington-books,,,,,,,,,,,,,english,false,,,,doody_ja;hannah_se;paffenroth,,1:time
43977,article,doody_ja:1991,,,1991,,MacIntyre and Habermas on Practical Reason,MacIntyre and Habermas on Practical Reason,,,,american-catholic-philosophical-quarterly,65,2,143--158,143,,,,,,,,,,,,,,,,,,,english,false,,,doody_ja,,,1:rationality;2:practical_rationality
43978,article,doody_r:2019,,,2019,,The Sunk Cost ``Fallacy'' Is Not a Fallacy,The Sunk Cost “Fallacy” Is Not a Fallacy,,,,ergo,6,40,1153--1190,1153,,,,,,,,,,,,,,,,,,,english,false,,,doody_r,,,1:decision_theory
43979,article,doody_r:2019a,,,2019,,Opaque Sweetening and Transitivity,Opaque Sweetening and Transitivity,,,,australasian-journal-of-philosophy,97,3,559--571,559,,,,,,,,,,,,,,,,,,,english,false,,,doody_r,,,
43980,book,dooley_b:2014,,,2014,,A Companion to Astrology in the Renaissance,A Companion to Astrology in the Renaissance,A Companion to Astrology in the Renaissance,A Companion to Astrology in the Renaissance,,,,49,,,,brill_s_companions_to_the_christian_tradition,Leiden,,,ej-brill,,,,,,,,,,,,,english,false,,,,dooley_b,,1:science;2:pseudoscience;3:astrology
43981,incollection,dooley_b:2014a,,,2014,,Introduction,Introduction,,,,,,,1--16,1,,,,,,,,,,,,,,,,,,,english,false,,,dooley_b,,,1:science;2:pseudoscience;3:astrology
43982,incollection,dooley_b:2014b,,,2014,,Astrology and Science,Astrology and Science,,,,,,,233--266,233,,,,,,,,,,,,,,,,,,,english,false,,,dooley_b,,,1:science;2:pseudoscience;3:astrology
43983,incollection,dooley_m:2005,,,2005,,Marion's Ambition of Transcendence,Marion's Ambition of Transcendence,,,,,,,190--199,190,,,,,,,,,,,,,,,,,,,english,false,,,dooley_m,,,1:religion;2:god
43984,incollection,dooley_m:2012,,,2012,,The Plagues of Desecration: Roger Scruton and Richard Rorty on Life After Religion,The Plagues of Desecration: Roger Scruton and Richard Rorty on Life After Religion,,,,,,,312--336,312,,,,,,,,,,,,,,,,,,,english,false,,,dooley_m,,,1:religion;2:atheism
43985,incollection,doolittle:1985,,,1985,,Some Broader Evolutionary Issues Which Emerge from Contemporary Molecular Biological Data,Some Broader Evolutionary Issues Which Emerge from Contemporary Molecular Biological Data,,,,,,,129--144,129,,,,,,,,,,,,,,,,,,,english,false,,,doolittle,,,1:biology
43986,incollection,doomen_j:2007,,,2007,,The Problems of Scepticism,The Problems of Scepticism,,,,,,,36--52,36,,,,,,,,,,,,,,,,,,,english,false,,,doomen_j,,,1:skepticism
43987,incollection,doomen_j:2011,,,2011,,Review of \citet{cottingham:2008},Review of Cottingham (2008),,,,,,,203--209,203,,,,,,,,,,,,,,,,,,,english,false,,,doomen_j,,,1:history_of_philosophy
43988,incollection,doomen_j:2013,,,2013,,Review of \citet{kateb_g:2011},Review of Kateb (2011),,,,,,,380--383,380,,,,,,,,,,,,,,,,,,,english,false,,,doomen_j,,,1:political_philosophy;2:rights;3:human_dignity
43989,incollection,doomen_j:2015,,,2015,,Review of \citet{aho_k:2014},Review of Aho (2014),,,,,,,269,269,,,,,,,,,,,,,,,,,,,english,false,,,doomen_j,,,1:metaphysics;2:existentialism
43990,article,doore:1981,,,1981,,Functionalism and Absent Qualia,Functionalism and Absent Qualia,,,,australasian-journal-of-philosophy,59,4,387--402,387,,,,,,,,,,,,,,,,,,,english,false,,,doore,,,2:functionalism;3:functionalism_in_the_philosophy_of_mind
43991,article,doore:1985,,,1985,,Contradiction in the Will,Contradiction in the Will,,,,kant-studien,76,2,138--151,138,,,,,,,,,,,,,,,,,,,english,false,,,doore,,,1:action;2:akrasia
43992,book,doorman_sj:1989,,,1989,,Images of Science,Images of Science,Images of Science,Images of Science,,,,,,,,,Southampton,,,gower-publishing-company,,,,,,,,,,,,,english,false,,,,doorman_sj,,1:science
43993,incollection,doorn_n-etal:2021,,,2021,,Reimagining the Future of Engineering,Reimagining the Future of Engineering,,,,,,,736--744,736,,,,,,,,,,,,,,,,,,,english,false,,,doorn_n;michelfelder_d;barrella;bristol_t;dechesne_f;fritzsche_a;johnson_ge;poznic;robison_wl;sain_b;stone_ta;rodrigueznikl;umbrello_s;vermaas;wilson_ril,,,1:science;2:technology;3:engineering
43994,incollection,doorn_n:2016,,,2016,,Reasoning about Uncertainty in Flood Risk Governance,Reasoning about Uncertainty in Flood Risk Governance,,,,,,,245--264,245,,,,,,,,,,,,,,,,,,,english,false,,,doorn_n,,,1:argumentation
43995,incollection,doorn_n:2021,,,2021,,The Role of Resilience in Engineering,The Role of Resilience in Engineering,,,,,,,482--493,482,,,,,,,,,,,,,,,,,,,english,false,,,doorn_n,,,1:science;2:technology;3:engineering
43996,article,dopp:1956,,,1956,,Les vari{\'e}t{\'e}s syntaxiques de la d{\'e}finition dans les langages rigoureux,Les variétés syntaxiques de la définition dans les langages rigoureux,,,,les-etudes-philosophiques,11,2,209--225,209,,,,,,,,,,,,,,,,,,,french,false,,,dopp,,,1:explanation;2:definition
43997,article,dopp:1960,,,1960,,Essai d'une pr{\'e}sentation de la logique combinatoire,Essai d'une présentation de la logique combinatoire,,,,logique-et-analyse-ns,3,11/12,183--201,183,,,,,,,,,,,,,,,,,,,french,false,,,dopp,,,1:logic;2:combinatory_logic
43998,book,dopp:1962,,,1962,,Logiques construites par une m{\'e}thode de d{\'e}duction naturelle,Logiques construites par une méthode de déduction naturelle,,,,,,,,,,,Louvain la Neuve,,,e-nauwelaerts,,,,,,,,,,,,,french,false,,,dopp,,,1:logic;2:natural_deduction
43999,book,dopp:1965,,,1965,,Notions de logique formelle,Notions de logique formelle,,,,,,,,,,,Louvain la Neuve,,,presses-universitaires-de-louvain,,,,,,,,,,,,,french,false,,,dopp,,,1:structuralism;2:relations
44000,article,doppelt:1977,,,1977,,"Incorrigibility, the Mental, and Materialism","Incorrigibility, the Mental, and Materialism",,,,philosophy-research-archives,3,2,,,,,,,,,,,,,,,,,,,,,english,false,,,doppelt,,,1:mind_body;2:physicalism
44001,article,doppelt:1979,,,1979,,The Austin-Malcolm Argument for the Incorrigibility of Perceptual Reports,The Austin-Malcolm Argument for the Incorrigibility of Perceptual Reports,,,,dialectica,33,1,59--76,59,,,,,,,,,"with an Erratum published in \emph{Dialectica}, 33(2), p. 153","with an Erratum published in Dialectica, 33(2), p. 153",,,,,,,10.1111/j.1746-8361.1979.tb01520.x,,english,false,,,doppelt,,,1:perception
44002,article,doppelt:1985,,,1985,,Modernity and Conflict.~Kommentar zu \citet{macintyre_ac:1984c},Modernity and Conflict. Kommentar zu MacIntyre (1984),,,,analyse-kritik,7,2,206--233,206,,,,,,,,,,,,,,,,,,,english,false,,,doppelt,,,1:political_philosophy;2:marxism
44003,article,doppelt:1989,,,1989,,Is Rawls's Kantian Liberalism Coherent and Defensible?,Is Rawls's Kantian Liberalism Coherent and Defensible?,,,,ethics,99,4,815--851,815,,,,,,,,,,,,,,,,,,,english,false,,,doppelt,,,1:political_philosophy;2:liberalism
44004,article,doppelt:2001,,,2001,,Does the Extension of Democratic Decision-making Imply Social Justice?,Does the Extension of Democratic Decision-making Imply Social Justice?,,,,inquiry,44,3,359--383,359,,,,,,,,,,,,,,,,,,,english,false,,,doppelt,,,1:political_philosophy;2:democracy
44005,incollection,doppelt:2001a,,,2001,,Incommensurability and the Normative Foundations of Scientific Knowledge,Incommensurability and the Normative Foundations of Scientific Knowledge,,,,,,,159--180,159,,,,,,,,,,,,,,,,,,,english,false,,,doppelt,,,1:science;2:theory_change
44006,article,doppelt:2003,,,2003,,The Theory of Justice from a Hermeneutic Perspective,The Theory of Justice from a Hermeneutic Perspective,,,,inquiry,46,4,449--472,449,,,,,,,,,,,,,,,,,,,english,false,,,doppelt,,,1:political_philosophy
44007,incollection,doppelt:2008,,,2008,,Values in Science,Values in Science,,,,,,,302--314,302,,,,,,,,,,,,,,,,,,,english,false,,,doppelt,,,1:science
44008,article,doppelt:2009,,,2009,,The Place of Self-Respect in a Theory of Justice,The Place of Self-Respect in a Theory of Justice,,,,inquiry,52,2,127--154,127,,,,,,,,,,,,,,,,,,,english,false,,,doppelt,,,1:political_philosophy;2:justice
44009,article,doppelt:2011,,,2011,,From Standard Scientific Realism and Structural Realism to Best Current Theory Realism,From Standard Scientific Realism and Structural Realism to Best Current Theory Realism,,,,journal-for-general-philosophy-of-science-zeitschrift-fur-allgemeine-wissenschaftstheorie,42,2,295--316,295,,,,,,,,,,,,,,,,,,,english,false,,,doppelt,,,1:science;2:scientific_realism
44010,book,doran_p:2017,,,2017,,"A Political Economy of Attention, Mindfulness and Consumerism: Reclaiming the Mindful Commons","A Political Economy of Attention, Mindfulness and Consumerism: Reclaiming the Mindful Commons",,,,,,,,,,,London,,,routledge,,,,,,,,,,,,,english,false,,,doran_p,,,1:political_philosophy
44011,book,doran_r:2015,,,2015,,The Theory of the Sublime from Longinus to Kant,The Theory of the Sublime from Longinus to Kant,,,,,,,,,,,Cambridge,,,cambridge-university-press,,,,,,,,,,,10.1017/cbo9781316182017,,english,false,,,doran_r,,,1:aesthetics;2:aesthetic_experience;3:the_sublime
44012,incollection,doran_r:2018,,,2018,,Kant and the Theory of the Sublime.~A Response to Paul Guyer,Kant and the Theory of the Sublime. A Response to Paul Guyer,,,,,,,2961--2968,2961,,,,,,,,,,,,,,,,,,,english,false,,,doran_r,,,1:aesthetics;2:aesthetic_experience;3:the_sublime
44013,article,doran_rp:2022,,,2022,,Ugliness is in the Gut of the Beholder,Ugliness is in the Gut of the Beholder,,,,ergo,9,5,88--146,88,,,,,,,,,,,,,,,,,10.3998/ergo.2261,,english,false,,,doran_rp,,,2:aesthetic_value;3:ugliness
44014,incollection,dorandi_t:1990,,,1990,,Filodemo: gli orientamenti della ricerca attuale,Filodemo: gli orientamenti della ricerca attuale,,,,,,,2328--2368,2328,,,,,,,,,,,,,,,,,,,italian,false,,,dorandi_t,,,1:history_of_philosophy
44015,incollection,dorandi_t:1990a,,,1990,,Filodemo storico del pensiero antico,Filodemo storico del pensiero antico,,,,,,,2407--2423,2407,,,,,,,,,,,,,,,,,,,italian,false,,,dorandi_t,,,1:history_of_philosophy
44016,incollection,dorandi_t:1992,,,1992,,II quarto libro delle `Vite' di Diogene Laerzio: l'Accademia da Speusippo a Clitomaco,II quarto libro delle ‘Vite' di Diogene Laerzio: l'Accademia da Speusippo a Clitomaco,,,,,,,3761--3792,3761,,,,,,,,,,,,,,,,,,,italian,false,,,dorandi_t,,,1:history_of_philosophy
44017,book,dorandi_t:1994,,,1994,,"Filodemo, storia dei filosofi","Filodemo, storia dei filosofi",,,,,,60,,,,philosophia_antiqua,Leiden,,,ej-brill,,,,,,,,,,,,,italian,false,,,dorandi_t,,,1:history_of_philosophy
44018,incollection,dorandi_t:1996,,,1996,,Ricerche sulla trasmissione delle \emph{Divisioni Aristoteliche},Ricerche sulla trasmissione delle Divisioni Aristoteliche,,,,,,,145--167,145,,,,,,,,,,,,,,,,,,,italian,false,,,dorandi_t,,,1:history_of_philosophy
44019,incollection,dorandi_t:1997,,,1997,,Gli \emph{Academica} quale fonte per la storia dell'Academia,Gli Academica quale fonte per la storia dell'Academia,,,,,,,89--106,89,,,,,,,,,,,,,,,,,,,italian,false,,,dorandi_t,,,1:history_of_philosophy
44020,incollection,dorandi_t:1999,,,1999,,Chronology,Chronology,,,,,,,31--54,31,,,,,,,,,,,,,,,,,,,english,false,,,dorandi_t,,,1:history_of_philosophy
44021,incollection,dorandi_t:1999a,,,1999,,Organization and Structure of the Philosophical Schools,Organization and Structure of the Philosophical Schools,,,,,,,55--64,55,,,,,,,,,,,,,,,,,,,english,false,,,dorandi_t,,,1:history_of_philosophy
44022,article,dorato-cei:2012,,,2012,,Preface: Bridging a Gulf (\dots or Perhaps Two!),Preface: Bridging a Gulf (…or Perhaps Two!),,,,european-journal-of-analytic-philosophy,8,1,4--13,4,,,,,,,,,,,,,,,,,,,english,false,,,dorato;cei,,,1:science
44023,incollection,dorato-esfeld:2016,,,2016,,The Metaphysics of Laws: Dispositionalism vs.~Primitivism,The Metaphysics of Laws: Dispositionalism vs. Primitivism,,,,,,,403--424,403,,,,,,,,,,,,,,,,,,,english,false,,,dorato;esfeld,,,1:causation;2:laws_of_nature;3:necessitarianism_about_laws
44024,incollection,dorato-felline:2011,,,2011,,Scientific Explanation and Scientific Structuralism,Scientific Explanation and Scientific Structuralism,,,,,,,161--176,161,,,,,,,,,,,,,,,,,,,english,false,,,dorato;felline_l,,,1:structuralism;2:structuralism_in_the_sciences;3:structuralism_in_physics
44025,incollection,dorato-laudisa:2014,,,2014,,Realism and Instrumentalism about the Wave Function: How should we Choose?,Realism and Instrumentalism about the Wave Function: How should we Choose?,,,,,,,119--134,119,,,,,,,,,,,,,,,,,,,english,false,,,dorato;laudisa,,,1:metaphysics;2:generalism;3:wave_function_realism
44026,article,dorato-morganti:2013,,,2013,,Grades of Individuality.~A Pluralistic View of Identity in Quantum Mechanics and in the Sciences,Grades of Individuality. A Pluralistic View of Identity in Quantum Mechanics and in the Sciences,,,,philosophical-studies,163,3,591--610,591,,,,,,,,,,,,,,,,,10.1007/s11098-011-9833-z,,english,false,,,dorato;morganti,,,1:structuralism;2:structuralism_in_the_sciences;3:structuralism_in_physics
44027,incollection,dorato-pauri:2006,,,2006,,Holism and Structuralism in Classical and Quantum General Relativity,Holism and Structuralism in Classical and Quantum General Relativity,,,,,,,121--151,121,,,,,,,,,,,,,,,,,,,english,false,,,dorato;pauri,,,1:structuralism;2:structuralism_in_the_sciences;3:structuralism_in_physics
44028,article,dorato:1988,,,1988,,The World of the Worms and the Quest for Reality,The World of the Worms and the Quest for Reality,,,,dialectica,42,3,171--182,171,,,,,,,,,,,,,,,,,10.1111/j.1746-8361.1988.tb00913.x,,english,false,,,dorato,,,1:science
44029,book,dorato:1995,,,1995,,Time and Reality: Spacetime Physics and the Objectivity of Temporal Becoming,Time and Reality: Spacetime Physics and the Objectivity of Temporal Becoming,,,,,,,,,,,Bologna,,,cooperativa-libraria-universitaria-editrice-clueb,,,,,,,,,,,,,english,false,,,dorato,,,1:space_spacetime
44030,incollection,dorato:1997,,,1997,,Three Views on the Relationship Between Time and Reality,Three Views on the Relationship Between Time and Reality,,,,,,,61--92,61,,,,,,,,,,,,,,,,,,,english,false,,,dorato,,,1:time;2:ontology_of_time
44031,article,dorato:1998,,,1998,,The Question of the Reality of Time and the Model-Theoretic Approach to Scientific Theories,The Question of the Reality of Time and the Model-Theoretic Approach to Scientific Theories,,,,logique-et-analyse,41,164,313--325,313,,,,,,,,,,,,,,,,,,,english,false,,,dorato,,,1:time
44032,article,dorato:1999,,,1999,,Cao on Substantivalism and the Development of 20th Century Field Theories [review of \citet{cao_ty:1997}],Cao on Substantivalism and the Development of 20th Century Field Theories [review of Cao (1997)],,,,epistemologia-an-international-review-for-the-philosophy-of-science,22,,151--166,151,,,,,,,,,,,,,,,,,,,english,false,,,dorato,,,1:space_spacetime
44033,incollection,dorato:1999a,,,1999,,"Time, Relativity, and the Spatiality of Mental Events","Time, Relativity, and the Spatiality of Mental Events",,,,,,,197--208,197,,,,,,,,,,,,,,,,,,,english,false,,,dorato,,,1:mind_body;2:physicalism
44034,incollection,dorato:1999b,,,1999,,The Conflict between the Static and the Dynamic Theory of Time in its Relation to von Wright's Work and to Human Freedom,The Conflict between the Static and the Dynamic Theory of Time in its Relation to von Wright's Work and to Human Freedom,,,,,,,131--138,131,,,,,,,,,,,,,,,,,,,english,false,,,dorato,,,1:time
44035,article,dorato:2000,,,2000,,Becoming and the Arrow of Causation,Becoming and the Arrow of Causation,,,,philosophy-of-science,67,suppl.,S523--S534,,,,,,,,,,,,"{PSA} 1998: Proceedings of the 1998 Biennial Meetings of the Philosophy of Science Association, Part {II}: Symposium Papers","PSA 1998: Proceedings of the 1998 Biennial Meetings of the Philosophy of Science Association, Part II: Symposium Papers",,,,,,,english,false,,,dorato,,,1:causation;2:direction_of_causation
44036,article,dorato:2000a,,,2000,,"Substantivalism, Relationism, and Structural Spacetime Realism","Substantivalism, Relationism, and Structural Spacetime Realism",,,,foundations-of-physics,30,10,1605--1628,1605,,,,,,,,,,,,,,,,,,,english,false,,,dorato,,,1:space_spacetime;2:absolute_vs_relational
44037,incollection,dorato:2000b,,,2000,,"Facts, Events, Things and the Ontology of Physics","Facts, Events, Things and the Ontology of Physics",,,,,,,343--364,343,,,,,,,,,,,,,,,,,,,english,false,,,dorato,,,1:ontology;2:events
44038,incollection,dorato:2000c,,,2000,,"Measurability, Computability and the Existence of Theoretical Entities","Measurability, Computability and the Existence of Theoretical Entities",,,,,,,207--218,207,,,,,,,,,,,,,,,,,,,english,false,,,dorato,,,1:ontology;2:abstract_objects
44039,incollection,dorato:2002,,,2002,,"On Becoming, Cosmic Time and Rotating Universes","On Becoming, Cosmic Time and Rotating Universes",,,,,,,253--276,253,,,,,,,,,,,,,,,,,,,english,false,,,dorato,,,1:time;2:becoming
44040,incollection,dorato:2002a,,,2002,,"Kant, G{\""o}del and Relativity","Kant, Gödel and Relativity",,,,,,,331--348,331,,,,,,,,,,,,,,,,,,,english,false,,,dorato,,,1:space_spacetime;2:relativity_theory
44041,article,dorato:2003,,,2003,,Review of \citet{craig_wl:2001},Review of Craig (2001),,,,studies-in-history-and-philosophy-of-science-part-b-studies-in-history-and-philosophy-of-modern-physics,34,1,154--158,154,,,,,,,,,,,,,,,,,,,english,false,,,dorato,,,1:time
44042,book,dorato:2005,,,2005,,The Software of the Universe: An Introduction to the History and Philosophy of Laws of Nature,The Software of the Universe: An Introduction to the History and Philosophy of Laws of Nature,,,,,,,,,,,"Farnham, Surrey",,,ashgate,,,,,,,,,,,,,english,false,,,dorato,,,1:causation;2:laws_of_nature
44043,incollection,dorato:2005a,,,2005,,Why are (Most) Laws of Nature Mathematical?,Why are (Most) Laws of Nature Mathematical?,,,,,,,55--76,55,,,,,,,,,,,,,,,,,,,english,false,,,dorato,,,1:causation;2:laws_of_nature
44044,incollection,dorato:2006,,,2006,,The Irrelevance of the Presentist/Eternalist Debate for the Ontology of Minkowski Spacetime,The Irrelevance of the Presentist/Eternalist Debate for the Ontology of Minkowski Spacetime,,,,,,,93--109,93,,,,,,,,,,,,,,,,,,,english,false,,,dorato,,,1:space_spacetime
44045,article,dorato:2006a,,,2006,,"Absolute Becoming, Relational Becoming and the Arrow of Time.~Some Non Conventional Remarks on the Connection between Physics and Metaphysics","Absolute Becoming, Relational Becoming and the Arrow of Time. Some Non Conventional Remarks on the Connection between Physics and Metaphysics",,,,studies-in-history-and-philosophy-of-science-part-b-studies-in-history-and-philosophy-of-modern-physics,37,3,559--576,559,,,,,,,,,,,,,,,,,,,english,false,,,dorato,,,1:time;2:direction_of_time
44046,incollection,dorato:2007,,,2007,,"Dispositions, Relational Properties and the Quantum World","Dispositions, Relational Properties and the Quantum World",,,,,,,249--270,249,,,,,,,,,,,,,,,,,,,english,false,,,dorato,,,1:properties;2:dispositions
44047,article,dorato:2007a,,,2007,,Tempo della mente e tempo della materia.~La natura del presente e la teoria della relativit{\`a},Tempo della mente e tempo della materia. La natura del presente e la teoria della relatività,,,,quaestio-annuario-di-storia-della-metafisica,7,,489--503,489,,,,,,,,,,,,,,,,,,,italian,false,,,dorato,,,1:ontology;2:matter
44048,incollection,dorato:2008,,,2008,,Is Structural Realism Relationism in Disguise? The Supererogatory Nature of the Substantivalism/Relationism Debate,Is Structural Realism Relationism in Disguise? The Supererogatory Nature of the Substantivalism/Relationism Debate,,,,,,,17--37,17,,,,,,,,,,,,,,,,,,,english,false,,,dorato,,,1:space_spacetime;2:absolute_vs_relational
44049,article,dorato:2008a,,,2008,,Putnam on Time and Special Relativity: A Long Journal from Ontology to Ethics,Putnam on Time and Special Relativity: A Long Journal from Ontology to Ethics,,,,european-journal-of-analytic-philosophy,4,2,51--70,51,,,,,,,,,,,,,,,,,,,english,false,,,dorato,,,1:space_spacetime;2:relativity_theory;3:special_relativity
44050,incollection,dorato:2010,,,2010,,On Various Senses of ``Conventional'' and Their Interrelation in the Philosophy of Physics: Simultaneity as a Case Study,On Various Senses of “Conventional” and Their Interrelation in the Philosophy of Physics: Simultaneity as a Case Study,,,,,,,335--349,335,,,,,,,,,,,,,,,,,,,english,false,,,dorato,,,1:physics
44051,incollection,dorato:2011,,,2011,,The Alexandroff Present and Minkowski Spacetime: Why it Cannot Do What it has Been Asked to Do,The Alexandroff Present and Minkowski Spacetime: Why it Cannot Do What it has Been Asked to Do,,,,,,,379--394,379,,,,,,,,,,,,,,,,,,,english,false,,,dorato,,,1:time;2:the_present
44052,incollection,dorato:2011a,,,2011,,Do Dispositions and Propensities Have a Role in the Ontology of Quantum Mechanics? Some Critical Remarks,Do Dispositions and Propensities Have a Role in the Ontology of Quantum Mechanics? Some Critical Remarks,,,,,,,197--220,197,,,,,,,,,,,,,,,,,,,english,false,,,dorato,,,1:properties;2:powers;3:propensities
44053,incollection,dorato:2012,,,2012,,Mathematical Biology and the Existence of Biological Laws,Mathematical Biology and the Existence of Biological Laws,,,,,,,109--122,109,,,,,,,,,,,,,,,,,,,english,false,,,dorato,,,1:biology
44054,article,dorato:2015,,,2015,,Events and the Ontology of Quantum Mechanics,Events and the Ontology of Quantum Mechanics,,,,topoi,34,2,369--378,369,,,,,,,,,,,,,,,,,,,english,false,,,dorato,,,1:quantum_mechanics
44055,article,dorato:2015a,,,2015,,Laws of Nature and the Reality of the Wave Function,Laws of Nature and the Reality of the Wave Function,,,,synthese,192,10,3179--3201,3179,,,,,,,,,,,,,,,,,,,english,false,,,dorato,,,1:metaphysics;2:generalism;3:wave_function_realism
44056,incollection,dorato:2016,,,2016,,"Rovelli's Relational Quantum Mechanics, Anti-Monism, and Quantum Becoming","Rovelli's Relational Quantum Mechanics, Anti-Monism, and Quantum Becoming",,,,,,,235--262,235,,,,,,,,,,,,,,,,,,,english,false,,,dorato,,,1:structuralism;2:relations
44057,article,dorato:2017,,,2017,,Dynamical versus Structural Explanations in Scientific Revolutions,Dynamical versus Structural Explanations in Scientific Revolutions,,,,synthese,194,7,2307--2327,2307,,,,,,,,,,,,,,,,,,,english,false,,,dorato,,,1:structuralism
44058,article,dorber-plesse:1968,,,1968,,"Zur philosophischen und politischen Position des von Ernst Haeckel begr{\""u}ndeten Monismus",Zur philosophischen und politischen Position des von Ernst Haeckel begründeten Monismus,,,,deutsche-zeitschrift-fur-philosophie,16,11,1325--1339,1325,,,,,,,,,,,,,,,,,,,ngerman,false,,,dorber;plesse_w,,,1:complexity;2:monism;3:compositional_monism
44059,article,dorchain_c:2017,,,2017,,"St{\""u}rmische Zeiten f{\""u}r die Liebe: Emily Bront{\""e}, ``Wuthering Heights'' und das philosophische Konzept des B{\""o}sen","Stürmische Zeiten für die Liebe: Emily Brontë, “Wuthering Heights” und das philosophische Konzept des Bösen",,,,philosophie-ch,,,,,,,,,,,,,,,,,,,,,,https://www.philosophie.ch/2017-09-29-dorchain,ngerman,false,,,dorchain_c,,,
44060,article,dorchain_c:2018,,,2018,,"In Liebe, Dionysos","In Liebe, Dionysos",,,,philosophie-ch,,,,,,,,,,,,,,,,,,,,,,https://www.philosophie.ch/2018-03-13-dorchain,ngerman,false,,,dorchain_c,,,
44061,article,dordan:1992,,,1992,,Mathematical Problems Arising in Qualitative Simulation of a Differential Equation,Mathematical Problems Arising in Qualitative Simulation of a Differential Equation,,,,artificial-intelligence,55,1,61--86,61,,,,,,,,,,,,,,,,,,,english,false,,,dordan,,,1:mathematics
44062,UNKNOWN,dordolo_s:2024,,,2024,,Les Intelligences Artificielles peuvent-elles ressentir ?,Les Intelligences Artificielles peuvent-elles ressentir ?,,,,,,,,,,,Lausanne,,d_e_partement_de_philosophie_universit_e_de_lausanne,,M{\'e}moire de licence,,,,,,,,,,,https://iris.unil.ch/handle/iris/60933,french,false,,,dordolo_s,,,
44063,article,dore_c:1962,,,1962,,On the Meaning of `Could Have',On the Meaning of ‘Could Have',,,,analysis,23,,41--43,41,,,,,,,,,,,,,,,,,,,english,false,,,dore_c,,,1:determinism;2:frankfurtology
44064,article,dore_c:1963,,,1963,,More on the Meaning of `Could Have',More on the Meaning of ‘Could Have',,,,analysis,24,,41--43,41,,,,,,,,,,,,,,,,,,,english,false,,,dore_c,,,1:determinism;2:frankfurtology
44065,article,dore_c:1963a,,,1963,,Is Free Will Compatible with Determinism?,Is Free Will Compatible with Determinism?,,,,the-philosophical-review,72,,500--501,500,,,,,,,,,,,,,,,,,,,english,false,,,dore_c,,,1:determinism;2:free_will
