id,entry_type,bibkey,options,shorthand,date_year,pubstate,title_latex,title_unicode,booktitle_latex,booktitle_unicode,crossref,journal_key,volume,number,pages,start_page,eid,series_key,address,institution_key,school_key,publisher_key,type_field,edition,note_latex,note_unicode,issuetitle_latex,issuetitle_unicode,extra_note_latex,extra_note_unicode,urn,eprint,doi,url,langid,is_translation,epoch,license,author_keys,editor_keys,guesteditor_keys,keyword_keys
46941,book,eccles:1966,,,1966,,Brain and Conscious Experience,Brain and Conscious Experience,Brain and Conscious Experience,Brain and Conscious Experience,,,,,,,,,Berlin,,,springer,,,,,,,,,,,,,english,false,,,,eccles_jc,,2:consciousness
46942,article,eccles:1972,,,1972,,Unconscious Actions Emanating From the Human Cerebral Cortex [on \citet{weitz:1972}],Unconscious Actions Emanating From the Human Cerebral Cortex [on Weitz (1972)],,,,philosophic-exchange,3,,249--252,249,,,,,,,,,,,,,,,,http://hdl.handle.net/20.500.12648/3190,,http://hdl.handle.net/20.500.12648/3190,english,false,,,eccles_jc,,,1:action
46943,incollection,eccles:1976,,,1976,,Brain and Free Will,Brain and Free Will,,,,,,,101--122,101,,,,,,,,,,,,,,,,,,,english,false,,,eccles_jc,,,1:mind_body;2:physicalism
46944,incollection,eccles:1976a,,,1976,,How Dogmatic Can Materialism Be? [response to \citet{savage_cw:1976}],How Dogmatic Can Materialism Be? [response to Savage (1976)],,,,,,,155--160,155,,,,,,,,,,,,,,,,,,,english,false,,,eccles_jc,,,1:mind_body;2:physicalism
46945,book,eccles:1979,,,1979,,"The Human Mystery.~The Gifford Lectures 1977-78, University of Edinburgh","The Human Mystery. The Gifford Lectures 1977-78, University of Edinburgh",,,,,,,,,,,Berlin,,,springer,,,,,,,,,,,,,english,false,,,eccles_jc,,,1:psychology;2:neuroscience
46946,book,eccles:1982,,,1982,,Mind and Brain.~Selected Readings from the Proceedings of the International Conference on the Unity of the Sciences,Mind and Brain. Selected Readings from the Proceedings of the International Conference on the Unity of the Sciences,Mind and Brain.~Selected Readings from the Proceedings of the International Conference on the Unity of the Sciences,Mind and Brain. Selected Readings from the Proceedings of the International Conference on the Unity of the Sciences,,,,,,,,,"Washington, D.C.",,,paragon-house,,,,,,,,,,,,,english,false,,,,eccles_jc,,1:mind_body
46947,book,eccles:1982a,,,1982,,"Das R{\""a}tsel Mensch",Das Rätsel Mensch,,,,,,,,,,,"M{\""u}nchen",,,piper-verlag,,,"{\""U}bersetzung von \citet{eccles:1979} durch Karin Ferreira",Übersetzung von Eccles (1979) durch Karin Ferreira,,,,,,,,,ngerman,true,,,eccles_jc,,,1:psychology;2:neuroscience
46948,article,eccles:1982b,,,1982,,Animal Consciousness and Human Self-Consciousness,Animal Consciousness and Human Self-Consciousness,,,,experientia,38,,1384--1391,1384,,,,,,,,,,,,,,,,,,,english,false,,,eccles_jc,,,1:animals;2:animal_cognition
46949,incollection,eccles:1982c,,,1982,,Introduction,Introduction,,,,,,,xi,11,,,,,,,,,,,,,,,,,,,english,false,,,eccles_jc,,,1:mind_body
46950,incollection,eccles:1982d,,,1982,,Critical Appraisal of Mind-Brain Theories,Critical Appraisal of Mind-Brain Theories,,,,,,,51--58,51,,,,,,,,,,,,,,,,,,,english,false,,,eccles_jc,,,1:mind_body
46951,incollection,eccles:1982e,,,1982,,Human Brain and the Human Person,Human Brain and the Human Person,,,,,,,85--102,85,,,,,,,,,,,,,,,,,,,english,false,,,eccles_jc,,,1:persons
46952,incollection,eccles:1982f,,,1982,,Cerebral Activity and the Freedom of the Will,Cerebral Activity and the Freedom of the Will,,,,,,,159--184,159,,,,,,,,,,,,,,,,,,,english,false,,,eccles_jc,,,1:determinism
46953,incollection,eccles:1982g,,,1982,,Culture: the Creation of Man and the Creator of Man,Culture: the Creation of Man and the Creator of Man,,,,,,,257--270,257,,,,,,,,,,,,,,,,,,,english,false,,,eccles_jc,,,1:social_philosophy
46954,incollection,eccles:1982h,,,1982,,Natural Theological Speculations of Death and the Meaning of Life,Natural Theological Speculations of Death and the Meaning of Life,,,,,,,335--338,335,,,,,,,,,,,,,,,,,,,english,false,,,eccles_jc,,,1:time;2:death
46955,book,eccles:1985,,,1985,,The Brain and the Unity of Conscious Experience,The Brain and the Unity of Conscious Experience,,,,,,,,,,,Cambridge,,,cambridge-university-press,,,,,,,,,,,,,english,false,,,eccles_jc,,,1:psychology;2:neuroscience
46956,article,eccles:1986,,,1986,,Do Mental Events Cause Neural Events Analogously to the Probability Fields of Quantum Mechanics?,Do Mental Events Cause Neural Events Analogously to the Probability Fields of Quantum Mechanics?,,,,proceedings-of-the-royal-society-of-london-series-b-biological-sciences,227,,411--428,411,,,,,,,,,,,,,,,,,,,english,false,,,eccles_jc,,,1:mind_body;2:mental_causation
46957,incollection,eccles:1987,,,1987,,The Effect of Silent Thinking on the Cerebral Cortex,The Effect of Silent Thinking on the Cerebral Cortex,,,,,,,,,,,,,,,,,,,,,,,,,,,english,false,,,eccles_jc,,,1:psychology;2:neuroscience
46958,article,eccles:1992,,,1992,,Evolution of Consciousness,Evolution of Consciousness,,,,proceedings-of-the-national-academy-of-sciences-of-the-usa,89,,7320--7324,7320,,,,,,,,,,,,,,,,,,,english,false,,,eccles_jc,,,2:consciousness
46959,article,echarri:1952,,,1952,,Exp{\'e}rience et th{\'e}orie.~Niveaux d'exp{\'e}rience,Expérience et théorie. Niveaux d'expérience,,,,dialectica,6,24,291--304,291,,,,,,,,,,,,,,,,,10.1111/j.1746-8361.1952.tb01089.x,,french,false,,,echarri,,,1:science;2:experimentation
46960,article,echarri:1970,,,1970,,Metodolog{\'{\i}}a abierta y fenomenolog{\'{\i}}a abierta,Metodología abierta y fenomenología abierta,,,,dialectica,24,1--3,41--52,41,,,,,,,,,,,,,,,,,10.1111/j.1746-8361.1970.tb01202.x,,spanish,false,,,echarri,,,1:method;2:dialectic
46961,article,echelbarger:1981,,,1981,,An Alleged Legend,An Alleged Legend,,,,philosophical-studies,39,3,227--245,227,,,,,,,,,,,,,,,,,10.1007/bf00354355,,english,false,,,echelbarger,,,
46962,incollection,echelbarger:1997,,,1997,,Hume and the Logicians,Hume and the Logicians,,,,,,,137--152,137,,,,,,,,,,,,,,,,,,,english,false,,,echelbarger,,,1:history_of_philosophy
46963,book,echeverri_m-soriano:2023,,,2023,,The Cambridge Companion to Latin American Independence,The Cambridge Companion to Latin American Independence,The Cambridge Companion to Latin American Independence,The Cambridge Companion to Latin American Independence,,,,,,,,cambridge_companions_to_history,Cambridge,,,cambridge-university-press,,,,,,,,,,,10.1017/9781108679336,,english,false,,,,echeverri_m;soriano,,
46964,article,echeverri_s:2011,,,2011,,McDowell's Conceptualist Therapy for Skepticism,McDowell's Conceptualist Therapy for Skepticism,,,,european-journal-of-philosophy,19,3,357--386,357,,,,,,,,,,,,,,,,,,,english,false,,,echeverri_s,,,1:skepticism
46965,article,echeverri_s:2013,,,2013,,Is Perception a Source of Reasons?,Is Perception a Source of Reasons?,,,,theoria,79,1,22--56,22,,,,,,,,,,,,,,,,,,,english,false,,,echeverri_s,,,1:perception;2:perceptual_judgement
46966,article,echeverri_s:2017,,,2017,,How to Undercut Radical Skepticism,How to Undercut Radical Skepticism,,,,philosophical-studies,174,5,1299--1321,1299,,,,,,,,,,,,,,,,,10.1007/s11098-016-0761-9,,english,false,,,echeverri_s,,,1:skepticism
46967,article,echeverri_s:2017a,,,2017,,"Illusion of Optimal Motion, Relationism, and Perceptual Content","Illusion of Optimal Motion, Relationism, and Perceptual Content",,,,pacific-philosophical-quarterly,98,s1,146--173,146,,,,,,,,,,,,,,,,,,,english,false,,,echeverri_s,,,1:perception;2:direct_realism;3:relationism_about_perception
46968,article,echeverri_s:2019,,,2019,,Emotional Justification,Emotional Justification,,,,philosophy-and-phenomenological-research,98,3,541--566,541,,,,,,,,,,,,,,,,,,,english,false,,,echeverri_s,,,1:feeling;2:emotions;3:emotional_justification
46969,incollection,echeverria_j:1996,,,1996,,Empirical Methods in Mathematics.~A Case Study: Goldbach's Conjecture,Empirical Methods in Mathematics. A Case Study: Goldbach's Conjecture,,,,,,,19--56,19,,,,,,,,,,,,,,,,,,,english,false,,,echeverria_j,,,1:mathematics
46970,incollection,echols-correll:2012,,,2012,,It's More than Skin Deep: Empathy and Helping Behavior across Social Groups,It's More than Skin Deep: Empathy and Helping Behavior across Social Groups,,,,,,,55--72,55,,,,,,,,,,,,,,,,,,,english,false,,,echols;correll_j,,,1:feeling;2:empathy
46971,incollection,eck_d-turner:2017,,,2017,,Cognitive Science,Cognitive Science,,,,,,,340--350,340,,,,,,,,,,,,,,,,,,,english,false,,,eck_d;turner_sp,,,1:social_sciences
46972,article,eckardt:1999,,,1999,,"Normal Objects, Normal Worlds and the Meaning of Generic Sentences","Normal Objects, Normal Worlds and the Meaning of Generic Sentences",,,,journal-of-semantics,16,3,237--278,237,,,,,,,,,,,,,,,,,,,english,false,,,eckardt,,,1:semantics;2:generics
46973,incollection,eckardt:2000,,,2000,,"Causation, Contexts, and Event Individuation","Causation, Contexts, and Event Individuation",,,,,,,105--122,105,,,,,,,,,,,,,,,,,,,english,false,,,eckardt,,,1:ontology;2:events
46974,article,eckardt:2001,,,2001,,Reanalyzing \emph{Selbst},Reanalyzing Selbst,,,,natural-language-semantics,9,4,371--412,371,,,,,,,,,,,,,,,,,,,english,false,,,eckardt,,,1:linguistics
46975,incollection,eckardt:2010,,,2010,,A Logic for Easy Linking Semantics,A Logic for Easy Linking Semantics,,,,,,,274--283,274,,,,,,,,,,,,,,,,,,,english,false,,,eckardt,,,1:linguistics
46976,incollection,eckardt:2011,,,2011,,Imperatives as Future Plans,Imperatives as Future Plans,,,,,,,209--224,209,,,,,,,,,,,,,,,,,,,english,false,,,eckardt,,,1:pragmatics;2:speech_acts;3:imperatives
46977,incollection,eckardt:2012,,,2012,,Grammaticalization and Semantic Reanalysis,Grammaticalization and Semantic Reanalysis,,,,,,,2675--2701,2675,,,,,,,,,,,,,,,,,,,english,false,,,eckardt,,,1:linguistics
46978,incollection,eckel_m:1998,,,1998,,Is there a Buddhist Philosophy of Nature?,Is there a Buddhist Philosophy of Nature?,,,,,,,53--70,53,,,,,,,,,,,,,,,,,,,english,false,,,eckel_m,,,1:religion;2:buddhist
46979,incollection,eckenwiler:2015,,,2015,,"Family Caregivers, Long-Term Care, and Global Justice","Family Caregivers, Long-Term Care, and Global Justice",,,,,,,449--461,449,,,,,,,,,,,,,,,,,,,english,false,,,eckenwiler,,,1:medicine;2:medical_ethics
46980,incollection,eckersley_r:2001,,,2001,,Politics,Politics,,,,,,,316--330,316,,,,,,,,,,,,,,,,,,,english,false,,,eckersley_r,,,1:political_philosophy
46981,article,eckert_m-strube:2000,,,2000,,"Dialogue Acts, Synchronizing Units, and Anaphora Resolution","Dialogue Acts, Synchronizing Units, and Anaphora Resolution",,,,journal-of-semantics,17,1,51--89,51,,,,,,,,,,,,,,,,,,,english,false,,,eckert_m;strube_m,,,1:reference;2:anaphora
46982,incollection,eckert_wp:1989,,,1989,,"Die Universit{\""a}t K{\""o}ln und die Juden im sp{\""a}ten Mittelalter",Die Universität Köln und die Juden im späten Mittelalter,,,,,,,488--507,488,,,,,,,,,,,,,,,,,,,ngerman,false,,,eckert_wp,,,1:religion
46983,incollection,eckes-erll:2011,,,2011,,Theory-Ladenness and Relativism,Theory-Ladenness and Relativism,,,,,,,85--104,85,,,,,,,,,,,,,,,,,,,english,false,,,eckes;erll_s,,,1:science;2:sociology_of_science
46984,article,eckhardt_w:1993,,,1993,,Probability Theory and the Doomsday Argument,Probability Theory and the Doomsday Argument,,,,mind,102,407,483--488,483,,,,,,,,,,,,,,,,,,,english,false,,,eckhardt_w,,,1:decision_theory;2:doomsday_argument
46985,article,eckhardt_w:1997,,,1997,,A Shooting-Room View of Doomsday,A Shooting-Room View of Doomsday,,,,the-journal-of-philosophy,94,5,244--259,244,,,,,,,,,,,,,,,,,,,english,false,,,eckhardt_w,,,1:decision_theory;2:doomsday_argument
46986,book,eckhardt_w:2013,,,2013,,Paradoxes in Probability Theory,Paradoxes in Probability Theory,,,,,,,,,,springer_briefs_in_philosophy,Dordrecht,,,springer,,,,,,,,,,,,,english,false,,,eckhardt_w,,,1:argumentation;2:paradoxes
46987,incollection,eckhoff_t:1964,,,1964,,Noen refleksjoner om domstolenes uavhengighet,Noen refleksjoner om domstolenes uavhengighet,,,,,,,109--147,109,,,,,,,,,,,,,,,,,,,swedish,false,,,eckhoff_t,,,2:ought
46988,book,eckholt:1994,,,1994,,Vernunft in Leiblichkeit bei Nicolas Malebranche.~Die christologische Vermittlung seines rationalen Systems,Vernunft in Leiblichkeit bei Nicolas Malebranche. Die christologische Vermittlung seines rationalen Systems,,,,,,,,,,,Tyrolia,,,innsbrucker-theologische-studien,,,,,,,,,,,,,ngerman,false,,,eckholt,,,1:religion
46989,incollection,eckl:2018,,,2018,,"Das Prinzip der ``Zweckm{\""a}ssigkeit'' in der Kritik der Urteilskraft und seine sachliche Vorbereitung in der \emph{Kritik der reinen Vernunft}",Das Prinzip der “Zweckmässigkeit” in der Kritik der Urteilskraft und seine sachliche Vorbereitung in der Kritik der reinen Vernunft,,,,,,,2969--2978,2969,,,,,,,,,,,,,,,,,,,ngerman,false,,,eckl,,,1:explanation;2:teleological_explanation
46990,book,eckle_hp:2019,,,2019,,Models of Quantum Matter.~A First Course on Integrability and the Bethe Ansatz,Models of Quantum Matter. A First Course on Integrability and the Bethe Ansatz,,,,,,,,,,,Oxford,,,oxford-university-press,,,,,,,,,,,,,english,false,,,eckle_hp,,,1:quantum_mechanics
46991,incollection,eckman:1976,,,1976,,Empirical and Nonempirical Generalizations in Syntax,Empirical and Nonempirical Generalizations in Syntax,,,,,,,35--48,35,,,,,,,,,,,,,,,,,,,english,false,,,eckman,,,1:linguistics
46992,book,eckman:1977,,,1977,,"Current themes in Linguistics: Bilingualism, Experimental Linguistics, and Language Typologies","Current themes in Linguistics: Bilingualism, Experimental Linguistics, and Language Typologies","Current themes in Linguistics: Bilingualism, Experimental Linguistics, and Language Typologies","Current themes in Linguistics: Bilingualism, Experimental Linguistics, and Language Typologies",,,,,,,,,"Hoboken, New Jersey",,,john-wiley-and-sons-inc,,,,,,,,,,,,,english,false,,,,eckman,,1:linguistics
46993,book,eckman:1977a,,,1977,,On the Explanation of Some Typological Facts about Raising,On the Explanation of Some Typological Facts about Raising,,,,,,,,,,,"310 Lindley Hall, Bloomington, Indiana",,,indiana-university-linguistics-club,,,,,,,,,,,,,english,false,,,eckman,,,1:linguistics;2:grammar;3:transformational_grammar
46994,incollection,eckmann_b:1968,,,1968,,Continous Solutions of Linear Equations: Some Exceptional Dimensions in Topology,Continous Solutions of Linear Equations: Some Exceptional Dimensions in Topology,,,,,,,,,,,,,,,,,,,,,,,,,,,english,false,,,eckmann_b,,,1:mathematics;2:algebra
46995,article,eckstein_b:1953,,,1953,,"{\""U}ber philosophische Fragen der modernen Physik",Über philosophische Fragen der modernen Physik,,,,deutsche-zeitschrift-fur-philosophie,1,3,629--631,629,,,,,,,,,,,,,,,,,,,ngerman,false,,,eckstein_b,,,1:physics
46996,book,eckstein_f:1955,,,1955,,Abriss der griechischen Philosophie,Abriss der griechischen Philosophie,,,,,,,,,,,Frankfurt a.M.,,,cornelsen-verlag-hirschgraben,,,,,,,,,,,,,ngerman,false,,,eckstein_f,,,1:history_of_philosophy
46997,book,eco-etal:1988,,,1988,,Meaning and Mental Representation,Meaning and Mental Representation,Meaning and Mental Representation,Meaning and Mental Representation,,,,,,,,,"Bloomington, Indiana",,,indiana-university-press,,,,,,,,,,,,,english,false,,,,eco;santambrogio;violi_p,,1:representation;2:mental_representation
46998,book,eco:1976,,,1976,,A Theory of Semiotics,A Theory of Semiotics,,,,,,,,,,,"Bloomington, Indiana",,,indiana-university-press,,,,,,,,,,,,,english,false,,,eco,,,1:representation;2:meaning_theories;3:semiotics
46999,book,eco:1979,,,1979,,The Role of the Reader,The Role of the Reader,,,,,,,,,,,"Bloomington, Indiana",,,indiana-university-press,,,,,,,,,,,,,english,false,,,eco,,,1:representation;2:meaning_theories;3:semiotics
47000,incollection,eco:1984a,,,1984,,Intensional Man vs Extensional Man: A Difficult Dialogue,Intensional Man vs Extensional Man: A Difficult Dialogue,,,,,,,335--350,335,,,,,,,,,,,,,,,,,,,english,false,,,eco,,,1:pragmatics
47001,book,eco:1985,,,1985,,"{\""U}ber Gottt und die Welt",Über Gottt und die Welt,,,,,,,,,,,"M{\""u}nchen",,,carl-hanser,,,,,,,,,,,,,ngerman,true,,,eco,,,1:religion
47002,incollection,eco:1987,,,1987,,"Semantics, Pragmatics, and Text Semiotics","Semantics, Pragmatics, and Text Semiotics",,,,,,,695--714,695,,,,,,,,,,,,,,,,,,,english,false,,,eco,,,1:pragmatics
47003,incollection,eco:1988,,,1988,,On Truth.~A Fiction,On Truth. A Fiction,,,,,,,41--60,41,,,,,,,,,,,,,,,,,,,english,false,,,eco,,,1:truth
47004,incollection,eco:1989,,,1989,,Report on Session 3: Literature and Arts,Report on Session 3: Literature and Arts,,,,,,,343--358,343,,,,,,,,,,,,,,,,,,,english,false,,,eco,,,1:aesthetics
47005,incollection,eco:1991,,,1991,,"Interpretation and Overinterpretation: World, History, Texts","Interpretation and Overinterpretation: World, History, Texts",,,,,,,,,,,,,,,,,,,,,,,,,,,english,false,,,eco,,,1:representation;2:meaning_theories;3:interpretationism
47006,incollection,eco:1992,,,1992,,The Original and the Copy,The Original and the Copy,,,,,,,273--304,273,,,,,,,,,,,,,,,,,,,english,false,,,eco,,,1:properties;2:resemblance
47007,incollection,eco:1997,,,1997,,"On Meaning, Logic and Verbal Language","On Meaning, Logic and Verbal Language",,,,,,,431--448,431,,,,,,,,,,,,,,,,,,,english,false,,,eco,,,1:representation
47008,book,eco:2000,,,2000,,Kant and the Platypus,Kant and the Platypus,,,,,,,,,,,London,,,penguin-books,,,,,,,,,,,,,english,false,,,eco,,,1:history_of_philosophy
47009,book,eco:2004,,,2004,,Histoire de la beaut{\'e},Histoire de la beauté,,,,,,,,,,,Paris,,,flammarion,,,,,,,,,,,,,french,false,,,eco,,,2:aesthetic_value;3:beauty
47010,article,eco:2015,,,2015,,Some Remarks on a New Realism,Some Remarks on a New Realism,,,,journal-of-philosophical-research,40,suppl.,387--395,387,,,,,,,,,,,Selected Papers from the XXIII World Congress of Philosophy,Selected Papers from the XXIII World Congress of Philosophy,,,,,,,english,false,,,eco,,boudouris_kj;dimitracopoulos;protopapadakis,1:metaphysics;2:realism
47011,incollection,eco:2017,,,2017,,Intellectual Autobiography,Intellectual Autobiography,,,,,,,3--66,3,,,,,,,,,,,,,,,,,,,english,false,,,eco,,,1:history_of_philosophy
47012,incollection,eco:2017a,,,2017,,Why Philosophy?,Why Philosophy?,,,,,,,67--73,67,,,,,,,,,,,,,,,,,,,english,false,,,eco,,,1:metaphilosophy
47013,incollection,eco:2017b,,,2017,,Reply to \citet{marenbon:2017},Reply to Marenbon (2017),,,,,,,95--102,95,,,,,,,,,,,,,,,,,,,english,false,,,eco,,,1:aesthetics
47014,incollection,eco:2017c,,,2017,,Reply to \citet{boersema:2017},Reply to Boersema (2017),,,,,,,151--152,151,,,,,,,,,,,,,,,,,,,english,false,,,eco,,,1:knowledge
47015,incollection,eco:2017d,,,2017,,Reply to \citet{verene:2017},Reply to Verene (2017),,,,,,,178--180,178,,,,,,,,,,,,,,,,,,,english,false,,,eco,,,1:science;2:scientific_realism
47016,incollection,eco:2017e,,,2017,,Reply to \citet{fabbrichesi_r:2017},Reply to Fabbrichesi (2017),,,,,,,325--330,325,,,,,,,,,,,,,,,,,,,english,false,,,eco,,,1:representation;2:natural_meaning;3:signs
47017,incollection,eco:2017f,,,2017,,Reply to \citet{lepore-stone:2017},Reply to LePore and Stone (2017),,,,,,,379--383,379,,,,,,,,,,,,,,,,,,,english,false,,,eco,,,1:pragmatics;2:metaphor
47018,incollection,eco:2017g,,,2017,,Reply to \citet{nergaard_s:2017},Reply to Nergaard (2017),,,,,,,412--419,412,,,,,,,,,,,,,,,,,,,english,false,,,eco,,,1:aesthetics;2:fiction;3:translation
47019,incollection,eco:2017h,,,2017,,Reply to \citet{crisafulli_e:2017},Reply to Crisafulli (2017),,,,,,,457--463,457,,,,,,,,,,,,,,,,,,,english,false,,,eco,,,1:aesthetics;2:fiction;3:translation
47020,incollection,eco:2017i,,,2017,,Reply to \citet{stephens_wa:2017},Reply to Stephens (2017),,,,,,,488--490,488,,,,,,,,,,,,,,,,,,,english,false,,,eco,,,1:aesthetics;2:fiction
47021,incollection,eco:2017j,,,2017,,Reply to \citet{bouchard_n:2017},Reply to Bouchard (2017),,,,,,,560--562,560,,,,,,,,,,,,,,,,,,,english,false,,,eco,,,1:aesthetics;2:fiction
47022,incollection,eco:2017k,,,2017,,Reply to \citet{jencks_c:2017},Reply to Jencks (2017),,,,,,,625--628,625,,,,,,,,,,,,,,,,,,,english,false,,,eco,,,1:history_of_philosophy
47023,incollection,eco:2017l,,,2017,,Reply to \citet{mchale_b:2017},Reply to McHale (2017),,,,,,,653--656,653,,,,,,,,,,,,,,,,,,,english,false,,,eco,,,1:metaphilosophy;2:non_factualism;3:postmodernism
47024,article,ecole:1979,,,1979,,En quels sens peut-on dire que Wolff est rationaliste?,En quels sens peut-on dire que Wolff est rationaliste?,,,,studia-leibnitiana,11,1,45--61,45,,,,,,,,,,,,,,,,,,,french,false,,,ecole,,,1:metaphysics;2:rationalism
47025,article,ecole:1983,,,1983,,Les rapports de la raison et de la foi selon Christian Wolff,Les rapports de la raison et de la foi selon Christian Wolff,,,,studia-leibnitiana,15,2,205--214,205,,,,,,,,,,,,,,,,,,,french,false,,,ecole,,,1:religion;2:faith
47026,article,ecole:1989,,,1989,,Note sur la d{\'e}finition wolffienne de la philosophie,Note sur la définition wolffienne de la philosophie,,,,studia-leibnitiana,21,2,205--208,205,,,,,,,,,,,,,,,,,,,french,false,,,ecole,,,1:metaphilosophy
47027,book,ecole:1990,,,1990,,La M{\'e}taphysique de Christian Wolff,La Métaphysique de Christian Wolff,,,,,,,,,,,Hildesheim,,,georg-olms,,,,,,,,,,,,,french,false,,,ecole,,,1:metaphysics
47028,incollection,ecole:1993,,,1993,,"De la nature de la raison, de ses rapports avec l'exp{\'e}rience et la foi selon Christian Wolff","De la nature de la raison, de ses rapports avec l'expérience et la foi selon Christian Wolff",,,,,,,127--139,127,,,,,,,,,,,,,,,,,,,french,false,,,ecole,,,1:rationality
47029,article,ecole:1996,,,1996,,La d{\'e}finition de l'existence comme le compl{\'e}ment de la possibilit{\'e} et les rapports de l'essence et de l'existence selon Christian Wolff,La définition de l'existence comme le complément de la possibilité et les rapports de l'essence et de l'existence selon Christian Wolff,,,,les-etudes-philosophiques,50,1/2,261--273,261,,,,,,,,,,,,,,,,,,,french,false,,,ecole,,,2:essence;3:essence_existence
47030,article,ecole:1997,,,1997,,Compte rendu de \citet{carboncini:1991},Compte rendu de Carboncini (1991),,,,les-etudes-philosophiques,51,3,411--412,411,,,,,,,,,,,,,,,,,,,french,false,,,ecole,,,1:skepticism;2:doubting
47031,incollection,ecole:1999,,,1999,,"La place de la \emph{Metaphysica de ente, quae rectius Ontosophia} dans l'histoire de l'Ontologie et sa reception chez Christian Wolff","La place de la Metaphysica de ente, quae rectius Ontosophia dans l'histoire de l'Ontologie et sa reception chez Christian Wolff",,,,,,,61--74,61,,,,,,,,,,,,,,,,,,,french,false,,,ecole,,,1:ontology;2:being
47032,incollection,economos_jj:1975,,,1975,,Identity and ``the difference'',Identity and “the difference”,,,,,,,,,,,,,,,,,,,,,,,,,,,english,false,,,economos_jj,,,1:mind_body;2:physicalism
