id,entry_type,bibkey,options,shorthand,date_year,pubstate,title_latex,title_unicode,booktitle_latex,booktitle_unicode,crossref,journal_key,volume,number,pages,start_page,eid,series_key,address,institution_key,school_key,publisher_key,type_field,edition,note_latex,note_unicode,issuetitle_latex,issuetitle_unicode,extra_note_latex,extra_note_unicode,urn,eprint,doi,url,langid,is_translation,epoch,license,author_keys,editor_keys,guesteditor_keys,keyword_keys
47584,incollection,eich_e:1989,,,1989,,Theoretical Issues in State Dependent Memory,Theoretical Issues in State Dependent Memory,,,,,,,331--354,331,,,,,,,,,,,,,,,,,,,english,false,,,eich_e,,,2:memory
47585,book,eich_s:2022,,,2022,,The Currency of Politics: The Political Theory of Money from Aristotle to Keynes,The Currency of Politics: The Political Theory of Money from Aristotle to Keynes,,,,,,,,,,,"Princeton, New Jersey",,,princeton-university-press,,,,,,,,,,,10.23943/princeton/9780691191072.001.0001,,english,false,,,eich_s,,,1:economics;2:money
47586,incollection,eichberger:1995,,,1995,,Die Architektur der Vernunft,Die Architektur der Vernunft,,,,,,,927--?,927,,,,,,,,,,,,,,,,,,,ngerman,false,,,eichberger,,,1:metaphysics;2:transcendental_idealism
47587,article,eichenberger:1996,,,1996,,"Ein politisch-{\""o}konomischer Blick auf Diskurse.~Kooperativ beim Aperitif -- mit Interessen zum Essen",Ein politisch-ökonomischer Blick auf Diskurse. Kooperativ beim Aperitif – mit Interessen zum Essen,,,,analyse-kritik,18,2,225--244,225,,,,,,,,,,,,,,,,,,,ngerman,false,,,eichenberger,,,1:pragmatics;2:discourse
47588,article,eichenberger:2001,,,2001,,Bessere Politik dank Deregulierung des politischen Prozesses,Bessere Politik dank Deregulierung des politischen Prozesses,,,,analyse-kritik,23,1,43--60,43,,,,,,,,,,,,,,,,,,,ngerman,false,,,eichenberger,,,1:political_philosophy
47589,incollection,eichengreen:2006,,,2006,,European Integration,European Integration,,,,,,,799--813,799,,,,,,,,,,,,,,,,,,,english,false,,,eichengreen,,,1:political_philosophy;2:nation_state
47590,incollection,eichenhofer_j:2020,,,2020,,Migrationsrecht und Integration -- eine Problemskizze,Migrationsrecht und Integration – eine Problemskizze,,,,,,,345--368,345,,,,,,,,,,,,,,,,,,,ngerman,false,,,eichenhofer_j,,,1:political_philosophy;2:immigration
47591,UNKNOWN,eicher_c:1996,,,1996,,La r{\'e}forme x{\'e}nophanienne de la mythologie : X{\'e}nophane et la probl{\'e}matique du discours sur le divin,La réforme xénophanienne de la mythologie : Xénophane et la problématique du discours sur le divin,,,,,,,,,,,Fribourg,,d_e_partement_de_philosophie_universit_e_de_fribourg,,Travail de licence,,,,,,,,,,,,french,false,,,eicher_c,,,
47592,UNKNOWN,eicher_j:2002,,,2002,,"Fonction sch{\'e}matique de la ``phantasia"" \& [et] dimension anagogique de l'""eikōn"" dans la philosophie proclienne des math{\'e}matiques : d'apr{\`e}s le ``Commentaire sur le premier livre des ``El{\'e}ments"" d'Euclide""","Fonction schématique de la “phantasia"" & [et] dimension anagogique de l'""eikōn"" dans la philosophie proclienne des mathématiques : d'après le “Commentaire sur le premier livre des “Eléments"" d'Euclide""",,,,,,,,,,,Fribourg,,d_e_partement_de_philosophie_universit_e_de_fribourg,,Travail de licence,,,,,,,,,,,,french,false,,,eicher_j,,,
47593,UNKNOWN,eicher_p:1969,,,1969,,Die anthropologische Wende: Karl Rahners philosophischer Weg vom Wesen des Menschen zur personalen Existenz,Die anthropologische Wende: Karl Rahners philosophischer Weg vom Wesen des Menschen zur personalen Existenz,,,,,,,,,,,Fribourg,,d_e_partement_de_philosophie_universit_e_de_fribourg,,Th{\`e}se de doctorat,,,,,,,,,,,,ngerman,false,,,eicher_p,,,
47594,article,eichhorn_re:2014,,,2014,,Review of \citet{zerba_m:2012},Review of Zerba (2012),,,,british-journal-for-the-history-of-philosophy,22,2,387--389,387,,,,,,,,,,,,,,,,,,,english,false,,,eichhorn_re,,,1:skepticism;2:history_of_skepticism
47595,article,eichhorn_w-krtscha:2007,,,2007,,Multivariate Lorenz Majorization and Heterogeneity Measures: An Axiomatic Approach,Multivariate Lorenz Majorization and Heterogeneity Measures: An Axiomatic Approach,,,,analyse-kritik,29,2,206--225,206,,,,,,,,,,,,,,,,,,,english,false,,,eichhorn_w;krtscha,,,1:economics
47596,article,eichinger_t:2020,,,2020,,"Die Gemeinschaft der vern{\""u}nftigen Tiere",Die Gemeinschaft der vernünftigen Tiere,,,,philosophie-ch,,,,,,,,,,,,,,,,,,,,,,https://www.philosophie.ch/2020-03-09-eichinger,ngerman,false,,https://creativecommons.org/licenses/by/3.0/,eichinger_t,,,
47597,incollection,eichner_h:2016,,,2016,,Handbooks in the Tradition of Later Eastern Ash'arism,Handbooks in the Tradition of Later Eastern Ash'arism,,,,,,,494--514,494,,,,,,,,,,,,,,,,,,,english,false,,,eichner_h,,,1:religion
47598,article,eichner_k:1975,,,1975,,"Die L{\""o}sung des Goodman-Paradoxons: Goodmans Fehlschluss",Die Lösung des Goodman-Paradoxons: Goodmans Fehlschluss,,,,kant-studien,66,4,500--509,500,,,,,,,,,,,,,,,,,,,ngerman,false,,,eichner_k,,,1:method;2:induction;3:grue
47599,article,eichorn:2016,,,2016,,Review of \citet{maianeto:2014},Review of Maia Neto (2014),,,,british-journal-for-the-history-of-philosophy,24,1,174--178,174,,,,,,,,,,,,,,,,,,,english,false,,,eichorn,,,1:skepticism;2:ancient_skepticism
47600,incollection,eickelman_df:2003,,,2003,,Islam and Ethical Pluralism,Islam and Ethical Pluralism,,,,,,,161--179,161,,,,,,,,,,,,,,,,,,,english,false,,,eickelman_df,,,1:ethics;2:metaethics;3:moral_relativism
47601,incollection,eickers-prinz:2021,,,2021,,Emotion Recognition as a Social Skill,Emotion Recognition as a Social Skill,,,,,,,347--362,347,,,,,,,,,,,,,,,,,,,english,false,,,eickers;prinz_jj,,,1:knowledge;2:knowing_how
47602,incollection,eickers:2022,,,2022,,"Being Trans, Being Loved: Clashing Identities and the Limits of Love","Being Trans, Being Loved: Clashing Identities and the Limits of Love",,,,,,,171--190,171,,,,,,,,,,,,,,,,,,,english,false,,,eickers,,,1:persons;2:gender;3:transsexualism
47603,article,eickers:2024,,,2024,,Scripts and Social Cognition,Scripts and Social Cognition,,,,ergo,10,54,1565--1587,1565,,,,,,,,,,,,,,,,,10.3998/ergo.5191,,english,false,,,eickers,,,
47604,incollection,eickmann_b:2010,,,2010,,"Kennzeichnungstheorien und die Rede {\""u}ber Gegenst{\""a}nde",Kennzeichnungstheorien und die Rede über Gegenstände,,,,,,,125--134,125,,,,,,,,,,,,,,,,,,,ngerman,false,,,eickmann_b,,,1:reference;2:definite_descriptions
47605,UNKNOWN,eid_l:1975,,,1975,,"Hayy Ben Yaqdhan ``Philosophus autodidactus"" : essai d'explication doctrinale","Hayy Ben Yaqdhan “Philosophus autodidactus"" : essai d'explication doctrinale",,,,,,,,,,,Fribourg,,d_e_partement_de_philosophie_universit_e_de_fribourg,,Travail de licence,,,,,,,,,,,,french,false,,,eid_l,,,
47606,incollection,eid_m:2001,,,2001,,Advanced Statistical Methods for the Study of Appraisal and Emotional Reaction,Advanced Statistical Methods for the Study of Appraisal and Emotional Reaction,,,,,,,319--330,319,,,,,,,,,,,,,,,,,,,english,false,,,eid_m,,,1:feeling;2:emotions
47607,UNKNOWN,eid_ma:1960,,,1960,,La philosophie de l'histoire selon Ibn-Khaldun,La philosophie de l'histoire selon Ibn-Khaldun,,,,,,,,,,,Fribourg,,d_e_partement_de_philosophie_universit_e_de_fribourg,,Travail de licence,,,,,,,,,,,,french,false,,,eid_ma,,,
47608,book,eidam_h:2000,,,2000,,Dasein und Bestimmung.~Kants Grund-Problem,Dasein und Bestimmung. Kants Grund-Problem,,,,,,138,,,,kantstudien_erg_a_nzungshefte,Berlin,,,de-gruyter,,,,,,,,,,,,,ngerman,false,,,eidam_h,,,1:ontology;2:being;3:dasein
47609,book,eidelson:2015,,,2015,,Discrimination and Disrespect,Discrimination and Disrespect,,,,,,,,,,,Oxford,,,oxford-university-press,,,,,,,,,,,10.1093/acprof:oso/9780198732877.001.0001,,english,false,,,eidelson,,,1:political_philosophy;2:discrimination
47610,book,eidinow_e-kindt:2015,,,2015,,The Oxford Handbook of Ancient Greek Religion,The Oxford Handbook of Ancient Greek Religion,The Oxford Handbook of Ancient Greek Religion,The Oxford Handbook of Ancient Greek Religion,,,,,,,,oxford_handbooks,New York,,,oxford-university-press,,,,,,,,,,,,,english,false,,,,eidinow_e;kindt_j,,1:religion
47611,incollection,eidlin_f-eidlin:2017,,,2017,,The Pitfall of Hypostatization and the Reality of Social Things,The Pitfall of Hypostatization and the Reality of Social Things,,,,,,,417--428,417,,,,,,,,,,,,,,,,,,,english,false,,,eidlin_f;eidlin_b,,,1:ontology;2:social_ontology
47612,incollection,eidlin_f:2007,,,2007,,"Call to Destiny or Call to Action: Marx, Popper, and History","Call to Destiny or Call to Action: Marx, Popper, and History",,,,,,,31--54,31,,,,,,,,,,,,,,,,,,,english,false,,,eidlin_f,,,1:history
47613,article,eifler:2016,,,2016,,Social Mechanisms in Norm-relevant Situations:Explanations for Theft by Finding in High-cost and Low-cost Situations,Social Mechanisms in Norm-relevant Situations:Explanations for Theft by Finding in High-cost and Low-cost Situations,,,,analyse-kritik,38,1,91--120,91,,,,,,,,,,,,,,,,,,,english,false,,,eifler,,,1:economics;2:property
47614,incollection,eifrig:1972,,,1972,,"Ein Nicht-Standard-Beweis f{\""u}r die Existenz eines starken Liftings in $L\infty<0,1]$","Ein Nicht-Standard-Beweis für die Existenz eines starken Liftings in L∞<0,1]",,,,,,,81--83,81,,,,,,,,,,,,,,,,,,,ngerman,false,,,eifrig,,,1:mathematics;2:set_theory
47615,incollection,eigen:1973,,,1973,,The Origin of Biological Information,The Origin of Biological Information,,,,,,,594--634,594,,,,,,,,,,,,,,,,,,,english,false,,,eigen,,,
47616,incollection,eigen:1985,,,1985,,Evolution und Zeitlichkeit,Evolution und Zeitlichkeit,,,,,,,215--237,215,,,,,,,,,,,,,,,,,,,ngerman,false,,,eigen,,,1:biology;2:evolution
47617,UNKNOWN,eigenmann_a:1921,,,1921,,"Die P{\""a}dagogik Kants im Lichte seiner Ethik",Die Pädagogik Kants im Lichte seiner Ethik,,,,,,,,,,,Fribourg,,d_e_partement_de_philosophie_universit_e_de_fribourg,,Th{\`e}se de doctorat,,,,,,,,,,,,ngerman,false,,,eigenmann_a,,,
47618,article,eigi:2012,,,2012,,Two Millian Arguments: Using Helen Longino's Approach to Solve the Problems Philip Kitcher Targeted with His Argument on Freedom of Inquiry,Two Millian Arguments: Using Helen Longino's Approach to Solve the Problems Philip Kitcher Targeted with His Argument on Freedom of Inquiry,,,,studia-philosophica-estonica,5,1,44--63,44,,,,,,,,,,,,,,,,,,,english,false,,,eigi,,,1:science;2:ethics_of_science
47619,article,eigi:2017,,,2017,,"Different Motivations, Similar Proposals: Objectivity in Scientific Community and Democratic Science Policy","Different Motivations, Similar Proposals: Objectivity in Scientific Community and Democratic Science Policy",,,,synthese,194,12,4657--4669,4657,,,,,,,,,,,,,,,,,,,english,false,,,eigi,,,1:science
47620,book,eigler_u-woehrle:2015,,,2015,,Theophrast: De odoribus,Theophrast: De odoribus,Theophrast: De odoribus,Theophrast: De odoribus,,,,37,,,,beitr_a_ge_zur_altertumskunde,Berlin,,,de-gruyter,,,,,,,,,,,,,ngerman,false,,,,eigler_u;woehrle_g,,1:perception;2:olfaction
47621,UNKNOWN,eiholzer_h:1983,,,1983,,Eine Darstellung der musikaesthetischen Theorie Eduard Hanslicks,Eine Darstellung der musikaesthetischen Theorie Eduard Hanslicks,,,,,,,,,,,Fribourg,,d_e_partement_de_philosophie_universit_e_de_fribourg,,Travail de licence,,,,,,,,,,,,ngerman,false,,,eiholzer_h,,,
47622,book,eikmeyer-rieser:1981,,,1981,,"Words, Worlds, and Contexts: New Approaches to Word Semantics","Words, Worlds, and Contexts: New Approaches to Word Semantics","Words, Worlds, and Contexts: New Approaches to Word Semantics","Words, Worlds, and Contexts: New Approaches to Word Semantics",,,,,,,,,Berlin,,,de-gruyter,,,,,,,,,,,,,english,false,,,,eikmeyer;rieser_h,,1:semantics
47623,incollection,eikmeyer-rieser:1981a,,,1981,,"Meanings, Intensions, and Stereotypes: A New Approach to Linguistic Semantics","Meanings, Intensions, and Stereotypes: A New Approach to Linguistic Semantics",,,,,,,133--150,133,,,,,,,,,,,,,,,,,,,english,false,,,eikmeyer;rieser_h,,,1:vagueness
47624,incollection,eikmeyer-rieser:1981b,,,1981,,Word Semantics from Different Points of View: An Introduction to the Present Volume,Word Semantics from Different Points of View: An Introduction to the Present Volume,,,,,,,1--18,1,,,,,,,,,,,,,,,,,,,english,false,,,eikmeyer;rieser_h,,,1:linguistics;2:lexicon
47625,incollection,eikmeyer-rieser:1983,,,1983,,A Formal Theory of Context Dependence and Context Change,A Formal Theory of Context Dependence and Context Change,,,,,,,131--188,131,,,,,,,,,,,,,,,,,,,english,false,,,eikmeyer;rieser_h,,,1:vagueness
47626,incollection,eikmeyer-rieser:1983a,,,1983,,A Nominalistic Approach to Ambiguity and Vagueness Considered from a Mildly Platonistic Point of View,A Nominalistic Approach to Ambiguity and Vagueness Considered from a Mildly Platonistic Point of View,,,,,,,393--422,393,,,,,,,,,,,,,,,,,,,english,false,,,eikmeyer;rieser_h,,,1:vagueness
47627,book,eilan-etal:1993,,,1993,,Spatial Representation: Problems in Philosophy and Psychology,Spatial Representation: Problems in Philosophy and Psychology,Spatial Representation: Problems in Philosophy and Psychology,Spatial Representation: Problems in Philosophy and Psychology,,,,,,,,,Oxford,,,blackwell-publishers,,,,,,,,,,,,,english,false,,,,eilan;mccarthy_r;brewer_mw,,1:rationality;2:spatial_reasoning
47628,incollection,eilan-etal:1995,,,1995,,Self-Consciousness and the Body: Interdisciplinary issues,Self-Consciousness and the Body: Interdisciplinary issues,,,,,,,11--28,11,,,,,,,,,,,,,,,,,,,english,false,,,eilan;marcel_aj;bermudez_jl,,,1:perception;2:proprioception;3:bodily_awareness
47629,book,eilan-etal:2005,,,2005,,Joint Attention: Communication and Other Minds,Joint Attention: Communication and Other Minds,Joint Attention: Communication and Other Minds,Joint Attention: Communication and Other Minds,,,,,,,,,Oxford,,,oxford-university-press,,,,,,,,,,,10.1093/acprof:oso/9780199245635.001.0001,,english,false,,,,eilan;hoerl;mccormack_t;roessler_j,,2:attention;3:joint_attention
47630,incollection,eilan-roessler:2003,,,2003,,Agency and Self-Awareness: Mechanisms and Epistemology,Agency and Self-Awareness: Mechanisms and Epistemology,,,,,,,1--47,1,,,,,,,,,,,,,,,,,,,english,false,,,eilan;roessler_j,,,1:perception;2:proprioception;3:self_awareness
47631,article,eilan:1995,,,1995,,The First Person Perspective,The First Person Perspective,,,,proceedings-of-the-aristotelian-society,95,,51--66,51,,,,,,,,,,,,,,,,,,,english,false,,,eilan,,,1:representation;2:de_se
47632,incollection,eilan:1995a,,,1995,,Consciousness and the Self,Consciousness and the Self,,,,,,,337--358,337,,,,,,,,,,,,,,,,,,,english,false,,,eilan,,,1:perception;2:proprioception;3:bodily_awareness
47633,article,eilan:1997,,,1997,,Objectivity and the Perspective of Consciousness,Objectivity and the Perspective of Consciousness,,,,european-journal-of-philosophy,5,3,235--250,235,,,,,,,,,,,,,,,,,,,english,false,,,eilan,,,1:metaphysics;2:perspectivalism;3:objectivity_in_representation
47634,incollection,eilan:1998,,,1998,,"Perceptual Intentionality, Attention and Consciousness","Perceptual Intentionality, Attention and Consciousness",,,,,,,181--202,181,,,,,,,,,,,,,,,,,,,english,false,,,eilan,,,2:attention
47635,article,eilan:2000,,,2000,,Primitive Consciousness and the `Hard Problem',Primitive Consciousness and the ‘Hard Problem',,,,journal-of-consciousness-studies,7,,28--39,28,,,,,,,,,,,,,,,,,,,english,false,,,eilan,,,1:mind_body;2:explanatory_gap;3:hard_problem
47636,incollection,eilan:2000a,,,2000,,On Understanding Schizophrenia,On Understanding Schizophrenia,,,,,,,97--114,97,,,,,,,,,,,,,,,,,,,english,false,,,eilan,,,1:psychology;2:mental_illness;3:schizophrenia
47637,article,eilan:2001,,,2001,,"Consciousness, Acquaintance and Demonstrative Thought [on \citet{brewer_b:1999}]","Consciousness, Acquaintance and Demonstrative Thought [on Brewer (1999)]",,,,philosophy-and-phenomenological-research,63,2,433--440,433,,,,,,,,,,,,,,,,,,,english,false,,,eilan,,,1:perception;2:perceptual_content
47638,article,eilan:2001a,,,2001,,On the Metaphysical Reality of Colours [on \citet{stroud_b:2001}],On the Metaphysical Reality of Colours [on Stroud (2001)],,,,philosophical-books,42,4,243--252,243,,,,,,,,,,,,,,,,,,,english,false,,,eilan,,,1:perception;2:colours;3:ontology_of_colours
47639,incollection,eilan:2005,,,2005,,"Joint Attention, Communication, and Mind","Joint Attention, Communication, and Mind",,,,,,,1--33,1,,,,,,,,,,,,,,,,,,,english,false,,,eilan,,,2:attention;3:joint_attention
47640,article,eilan:2006,,,2006,,On the Role of Perceptual Consciousness in Explaining the Goals and Mechanisms of Vision: A Convergence on Attention?,On the Role of Perceptual Consciousness in Explaining the Goals and Mechanisms of Vision: A Convergence on Attention?,,,,proceedings-of-the-aristotelian-society-supplementary-volume,80,,67--88,67,,,,,,,,,,,,,,,,,,,english,false,,,eilan,,,2:consciousness
47641,incollection,eilan:2007,,,2007,,"Consciousness, Self-Consciousness and Communication","Consciousness, Self-Consciousness and Communication",,,,,,,118--138,118,,,,,,,,,,,,,,,,,,,english,false,,,eilan,,,
47642,incollection,eilan:2010,,,2010,,The Explanatory Role of Consciousness,The Explanatory Role of Consciousness,,,,,,,182--190,182,,,,,,,,,,,,,,,,,,,english,false,,,eilan,,,2:consciousness
47643,incollection,eilan:2011,,,2011,,Experiential Objectivity,Experiential Objectivity,,,,,,,51--67,51,,,,,,,,,,,,,,,,,,,english,false,,,eilan,,,1:perception;2:perceptual_judgement
47644,article,eilan:2014,,,2014,,The You Turn,The You Turn,,,,philosophical-explorations,17,3,265--278,265,,,,,,,,,,,,,,,,,,,english,false,,,eilan,,,1:epistemology;2:collective_epistemology
47645,book,eilan:2015,,,2015,,The Second Person: Philosophical and Psychological Perspectives,The Second Person: Philosophical and Psychological Perspectives,The Second Person: Philosophical and Psychological Perspectives,The Second Person: Philosophical and Psychological Perspectives,,,,,,,,,London,,,routledge,,,,,,,,,,,,,english,false,,,,eilan,,1:psychology;2:folk_psychology;3:simulation_theory
47646,article,eilan:2016,,,2016,,You Me and the World,You Me and the World,,,,analysis,76,3,311--324,311,,,,,,,,,,,,,,,,,,,english,false,,,eilan,,,1:metaphysics;2:perspectivalism
47647,incollection,eilstein:1995,,,1995,,The Virus of Fatalism,The Virus of Fatalism,,,,,,,71--88,71,,,,,,,,,,,,,,,,,,,english,false,,,eilstein,,,1:religion;2:theological_determinism
47648,book,eilstein:1997,,,1997,,"Life Contemplative, Life Practical","Life Contemplative, Life Practical",,,,,,52,,,,pozna_n_studies_in_the_philosophy_of_the_sciences_and_the_humanities,Amsterdam,,,rodopi,,,,,,,,,,,,,english,false,,,eilstein,,,1:ethics
47649,book,eilstein:2002,,,2002,,A Collection of Polish Works on Philosophical Problems of Time and Space-Time,A Collection of Polish Works on Philosophical Problems of Time and Space-Time,A Collection of Polish Works on Philosophical Problems of Time and Space-Time,A Collection of Polish Works on Philosophical Problems of Time and Space-Time,,,,309,,,,synthese_library,Dordrecht,,,kluwer-academic-publishers,,,,,,,,,,,,,english,false,,,,eilstein,,1:time
47650,incollection,eilstein:2002a,,,2002,,Against Detensers (Not for Tensers),Against Detensers (Not for Tensers),,,,,,,93--126,93,,,,,,,,,,,,,,,,,,,english,false,,,eilstein,,,1:time;2:tense_aspect;3:tensing_detensing
47651,article,einheuser:2005,,,2005,,Two Types of Rigid Designation,Two Types of Rigid Designation,,,,dialectica,59,3,367--374,367,,,,,,,,,,,,,,,,,10.1111/j.1746-8361.2005.01021.x,,english,false,,,einheuser,,,1:reference
47652,article,einheuser:2006,,,2006,,Counterconventional Conditionals,Counterconventional Conditionals,,,,philosophical-studies,127,3,459--482,459,,,,,,,,,,,,,,,,,10.1007/s11098-004-7790-5,,english,false,,,einheuser,,,1:metaphysics;2:conventionalism;3:conventionalism_about_modality
47653,incollection,einheuser:2008,,,2008,,Three Forms of Truth Relativism,Three Forms of Truth Relativism,,,,,,,187--205,187,,,,,,,,,,,,,,,,,,,english,false,,,einheuser,,,1:truth;2:relative_truth
47654,article,einheuser:2009,,,2009,,Some Remarks on ``Language-Created Entities'',Some Remarks on “Language-Created Entities”,,,,acta-analytica,24,3,185--192,185,,,,,,,,,,,,,,,,,,,english,false,,,einheuser,,,1:representation;2:objects_of_propositional_attitudes;3:propositions
47655,article,einheuser:2010,,,2010,,The Model-Theoretic Argument against Quantifying over Everything,The Model-Theoretic Argument against Quantifying over Everything,,,,dialectica,64,2,237--246,237,,,,,,,,,,,,,,,,,10.1111/j.1746-8361.2010.01221.x,,english,false,,,einheuser,,,1:ontology;2:quantification;3:unrestricted_quantification
47656,article,einheuser:2011,,,2011,,Toward a Conceptualist Solution of the Grounding Problem,Toward a Conceptualist Solution of the Grounding Problem,,,,nous,45,2,300--314,300,,,,,,,,,,,,,,,,,,,english,false,,,einheuser,,,1:complexity;2:material_constitution
47657,article,einheuser:2012,,,2012,,Inner and Outer Truth,Inner and Outer Truth,,,,philosophers-imprint,12,10,,,,,,,,,,,,,,,,,,http://hdl.handle.net/2027/spo.3521354.0012.010,,http://hdl.handle.net/2027/spo.3521354.0012.010,english,false,,,einheuser,,,1:truth;2:truth_in_truth_at
47658,article,einheuser:2012a,,,2012,,"Nonexistence, Vague Existence, Merely Possible Existence","Nonexistence, Vague Existence, Merely Possible Existence",,,,disputatio,4,33,427--443,427,,,,,,,,,,,,,,,,,,,english,false,,,einheuser,,,1:ontology
47659,article,einheuser:2012b,,,2012,,Is there a (Meta-)Problem of Change?,Is there a (Meta-)Problem of Change?,,,,analytic-philosophy,53,4,344--351,344,,,,,,,,,,,,,,,,,,,english,false,,,einheuser,,,1:time;2:change
47660,article,einheuser:2012c,,,2012,,Relativized Propositions and the Fregean Orthodoxy,Relativized Propositions and the Fregean Orthodoxy,,,,philosophy-and-phenomenological-research,84,3,590--603,590,,,,,,,,,,,,,,,,,,,english,false,,,einheuser,,,1:time;2:change
47661,article,einolf:2007,,,2007,,The Fall and Rise of Torture: A Comparative and Historical Analysis,The Fall and Rise of Torture: A Comparative and Historical Analysis,,,,sociological-theory,25,2,101--121,101,,,,,,,,,,,,,,,,,,,english,false,,,einolf,,,1:political_philosophy;2:torture
47662,article,einstein-etal:1935,,,1935,,Can Quantum-Mechanical Description of Physical Reality Be Considered Complete?,Can Quantum-Mechanical Description of Physical Reality Be Considered Complete?,,,,physical-review,47,,777--780,777,,,,,,,,,,,,,,,,,,,english,false,,,einstein;podolsky_b;rosen_n,,,1:quantum_mechanics;2:entanglement;3:epr
47663,book,einstein-freud:2005,,,2005,,Pourquoi la guerre ?,Pourquoi la guerre ?,,,,,,488,,,,rivages_poche,Paris,,,rivages,,,,,,,,,,,,,french,false,,,einstein;freud,,,1:social_philosophy;2:war
47664,book,einstein-infeld:1938,,,1938,,The Evolution of Physics,The Evolution of Physics,,,,,,,,,,,New York,,,simon-schuster,,,,,,,,,,,,,english,false,,,einstein;infeld,,,1:science;2:theory_change
47665,book,einstein-infeld:1983,,,1983,,L'{\'e}volution des id{\'e}es en physique,L'évolution des idées en physique,,,,,,,,,,,Paris,,,flammarion,,,Traductin de \citet{einstein-infeld:1938} par Maurice Solovine,Traductin de Einstein and Infeld (1938) par Maurice Solovine,,,,,,,,,french,true,,,einstein;infeld,,,1:science;2:theory_change
47666,article,einstein:1905,,,1905,,"Zur Elektrodynamik bewegter K{\""o}rper",Zur Elektrodynamik bewegter Körper,,,,annalen-der-physik,322,10,891--921,891,,,,,,,,,Reprinted in \citet[35--65]{lorentz_ha-etal:1923},Reprinted in Lorentz et al. (1923),,,,,,,10.1002/andp.19053221004,,ngerman,false,,,einstein,,,1:space_spacetime;2:relativity_theory
47667,article,einstein:1905a,,,1905,,"Ist die Tr{\""a}gheit eines K{\""o}rpers von seinem Energiegehalt abh{\""a}ngig?",Ist die Trägheit eines Körpers von seinem Energiegehalt abhängig?,,,,annalen-der-physik,18,,639--641,639,,,,,,,,,Reprinted in \citet[69--71]{lorentz_ha-etal:1923},Reprinted in Lorentz et al. (1923),,,,,,,10.1002/andp.200590007,,ngerman,true,,,einstein,,,1:time;2:motion;3:inertia
47668,article,einstein:1911,,,1911,,"{\""U}ber den Einfluss der Schwerkraft auf die Ausbreitung des Lichts",Über den Einfluss der Schwerkraft auf die Ausbreitung des Lichts,,,,annalen-der-physik,35,,,,,,,,,,,,Reprinted in \citet[99--108]{lorentz_ha-etal:1923},Reprinted in Lorentz et al. (1923),,,,,,,,,ngerman,false,,,einstein,,,1:space_spacetime;2:relativity_theory
47669,incollection,einstein:1913,,,1913,,On the Present State of the Problem of Gravitation,On the Present State of the Problem of Gravitation,,,,,,,543--568,543,,,,,,,,,,,,,,,,,,,english,false,,,einstein,,,1:space_spacetime;2:gravitation
47670,incollection,einstein:1914,,,1914,,On the Relativity Problem,On the Relativity Problem,,,,,,,605--612,605,,,,,,,,,,,,,,,,,,,english,false,,,einstein,,,1:space_spacetime;2:relativity_theory
47671,article,einstein:1916,,,1916,,"Die Grundlage der allgemeinen Relativit{\""a}tstheorie",Die Grundlage der allgemeinen Relativitätstheorie,,,,annalen-der-physik,49,,,,,,,,,,,,Translated as ``The Foundations of the General Theory of Relativity'' in \citet[111--173]{lorentz_ha-etal:1923},Translated as “The Foundations of the General Theory of Relativity” in Lorentz et al. (1923),,,,,,,,,ngerman,true,,,einstein,,,1:space_spacetime;2:relativity_theory;3:general_relativity
47672,article,einstein:1917,,,1917,,"Kosmologische Betrachtungen zur allgemeinen Relativit{\""a}tstheorie",Kosmologische Betrachtungen zur allgemeinen Relativitätstheorie,,,,sitzungsberichte-der-preussischen-akademie-der-wissenschaften,,,,,,,,,,,,,Reprinted in \citet[177--188]{lorentz_ha-etal:1923},Reprinted in Lorentz et al. (1923),,,,,,,,,ngerman,true,,,einstein,,,1:space_spacetime;2:relativity_theory;3:general_relativity
