id,entry_type,bibkey,options,shorthand,date_year,pubstate,title_latex,title_unicode,booktitle_latex,booktitle_unicode,crossref,journal_key,volume,number,pages,start_page,eid,series_key,address,institution_key,school_key,publisher_key,type_field,edition,note_latex,note_unicode,issuetitle_latex,issuetitle_unicode,extra_note_latex,extra_note_unicode,urn,eprint,doi,url,langid,is_translation,epoch,license,author_keys,editor_keys,guesteditor_keys,keyword_keys
48055,incollection,eliasson:2013,,,2013,,The Account of the Voluntariness of Virtue in the Anonymous Peripatetic Commentary of \emph{Nicomachean Ethics} 2-5,The Account of the Voluntariness of Virtue in the Anonymous Peripatetic Commentary of Nicomachean Ethics 2-5,,,,,,,195--231,195,,,,,,,,,,,,,,,,,,,english,false,,,eliasson,,,1:ethics
48056,incollection,eliavfeldon:1986,,,1986,,Metamorphoses of the Scientist in Utopia: A Comment [on \citet{manuel_f:1986}],Metamorphoses of the Scientist in Utopia: A Comment [on Manuel (1986)],,,,,,,17--20,17,,,,,,,,,,,,,,,,,,,english,false,,,eliavfeldon,,,1:science;2:sociology_of_science
48057,book,elie_h:1936,,,1936,,Le complexe significabile,Le complexe significabile,,,,,,,,,,,Paris,,,librairie-philosophique-jean-vrin,,,,,,,,,,,,,french,false,,,elie_h,,,1:representation
48058,article,elie_m:2002,,,2002,,Sur l'ultime.~{\`A} propos d'une cat{\'e}gorie de proc{\'e}s et r{\'e}alit{\'e},Sur l'ultime. À propos d'une catégorie de procés et réalité,,,,les-etudes-philosophiques,56,4,491--509,491,,,,,,,,,,,,,,,,,,,french,false,,,elie_m,,,1:metaphysics;2:the_absolute
48059,article,elieser:1959,,,1959,,"Zur erkenntnistheoretischen Bedeutung des Relativit{\""a}tsprinzips",Zur erkenntnistheoretischen Bedeutung des Relativitätsprinzips,,,,kant-studien,50,4,405--408,405,,,,,,,,,,,,,,,,,,,ngerman,false,,,elieser,,,1:space_spacetime;2:relativity_theory
48060,unpublished,elio-pelletier:1995,,,1995,,A Study of Belief Update Theories,A Study of Belief Update Theories,,,,,,,,,,,,,,,,,"Unpublished manuscript, University of Alberta","Unpublished manuscript, University of Alberta",,,,,,,,,english,false,,,elio;pelletier_fj,,,1:rationality;2:belief_revision
48061,book,elio:2002,,,2002,,"Common Sense, Reasoning, and Rationality","Common Sense, Reasoning, and Rationality","Common Sense, Reasoning, and Rationality","Common Sense, Reasoning, and Rationality",,,,,,,,,Oxford,,,oxford-university-press,,,,,,,,,,,10.1093/0195147669.001.0001,,english,false,,,,elio,,1:argumentation;2:informal_logic
48062,article,eliot_ch:2011,,,2011,,Hempel's Provisos and \emph{Ceteris Paribus} Clauses,Hempel's Provisos and Ceteris Paribus Clauses,,,,journal-for-general-philosophy-of-science-zeitschrift-fur-allgemeine-wissenschaftstheorie,42,2,207--218,207,,,,,,,,,,,,,,,,,,,english,false,,,eliot_ch,,,1:causation;2:laws_of_nature;3:ceteris_paribus_laws
48063,book,eliot_ts:1964,,,1964,,Knowledge and Experience in the Philosophy of F.H.~Bradley,Knowledge and Experience in the Philosophy of F.H. Bradley,,,,,,,,,,,New York,,,columbia-university-press,,,,,,,,,,,,,english,false,,,eliot_ts,,,1:epistemology
48064,book,elissade:2000,,,2000,,Critique de l'interpr{\'e}tation,Critique de l'interprétation,,,,,,,,,,philologie_et_mercure,Paris,,,librairie-philosophique-jean-vrin,,,,,,,,,,,,,french,false,,,elissade,,,1:representation;2:meaning_theories;3:interpretationism
48065,book,elissade:2004,,,2004,,Les passions : premi{\`e}res r{\'e}flexions,Les passions : premières réflexions,,,,,,,,,,,Rosny-sous-Bois (Seine-Saint-Denis),,,breal,,,,,,,,,,,,,french,false,,,elissade,,,1:feeling;2:emotions
48066,book,elithorn-jones:1973,,,1973,,Artificial and Human Thinking,Artificial and Human Thinking,Artificial and Human Thinking,Artificial and Human Thinking,,,,,,,,,"San Francisco, California",,,jossey-bass,,,,,,,,,,,,,english,false,,,,elithorn;jones_da,,1:ai;2:foundations_of_ai
48067,book,elitzur-etal:2005,,,2005,,Quo Vadis Quantum Mechanics?,Quo Vadis Quantum Mechanics?,Quo Vadis Quantum Mechanics?,Quo Vadis Quantum Mechanics?,,,,,,,,,Berlin,,,springer,,,,,,,,,,,,,english,false,,,,elitzur;dolev_s;kolenda_n,,1:quantum_mechanics
48068,article,elitzur:1989,,,1989,,Consciousness and the Incompleteness of the Physical Explanation of Behavior,Consciousness and the Incompleteness of the Physical Explanation of Behavior,,,,journal-of-mind-and-behavior,10,,1--20,1,,,,,,,,,,,,,,,,,,,english,false,,,elitzur,,,2:consciousness
48069,article,elitzur:1990,,,1990,,Neither Idealism nor Materialism: A Reply to \citet{snyder_d:1990},Neither Idealism nor Materialism: A Reply to Snyder (1990),,,,journal-of-mind-and-behavior,11,,,,,,,,,,,,,,,,,,,,,,english,false,,,elitzur,,,1:metaphysics;2:idealism
48070,article,elitzur:1995,,,1995,,Consciousness Can No Longer Be Ignored,Consciousness Can No Longer Be Ignored,,,,journal-of-consciousness-studies,2,,353--558,353,,,,,,,,,,,,,,,,,,,english,false,,,elitzur,,,2:consciousness
48071,incollection,elitzur:1996,,,1996,,Time and Consciousness: The Uneasy Bearing of Relativity on the Mind-Body Problem,Time and Consciousness: The Uneasy Bearing of Relativity on the Mind-Body Problem,,,,,,,,,,,,,,,,,,,,,,,,,,,english,false,,,elitzur,,,2:consciousness
48072,article,elizondo_es:2013,,,2013,,Reason in its Practical Application,Reason in its Practical Application,,,,philosophers-imprint,13,21,,,,,,,,,,,,,,,,,,http://hdl.handle.net/2027/spo.3521354.0013.021,,http://hdl.handle.net/2027/spo.3521354.0013.021,english,false,,,elizondo_es,,,1:rationality
48073,incollection,elkaisyfriemuth:2016,,,2016,,God and Creation in al-R{\={a}}z{\={i}}'s Commentary on the Qur'{\={a}}n,God and Creation in al-Rāzī's Commentary on the Qur'ān,,,,,,,7--19,7,,,,,,,,,,,,,,,,,,,english,false,,,elkaisyfriemuth,,,1:religion;2:god
48074,article,elkan:1990,,,1990,,A Rational Reconstruction of Nonmonotonic Truth Maintenance Systems,A Rational Reconstruction of Nonmonotonic Truth Maintenance Systems,,,,artificial-intelligence,43,2,219--234,219,,,,,,,,,,,,,,,,,,,english,false,,,elkan,,,1:computation;2:data;3:truth_maintenance
48075,inproceedings,elkan:1991,,,1991,,Formalizing Causation in First-Order Logic,Formalizing Causation in First-Order Logic,Formalizing Causation in First-Order Logic,Formalizing Causation in First-Order Logic,,,,,,,,,"Menlo Park, California",,,the-aaai-press,,,,,,,,,,,,,english,false,,,elkan,,,1:causation;2:metaphysics_of_causality;3:logic_of_causation
48076,inproceedings,elkan:1991a,,,1991,,Reasoning about Action in First-Order Logic,Reasoning about Action in First-Order Logic,Reasoning about Action in First-Order Logic,Reasoning about Action in First-Order Logic,,,,,221--227,221,,,"San Francisco, California",,,morgan-kaufmann-publishers,,,,,,,,,,,,,english,false,,,elkan,,,1:action;2:action_formalisms;3:logic_of_action
48077,incollection,elkan:1993,,,1993,,The Paradoxical Success of Fuzzy Logic,The Paradoxical Success of Fuzzy Logic,,,,,,,698--703,698,,,,,,,,,,,,,,,,,,,english,false,,,elkan,,,1:action;2:action_formalisms;3:reasoning_about_uncertainty
48078,incollection,elkan:1995,,,1995,,On Solving the Qualification Problem,On Solving the Qualification Problem,,,,,,,,,,,,,,,,,,,,,,,,,,,english,false,,,elkan,,,1:logic;2:nonmonotonic_logic;3:qualification_problem
48079,incollection,elkan:1995a,,,1995,,Formalizing Counterfactual and Nondeterministic Actions in First Order Logic,Formalizing Counterfactual and Nondeterministic Actions in First Order Logic,,,,,,,,,,,,,,,,,,,,,,,,,,,english,false,,,elkan,,,1:action;2:action_formalisms
48080,incollection,elkana:1974,,,1974,,Scientific and Metaphysical Problems: Euler and Kant,Scientific and Metaphysical Problems: Euler and Kant,,,,,,,277--306,277,,,,,,,,,,,,,,,,,,,english,false,,,elkana,,,1:metaphysics;2:metametaphysics
48081,incollection,elkana:1976,,,1976,,"Introduction: Culture, Cultural System and Science","Introduction: Culture, Cultural System and Science",,,,,,,99--108,99,,,,,,,,,,,,,,,,,,,english,false,,,elkana,,,1:social_sciences
48082,book,elkassar:2015,,,2015,,Towards a Theory of Epistemically Signfiicant Perception.~How We Relate to the World,Towards a Theory of Epistemically Signfiicant Perception. How We Relate to the World,,,,,,,,,,ideen_argumente,Berlin,,,de-gruyter,,,,,,,,,,,,,english,false,,,elkassar_n,,,1:perception;2:perceptual_judgement
48083,article,elkassar:2022,,,2022,,First Steps in an Epistemology of Collective Intellectual Self-Trust,First Steps in an Epistemology of Collective Intellectual Self-Trust,,,,ergo,9,6,147--171,147,,,,,,,,,,,,,,,,,10.3998/ergo.2262,,english,false,,,elkassar_n,,,1:epistemology;2:testimony;3:trust
48084,incollection,elkassar:2022a,,,2022,,Valuable and Pernicious Collective Intellectual Self-trust,Valuable and Pernicious Collective Intellectual Self-trust,,,,,,,286--303,286,,,,,,,,,,,,,,,,,10.1111/phis.12228,,english,false,,,elkassar_n,,,
48085,incollection,elkin_h:1972,,,1972,,Towards a Developmental Phenomenology: Transcendental-\emph{Ego} and Body-\emph{Ego},Towards a Developmental Phenomenology: Transcendental-Ego and Body-Ego,,,,,,,258--266,258,,,,,,,,,,,,,,,,,,,english,false,,,elkin_h,,,1:persons;2:self
48086,article,elkin_l:2021,,,2021,,Regret Averse Opinion Aggregation,Regret Averse Opinion Aggregation,,,,ergo,8,16,473--495,473,,,,,,,,,,,,,,,,,10.3998/ergo.1153,,english,false,,,elkin_l,,,
48087,incollection,elkin_sl:2006,,,2006,,Political Theory and Political Economy,Political Theory and Political Economy,,,,,,,792--809,792,,,,,,,,,,,,,,,,,,,english,false,,,elkin_sl,,,1:political_philosophy
48088,book,elkind_ldc-klein:2024,,,2024,,"Bertrand Russell, Feminism, and Women Philosophers in his Circle","Bertrand Russell, Feminism, and Women Philosophers in his Circle","Bertrand Russell, Feminism, and Women Philosophers in his Circle","Bertrand Russell, Feminism, and Women Philosophers in his Circle",,,,,,,,,London,,,palgrave-macmillan,,,,,,,,,,,10.1007/978-3-031-33026-1,,english,false,,,,elkind_ldc;klein_al,,1:political_philosophy;2:feminism
48089,book,elkind_ldc-landini:2018,,,2018,,The Philosophy of Logical Atomism,The Philosophy of Logical Atomism,The Philosophy of Logical Atomism,The Philosophy of Logical Atomism,,,,,,,,history_of_analytic_philosophy,London,,,palgrave-macmillan,,,,,,,,,,,,,english,false,,,,elkind_ldc;landini,,1:metaphysics;2:logical_atomism
48090,incollection,elkind_ldc:2018,,,2018,,On Russell's Logical Atomism,On Russell's Logical Atomism,,,,,,,3--37,3,,,,,,,,,,,,,,,,,,,english,false,,,elkind_ldc,,,1:metaphysics;2:logical_atomism
48091,incollection,elkind_ldc:2024,,,2024,,``I Like Her \emph{Very} Good Brains'': Dorothy Wrinch's Influence on Bertrand Russll,“I Like Her Very Good Brains”: Dorothy Wrinch's Influence on Bertrand Russll,,,,,,,259--298,259,,,,,,,,,,,,,,,,,,,english,false,,,elkind_ldc,,,1:history_of_philosophy
48092,book,elkins_j:1999,,,1999,,The Domain of Images,The Domain of Images,,,,,,,,,,,"Ithaca, New York",,,cornell-university-press,,,,,,,,,,,,,english,false,,,elkins_j,,,1:representation;2:natural_meaning;3:pictorial_representation
48093,incollection,elkins_j:2010,,,2010,,Visual Practices Across the University,Visual Practices Across the University,,,,,,,169--192,169,,,,,,,,,,,,,,,,,,,english,false,,,elkins_j,,,1:representation;2:natural_meaning;3:pictorial_representation
48094,book,elkins_k:2022,,,2022,,Proust's \emph{In Search of Lost Time}: Philosophical Perspectives,Proust's In Search of Lost Time: Philosophical Perspectives,Proust's \emph{In Search of Lost Time}: Philosophical Perspectives,Proust's In Search of Lost Time: Philosophical Perspectives,,,,,,,,,Oxford,,,oxford-university-press,,,,,,,,,,,10.1093/oso/9780190921576.001.0001,,english,false,,,,elkins_k,,1:aesthetics;2:literature
48095,incollection,elle_j-hess:2020,,,2020,,"Asyl und Geschlecht: Dynamiken und Fallstricke des Vulnerabilit{\""a}tsparadigmas",Asyl und Geschlecht: Dynamiken und Fallstricke des Vulnerabilitätsparadigmas,,,,,,,317--343,317,,,,,,,,,,,,,,,,,,,ngerman,false,,,elle_j;hess_sa,,,1:political_philosophy;2:immigration
48096,book,ellemers-etal:2023,,,2023,,The Routledge International Handbook of the Psychology of Morality,The Routledge International Handbook of the Psychology of Morality,The Routledge International Handbook of the Psychology of Morality,The Routledge International Handbook of the Psychology of Morality,,,,,,,,routledge_international_handbooks,London,,,routledge,,,,,,,,,,,,,english,false,,,,ellemers;pagliaro_s;vannunspeet,,
48097,article,ellenberg_j-sober:2011,,,2011,,Objective Probabilities in Number Theory,Objective Probabilities in Number Theory,,,,philosophia-mathematica,19,3,308--322,308,,,,,,,,,,,,,,,,,,,english,false,,,ellenberg_j;sober,,,1:mathematics;2:arithmetic
48098,book,ellenzweig_s-zammito:2017,,,2017,,"The New Politics of Materialism: History, Philosophy, Science","The New Politics of Materialism: History, Philosophy, Science","The New Politics of Materialism: History, Philosophy, Science","The New Politics of Materialism: History, Philosophy, Science",,,,,,,,,London,,,routledge,,,,,,,,,,,,,english,false,,,,ellenzweig_s;zammito,,1:mind_body
48099,article,eller:1968,,,1968,,The Unique Character and the Foundation of Josef Defever's Real Proof for God,The Unique Character and the Foundation of Josef Defever's Real Proof for God,,,,franciscan-studies,28,,105--136,105,,,,,,,,,,,,,,,,,,,english,false,,,eller,,,1:religion;2:arguments_for_the_existence_of_god;3:ontological_argument
48100,article,ellerman:2007,,,2007,,Adjoints and Emergence: Applications of a New Theory of Adjoint Functors,Adjoints and Emergence: Applications of a New Theory of Adjoint Functors,,,,axiomathes,17,1,19--39,19,,,,,,,,,,,,,,,,,,,english,false,,,ellerman,,,2:emergence
48101,article,ellerman:2010,,,2010,,The Logic of Partitions: Introduction to the Dual of the Logic Subsets,The Logic of Partitions: Introduction to the Dual of the Logic Subsets,,,,the-review-of-symbolic-logic,3,2,287--350,287,,,,,,,,,,,,,,,,,,,english,false,,,ellerman,,,1:complexity;2:mereology
48102,article,ellerman:2011,,,2011,,Comment on \citet{flecha_r-santacruz:2011},Comment on Flecha and Santa Cruz (2011),,,,analyse-kritik,33,1,171--174,171,,,,,,,,,,,,,,,,,,,english,false,,,ellerman,,,1:economics;2:labour
48103,article,ellerman:2016,,,2016,,On Adjoint and Brain Functors,On Adjoint and Brain Functors,,,,axiomathes,26,1,41--61,41,,,,,,,,,,,,,,,,,,,english,false,,,ellerman,,,1:psychology;2:cognitive_science;3:connectionism
48104,article,ellerman:2017,,,2017,,Quantum Mechanics over Sets: A Pedagogical Model with Non-Commutative Finite Probability Theory as Its Quantum Probability Calculus,Quantum Mechanics over Sets: A Pedagogical Model with Non-Commutative Finite Probability Theory as Its Quantum Probability Calculus,,,,synthese,194,12,4863--4896,4863,,,,,,,,,,,,,,,,,,,english,false,,,ellerman,,,1:quantum_mechanics
48105,article,ellerman:2017a,,,2017,,Category Theory and Set Theory as Theories About Complementary Types of Universals,Category Theory and Set Theory as Theories About Complementary Types of Universals,,,,logic-and-logical-philosophy,26,2,136--162,136,,,,,,,,,,,,,,,,,,,english,false,,,ellerman,,,
48106,article,ellin:1989,,,1989,,[Comment on \citet{streminger:1989}],[Comment on Streminger (1989)],,,,hume-studies,15,2,295--300,295,,,,,,,,,,,,,,,,,,,english,false,,,ellin,,,1:history_of_philosophy
48107,article,ellin:1993,,,1993,,Again: Hume on Miracles,Again: Hume on Miracles,,,,hume-studies,19,1,203--212,203,,,,,,,,,,,,,,,,,,,english,false,,,ellin,,,1:causation;2:causal_closure;3:miracles
48108,incollection,ellingsen_dm-etal:2016,,,2016,,Hedonic Value,Hedonic Value,,,,,,,265--286,265,,,,,,,,,,,,,,,,,,,english,false,,,ellingsen_dm;leknes;kringelbach_ml,,,1:ethics;2:metaethics;3:hedonism
48109,incollection,ellingsen_dm-etal:2019,,,2019,,A Neuroscience Perspective on Pleasure and Pain,A Neuroscience Perspective on Pleasure and Pain,,,,,,,60--78,60,,,,,,,,,,,,,,,,,,,english,false,,,ellingsen_dm;kringelbach_ml;leknes,,,1:feeling;2:pain
48110,article,elliot_c-brzezinski:1998,,,1998,,Autonomous Agents as Synthetic Characters,Autonomous Agents as Synthetic Characters,,,,the-ai-magazine,19,2,13--30,13,,,,,,,,,,,,,,,,,,,english,false,,,elliot_c;brzezinski_ja,,,1:action
48111,article,elliot_r-gallois:1984,,,1984,,Would It Have Been Me? (Against the Necessity of Origin),Would It Have Been Me? (Against the Necessity of Origin),,,,australasian-journal-of-philosophy,62,,292--293,292,,,,,,,,,,,,,,,,,,,english,false,,,elliot_r;gallois_an,,,2:essence;3:essentiality_of_origin
48112,article,elliot_r-smith:1978,,,1978,,"Descartes, God and the Evil Spirit","Descartes, God and the Evil Spirit",,,,sophia-international-journal-for-philosophy-of-religion-metaphysical-theology-and-ethics,17,3,33--36,33,,,,,,,,,,,,,,,,,,,english,false,,,elliot_r;smith_ma,,,1:skepticism;2:evil_demon
48113,article,elliot_r:1989,,,1989,,"Prior, Intermittent Identity and Leibniz' Law","Prior, Intermittent Identity and Leibniz' Law",,,,logique-et-analyse,32,125/126,55--60,55,,,,,,,,,,,,,,,,,,,english,false,,,elliot_r,,,1:identity
48114,article,elliot_r:1991,,,1991,,Personal Identity and the Causal Continuity Requirement,Personal Identity and the Causal Continuity Requirement,,,,the-philosophical-quarterly,41,162,55--75,55,,,,,,,,,,,,,,,,,10.2307/2219786,,english,false,,,elliot_r,,,1:persons;2:personal_identity
48115,incollection,elliot_r:1991a,,,1991,,Environmental Ethics,Environmental Ethics,,,,,,,284--293,284,,,,,,,,,,,,,,,,,,,english,false,,,elliot_r,,,1:ethics;2:environmental_ethics
48116,article,elliot_r:1992,,,1992,,"Intrinsic Value, Environmental Obligation and Naturalness","Intrinsic Value, Environmental Obligation and Naturalness",,,,the-monist,75,2,138--160,138,,,,,,,,,,,,,,,,,,,english,false,,,elliot_r,,,2:intrinsic_value
48117,incollection,elliot_r:1994,,,1994,,Ecology and the Ethics of Environmental Restoration,Ecology and the Ethics of Environmental Restoration,,,,,,,31--43,31,,,,,,,,,,,,,,,,,,,english,false,,,elliot_r,,,1:ethics;2:bioethics
48118,incollection,elliot_r:2001,,,2001,,Normative Ethics,Normative Ethics,,,,,,,177--191,177,,,,,,,,,,,,,,,,,,,english,false,,,elliot_r,,,1:ethics
48119,book,elliott_a-prager:2016,,,2016,,The Routledge Handbook of Psychoanalysis in the Social Sciences and Humanities,The Routledge Handbook of Psychoanalysis in the Social Sciences and Humanities,The Routledge Handbook of Psychoanalysis in the Social Sciences and Humanities,The Routledge Handbook of Psychoanalysis in the Social Sciences and Humanities,,,,,,,,routledge_international_handbooks,London,,,routledge,,,,,,,,,,,,,english,false,,,,elliott_a;prager_j,,1:psychology;2:psychoanalysis
48120,book,elliott_a:2009,,,2009,,The Routledge Companion to Social Theory,The Routledge Companion to Social Theory,The Routledge Companion to Social Theory,The Routledge Companion to Social Theory,,,,,,,,routledge_companions,London,,,routledge,,,,,,,,,,,,,english,false,,,,elliott_a,,1:social_philosophy
48121,book,elliott_a:2011,,,2011,,The Routledge Handbook of Identity Studies,The Routledge Handbook of Identity Studies,The Routledge Handbook of Identity Studies,The Routledge Handbook of Identity Studies,,,,,,,,routledge_international_handbooks,London,,,routledge,,,Second edition: \citet{elliott_a:2019},Second edition: Elliott (2019),,,,,,,,,english,false,,,,elliott_a,,1:identity;2:personal_identity
48122,book,elliott_a:2019,,,2019,,The Routledge Handbook of Identity Studies,The Routledge Handbook of Identity Studies,The Routledge Handbook of Identity Studies,The Routledge Handbook of Identity Studies,,,,,,,,routledge_international_handbooks,London,,,routledge,,2,First edition: \citet{elliott_a:2011},First edition: Elliott (2011),,,,,,,,,english,false,,,,elliott_a,,1:persons;2:personal_identity
48123,book,elliott_a:2021,,,2021,,The Routledge Handbook of Social and Cultural Theory,The Routledge Handbook of Social and Cultural Theory,The Routledge Handbook of Social and Cultural Theory,The Routledge Handbook of Social and Cultural Theory,,,,,,,,routledge_international_handbooks,London,,,routledge,,2,,,,,,,,,,,english,false,,,,elliott_a,,1:social_sciences
48124,book,elliott_a:2021a,,,2021,,The Routledge Social Science Handbook of AI,The Routledge Social Science Handbook of AI,The Routledge Social Science Handbook of AI,The Routledge Social Science Handbook of AI,,,,,,,,routledge_international_handbooks,London,,,routledge,,,,,,,,,,,,,english,false,,,,elliott_a,,1:ai
48125,incollection,elliott_a:2021b,,,2021,,The Trajectories of Social and Cultural Theory,The Trajectories of Social and Cultural Theory,,,,,,,3--20,3,,,,,,,,,,,,,,,,,,,english,false,,,elliott_a,,,1:structuralism;2:post_structuralism
48126,incollection,elliott_a:2021c,,,2021,,Structuration Theories: Giddens and Bourdieu,Structuration Theories: Giddens and Bourdieu,,,,,,,57--75,57,,,,,,,,,,,,,,,,,,,english,false,,,elliott_a,,,1:structuralism;2:post_structuralism
48127,incollection,elliott_a:2021d,,,2021,,Psychoanalytic Social Theory,Psychoanalytic Social Theory,,,,,,,140--160,140,,,,,,,,,,,,,,,,,,,english,false,,,elliott_a,,,1:psychology;2:psychoanalysis
48128,incollection,elliott_a:2021e,,,2021,,Posthumanism,Posthumanism,,,,,,,367--382,367,,,,,,,,,,,,,,,,,,,english,false,,,elliott_a,,,1:structuralism;2:post_structuralism
48129,article,elliott_ap:2014,,,2014,,Can Moral Principles Explain Supervenience?,Can Moral Principles Explain Supervenience?,,,,res-philosophica,91,4,629--659,629,,,,,,,,,,,,,,,,,,,english,false,,,elliott_ap,,,2:supervenience;3:moral_supervenience
48130,article,elliott_ap:2017,,,2017,,"Reasons, Dispositions, and Value","Reasons, Dispositions, and Value",,,,philosophers-imprint,17,23,,,,,,,,,,,,,,,,,,http://hdl.handle.net/2027/spo.3521354.0017.023,,http://hdl.handle.net/2027/spo.3521354.0017.023,english,false,,,elliott_ap,,,1:epistemology;2:justification;3:reasons_for_belief
48131,incollection,elliott_b:2005a,,,2005,,Reduced Phenomena and Unreserved Debts in Marion's Reading of Heidegger,Reduced Phenomena and Unreserved Debts in Marion's Reading of Heidegger,,,,,,,87--100,87,,,,,,,,,,,,,,,,,,,english,false,,,elliott_b,,,1:ontology;2:being
48132,article,elliott_b:2009,,,2009,,"Theories of Community in Habermas, Nancy and Agamben: A Critical Evaluation","Theories of Community in Habermas, Nancy and Agamben: A Critical Evaluation",,,,philosophy-compass,4,6,893--903,893,,,,,,,,,,,,,,,,,,,english,false,,,elliott_b,,,1:political_philosophy
48133,incollection,elliott_b:2012,,,2012,,"The Unity of Thought in Aristotle, Kant, and Heidegger","The Unity of Thought in Aristotle, Kant, and Heidegger",,,,,,,491--518,491,,,,,,,,,,,,,,,,,,,english,false,,,elliott_b,,,2:cognition;3:thinking
48134,incollection,elliott_b:2020,,,2020,,Constructing Communities in Urban Spaces,Constructing Communities in Urban Spaces,,,,,,,193--202,193,,,,,,,,,,,,,,,,,,,english,false,,,elliott_b,,,1:history_of_philosophy
48135,incollection,elliott_c:2009,,,2009,,Patients Doubtfully Capable or Incapable of Consent,Patients Doubtfully Capable or Incapable of Consent,,,,,,,541--550,541,,,,,,,,,,,,,,,,,,,english,false,,,elliott_c,,,1:medicine;2:medical_ethics
48136,incollection,elliott_c:2016,,,2016,,Medicine as a Commodity,Medicine as a Commodity,,,,,,,519--528,519,,,,,,,,,,,,,,,,,,,english,false,,,elliott_c,,,1:medicine
48137,book,elliott_da:2017,,,2017,,Hope and Christian Ethics,Hope and Christian Ethics,,,,,,,,,,,Cambridge,,,cambridge-university-press,,,,,,,,,,,10.1017/9781316659458,,english,false,,,elliott_da,,,1:ethics;2:religious_ethics
48138,book,elliott_de-spence:2017,,,2017,,Ethics for a Digital Era,Ethics for a Digital Era,,,,,,,,,,,Chichester,,,wiley-blackwell,,,,,,,,,,,,,english,false,,,elliott_de;spence_eh,,,1:ethics
48139,incollection,elliott_de:2009,,,2009,,Media Ethics,Media Ethics,,,,,,,452--454,452,,,,,,,,,,,,,,,,,,,english,false,,,elliott_de,,,1:information;2:ethics_of_information
48140,incollection,elliott_dy:2012,,,2012,,\emph{Raptus}/Rapture,Raptus/Rapture,,,,,,,189--199,189,,,,,,,,,,,,,,,,,,,english,false,,,elliott_dy,,,1:religion;2:eschatology
48141,article,elliott_e-etal:2013,,,2013,,Epistemic Two-Dimensionalism and Arguments from Epistemic Misclassification,Epistemic Two-Dimensionalism and Arguments from Epistemic Misclassification,,,,australasian-journal-of-philosophy,91,2,375--389,375,,,,,,,,,,,,,,,,,,,english,false,,,elliott_e;mcqueen_kj;weber_c,,,1:representation;2:2d
48142,article,elliott_e:2017,,,2017,,A Representation Theorem for Frequently Irrational Agents,A Representation Theorem for Frequently Irrational Agents,,,,journal-of-philosophical-logic,46,5,467--506,467,,,,,,,,,,,,,,,,,,,english,false,,,elliott_e,,,1:decision_theory
48143,article,elliott_e:2017a,,,2017,,Ramsey without Ethical Neutrality: A New Representation Theorem,Ramsey without Ethical Neutrality: A New Representation Theorem,,,,mind,126,501,1--51,1,,,,,,,,,,,,,,,,,,,english,false,,,elliott_e,,,1:ethics
48144,article,elliott_e:2019,,,2019,,Normative Decision Theory,Normative Decision Theory,,,,analysis,79,4,755--772,755,,,,,,,,,,,,,,,,,,,english,false,,,elliott_e,,,1:decision_theory
48145,incollection,elliott_g:1987,,,1987,,"Further Adventures of the Dialectic: Merleau-Ponty, Sartre, Althusser","Further Adventures of the Dialectic: Merleau-Ponty, Sartre, Althusser",,,,,,,195--214,195,,,,,,,,,,,,,,,,,,,english,false,,,elliott_g,,,1:history_of_philosophy
48146,incollection,elliott_j-etal:2000,,,2000,,Increasing our Ignorance of Language: Identifying Language Structure in an Unknown `Signal',Increasing our Ignorance of Language: Identifying Language Structure in an Unknown ‘Signal',,,,,,,25--30,25,,,,,,,,,,,,,,,,,,,english,false,,,elliott_j;antwell_e;whyte_b,,,1:ai;2:machine_learning;3:machine_language_learning
48147,incollection,elliott_j:2011,,,2011,,Austin and Frege: Unum Verum Bonum,Austin and Frege: Unum Verum Bonum,,,,,,,41--52,41,,,,,,,,,,,,,,,,,,,english,false,,,elliott_j,,,1:language
