id,entry_type,bibkey,options,shorthand,date_year,pubstate,title_latex,title_unicode,booktitle_latex,booktitle_unicode,crossref,journal_key,volume,number,pages,start_page,eid,series_key,address,institution_key,school_key,publisher_key,type_field,edition,note_latex,note_unicode,issuetitle_latex,issuetitle_unicode,extra_note_latex,extra_note_unicode,urn,eprint,doi,url,langid,is_translation,epoch,license,author_keys,editor_keys,guesteditor_keys,keyword_keys
49993,book,ezcurdia-hansberg:2003,,,2003,,La naturaleza de la experiencia.~Volumen I: Sensaciones,La naturaleza de la experiencia. Volumen I: Sensaciones,La naturaleza de la experiencia.~Volumen I: Sensaciones,La naturaleza de la experiencia. Volumen I: Sensaciones,,,,,,,,,"M{\'e}xico, D.F.",,,instituto-de-investigaciones-filosoficas-universidad-nacional-autonoma-de-mexico,,,,,,,,,,,,,spanish,false,,,,ezcurdia;hansberg,,1:perception;2:experience
49994,book,ezcurdia-stainton:2013,,,2013,,The Semantics-Pragmatics Boundary in Philosophy,The Semantics-Pragmatics Boundary in Philosophy,The Semantics-Pragmatics Boundary in Philosophy,The Semantics-Pragmatics Boundary in Philosophy,,,,,,,,,"Peterborough, Ontario",,,broadview-press,,,,,,,,,,,,,english,false,,,,ezcurdia;stainton_r,,1:language
49995,article,ezcurdia:1995,,,1995,,Modos de presentaci{\'o}n y modos de determinaci{\'o}n,Modos de presentación y modos de determinación,,,,critica-revista-hispanoamericana-de-filosofia,27,80,57--96,57,,,,,,,,,,,,,,,,,,,spanish,false,,,ezcurdia,,,1:representation;2:fregean_sense
49996,incollection,ezcurdia:1996,,,1996,,Dynamic and Coherent Thoughts,Dynamic and Coherent Thoughts,,,,,,,105--140,105,,,,,,,,,,,,,,,,,,,english,false,,,ezcurdia,,,
49997,article,ezcurdia:1996a,,,1996,,Nota Cr{\'{\i}}tica sobre \citet{neale:1990},Nota Crítica sobre Neale (1990),,,,critica-revista-hispanoamericana-de-filosofia,28,83,97--129,97,,,,,,,,,,,,,,,,,,,spanish,false,,,ezcurdia,,,1:reference;2:definite_descriptions
49998,incollection,ezcurdia:1998,,,1998,,The Concept-Conception Distinction [on \citet{higginbotham:1998b}],The Concept-Conception Distinction [on Higginbotham (1998)],,,,,,,187--192,187,,,,,,,,,,,,,,,,,,,english,false,,,ezcurdia,,,1:representation;2:concepts
49999,article,ezcurdia:2000,,,2000,,Review of \citet{garciacarpintero:1996},Review of García-Carpintero (1996),,,,dialectica,54,3,225--226,225,,,,,,,,,,,,,,,,,10.48106/dial.v54.i3.04,,english,false,,,ezcurdia,,,1:language
50000,incollection,ezcurdia:2001,,,2001,,Thinking about Myself,Thinking about Myself,,,,,,,179--204,179,,,,,,,,,,,,,,,,,,,english,false,,,ezcurdia,,,1:representation;2:de_se;3:egocentric_beliefs
50001,article,ezcurdia:2004,,,2004,,Pragmatic Attitudes and Semantic Competence [on \citet{soames:2002}],Pragmatic Attitudes and Semantic Competence [on Soames (2002)],,,,critica-revista-hispanoamericana-de-filosofia,36,108,55--82,55,,,,,,,,,,,,,,,,,,,english,false,,,ezcurdia,,,1:belief;2:belief_reports
50002,article,ezcurdia:2004a,,,2004,,Nota Cr{\'{\i}}tica sobre \citet{soames:2002},Nota Crítica sobre Soames (2002),,,,critica-revista-hispanoamericana-de-filosofia,36,108,115--142,115,,,,,,,,,,,,,,,,,,,spanish,false,,,ezcurdia,,,1:reference;2:rigidity
50003,incollection,ezcurdia:2017,,,2017,,The Semantics-Pragmatics Distinction and Context-Sensitivity,The Semantics-Pragmatics Distinction and Context-Sensitivity,,,,,,,441--454,441,,,,,,,,,,,,,,,,,,,english,false,,,ezcurdia,,,1:language;2:semantics_pragmatics
50004,incollection,ezcurdia:2017a,,,2017,,Semantic Complexity,Semantic Complexity,,,,,,,73--103,73,,,,,,,,,,,,,,,,,,,english,false,,,ezcurdia,,,1:representation
50005,article,eze:1999,,,1999,,Philosophy and the ``Man'' in the Humanities,Philosophy and the “Man” in the Humanities,,,,topoi,18,1,49--58,49,,,,,,,,,,,,,,,,,,,english,false,,,eze,,,1:social_sciences;2:anthropology
50006,incollection,ezeiza-etal:1998,,,1998,,Combining Stochastic and Rule-Based Methods for Disambiguation in Agglutinative Languages,Combining Stochastic and Rule-Based Methods for Disambiguation in Agglutinative Languages,,,,,,,379--384,379,,,,,,,,,,,,,,,,,,,english,false,,,ezeiza;alegria_i;arriola_jm;urizar_r;aduriz,,,1:linguistics;2:lexicon
50007,incollection,ezorsky:1960,,,1960,,Wishing Won't -- But Wanting Will,Wishing Won't – But Wanting Will,,,,,,,252--258,252,,,,,,,,,,,,,,,,,,,english,false,,,ezorsky,,,1:representation;2:concepts
50008,incollection,ezorsky:1969,,,1969,,A Note on Metaphysics and Language,A Note on Metaphysics and Language,,,,,,,291--292,291,,,,,,,,,,,,,,,,,,,english,false,,,ezorsky,,,1:language;2:logical_structure;3:logical_form
50009,book,ezorsky:1991,,,1991,,Racism and Justice: The Case for Affirmative Action,Racism and Justice: The Case for Affirmative Action,,,,,,,,,,,"Ithaca, New York",,,cornell-university-press,,,,,,,,,,,,,english,false,,,ezorsky,,,1:political_philosophy;2:discrimination;3:racism
50010,book,ezquerro-larrazabal:1992,,,1992,,"Cognition, Semantics and Philosophy","Cognition, Semantics and Philosophy","Cognition, Semantics and Philosophy","Cognition, Semantics and Philosophy",,,,52,,,,philosophical_studies_series,Dordrecht,,,d-reidel-publishing-co,,,,,,,,,,,,,english,false,,,,ezquerro;larrazabal,,1:psychology
50011,article,ezquerro-martinezmanrique:2004,,,2004,,Intertheory Relations in Cognitive Science: Privileged Levels and Reductive Strategies,Intertheory Relations in Cognitive Science: Privileged Levels and Reductive Strategies,,,,critica-revista-hispanoamericana-de-filosofia,36,106,55--103,55,,,,,,,,,,,,,,,,,,,english,false,,,ezquerro;martinezmanrique,,,2:reduction
50012,incollection,ezquerro-martinezmanrique:2004a,,,2004,,Epistemology and Cognitive Theorizing,Epistemology and Cognitive Theorizing,,,,,,,133--156,133,,,,,,,,,,,,,,,,,,,english,false,,,ezquerro;martinezmanrique,,,1:epistemology
50013,book,ezra:2002,,,2002,,The Withdrawal of Rights.~Rights from a Different Perspective,The Withdrawal of Rights. Rights from a Different Perspective,,,,,,314,,,,synthese_library,Dordrecht,,,kluwer-academic-publishers,,,,,,,,,,,,,english,false,,,ezra,,,1:political_philosophy
50014,incollection,ezra:2015,,,2015,,Distributive Justice,Distributive Justice,,,,,,,75--94,75,,,,,,,,,,,,,,,,,,,english,false,,,ezra,,,1:political_philosophy;2:justice;3:distributive_justice
50015,incollection,ezrahi:1986,,,1986,,Knowledge and Power in the Sciences: A Comment [on \citet{mendelsohn_e:1986}],Knowledge and Power in the Sciences: A Comment [on Mendelsohn (1986)],,,,,,,241--246,241,,,,,,,,,,,,,,,,,,,english,false,,,ezrahi,,,1:science;2:sociology_of_science
50016,book,ezrahi:2012,,,2012,,Imagined Democracies: Necessary Political Fictions,Imagined Democracies: Necessary Political Fictions,,,,,,,,,,,Cambridge,,,cambridge-university-press,,,,,,,,,,,,,english,false,,,ezrahi,,,1:political_philosophy
