id,entry_type,bibkey,options,shorthand,date_year,pubstate,title_latex,title_unicode,booktitle_latex,booktitle_unicode,crossref,journal_key,volume,volume_numeric,number,number_numeric,pages,start_page,eid,series_key,address,institution_key,school_key,publisher_key,type_field,edition,note_latex,note_unicode,issuetitle_latex,issuetitle_unicode,extra_note_latex,extra_note_unicode,urn,eprint,doi,url,langid,is_translation,epoch,license,author_keys,editor_keys,guesteditor_keys,keyword_keys
53819,incollection,foa_j:2011,,,2011,,Peace Commissioners at the Beginning of the Wars of Religion: Toward an Interactionist Interpretation of the Pacification Process in France,Peace Commissioners at the Beginning of the Wars of Religion: Toward an Interactionist Interpretation of the Pacification Process in France,,,,,,,,,239--264,239,,,,,,,,,,,,,,,,,,,english,false,,,foa_j,,,1:religion;2:religious_pluralism;3:religious_tolerance
53820,book,foa_p:1977,,,1977,,Feminism and Philosophy,Feminism and Philosophy,Feminism and Philosophy,Feminism and Philosophy,,,,,,,,,,,"Totowa, New Jersey",,,littlefield-adams-company,,,,,,,,,,,,,english,false,,,foa_p,,,1:social_philosophy
53821,incollection,foa_p:1977a,,,1977,,What's Wrong with Rape,What's Wrong with Rape,,,,,,,,,,,,,,,,,,,Reprinted in \citet[583--593]{baker_rb-etal:1998},"Reprinted in Baker, Wininger, and Elliston (1998)",,,,,,,,,english,false,,,foa_p,,,1:ethics;2:sexual_consent;3:rape
53822,book,fobaustier:2004,,,2004,,John Locke : le droit avant l'Etat,John Locke : le droit avant l'Etat,,,,,,,,,,,,le_bien_commun,Paris,,,michalon,,,,,,,,,,,,,french,false,,,fobaustier,,,1:political_philosophy
53823,article,fock:1965,,,1965,,La physique quantique et les id{\'e}alisations classiques,La physique quantique et les idéalisations classiques,,,,dialectica,19,19,75/76,75,223--245,223,,,,,,,,,,,,,,,,,10.1111/j.1746-8361.1965.tb00471.x,,french,false,,,fock,,,1:quantum_mechanics
53824,book,focquaert_f-etal:2021,,,2021,,The Routledge Handbook of the Philosophy and Science of Punishment,The Routledge Handbook of the Philosophy and Science of Punishment,The Routledge Handbook of the Philosophy and Science of Punishment,The Routledge Handbook of the Philosophy and Science of Punishment,,,,,,,,,,routledge_handbooks_in_philosophy,London,,,routledge,,,,,,,,,,,,,english,false,,,,focquaert_f;shaw_e;waller_bn,,1:law;3:punishment
53825,incollection,focquaert_f-etal:2021a,,,2021,,Introduction,Introduction,,,,,,,,,1--2,1,,,,,,,,,,,,,,,,,,,english,false,,,focquaert_f;shaw_e;waller_bn,,,1:law;3:punishment
53826,incollection,foddy-etal:2013,,,2013,,Practical Neuropsychiatric Ethics,Practical Neuropsychiatric Ethics,,,,,,,,,1185--1201,1185,,,,,,,,,,,,,,,,,,,english,false,,,foddy;kahane_g;savulescu,,,1:psychology;2:mental_illness
53827,article,foddy:2014,,,2014,,In Defense of a Temporal Account of Betterness,In Defense of a Temporal Account of Betterness,,,,american-philosophical-quarterly,51,51,2,2,155--166,155,,,,,,,,,,,,,,,,,,,english,false,,,foddy,,,2:comparison_of_value
53828,incollection,foddy:2016,,,2016,,Addiction: The Pleasures and Perils of Operant Behavior,Addiction: The Pleasures and Perils of Operant Behavior,,,,,,,,,49--65,49,,,,,,,,,,,,,,,,,,,english,false,,,foddy,,,1:ethics;2:addiction
53829,article,fodor_ja-etal:1980,,,1980,,Against Definitions,Against Definitions,,,,cognition,8,8,3,3,263--367,263,,,,,,,,,,,,,,,,,,,english,false,,,fodor_ja;garrett_mf;walker_ea;parkes_ch,,,1:linguistics;2:lexicon
53830,book,fodor_ja-katz:1964,,,1964,,The Structure of Language: Readings in the Philosophy of Language,The Structure of Language: Readings in the Philosophy of Language,The Structure of Language: Readings in the Philosophy of Language,The Structure of Language: Readings in the Philosophy of Language,,,,,,,,,,,"Englewood Cliffs, New Jersey",,,prentice-hall-inc,,,,,,,,,,,,,english,false,,,,fodor_ja;katz_jj,,1:semantics
53831,incollection,fodor_ja-katz:1974,,,1974,,Sprachphilosophie und Sprachwissenschaft,Sprachphilosophie und Sprachwissenschaft,,,,,,,,,,,,,,,,,,,,,,,,,,,,,german,false,,,fodor_ja;katz_jj,,,1:language
53832,article,fodor_ja-lepore:1991,,,1991,,Why Meaning (Probably) Isn't Conceptual Role,Why Meaning (Probably) Isn't Conceptual Role,,,,mind-and-language,6,6,,,328--343,328,,,,,,,,,Reprinted in \citet[15--32]{phil-issues:1993} and in \citet[9--26]{fodor_ja-lepore:2002},Reprinted in Villanueva (1993) and in Fodor and LePore (2002),,,,,,,,,english,false,,,fodor_ja;lepore,,,1:representation;2:meaning_theories;3:conceptual_role_semantics
53833,book,fodor_ja-lepore:1992,,,1992,,Holism: A Shopper's Guide,Holism: A Shopper's Guide,,,,,,,,,,,,,Oxford,,,blackwell-publishers,,,,,,,,,,,,,english,false,,,fodor_ja;lepore,,,1:language
53834,incollection,fodor_ja-lepore:1993,,,1993,,Is Intentional Ascription Intrinsically Normative?,Is Intentional Ascription Intrinsically Normative?,,,,,,,,,70--82,70,,,,,,,,,,,,,,,,,,,english,false,,,fodor_ja;lepore,,,1:representation;2:meaning
53835,article,fodor_ja-lepore:1993a,,,1993,,Replies [to Discussants of \citet{fodor_ja-lepore:1992}],Replies [to Discussants of Fodor and LePore (1992)],,,,grazer-philosophische-studien,46,46,,,303--322,303,,,,,,,,,,,Holism: A Consumer Update,Holism: A Consumer Update,,,,,,,english,false,,,fodor_ja;lepore,,fodor_ja;lepore,1:representation;2:content_determination;3:meaning_holism
53836,article,fodor_ja-lepore:1994a,,,1994,,What is the Connection Principle?,What is the Connection Principle?,,,,philosophy-and-phenomenological-research,54,54,,,837--845,837,,,,,,,,,,,,,,,,,,,english,false,,,fodor_ja;lepore,,,1:reference;2:anaphora
53837,article,fodor_ja-lepore:1996,,,1996,,"What Cannot Be Evaluated Cannot Be Evaluated, and It Cannot Be Superevaluated Either","What Cannot Be Evaluated Cannot Be Evaluated, and It Cannot Be Superevaluated Either",,,,the-journal-of-philosophy,93,93,10,10,516--535,516,,,,,,,,,Reprinted in \citet[63--87]{fodor_ja-lepore:2002},Reprinted in Fodor and LePore (2002),,,,,,,,,english,false,,,fodor_ja;lepore,,,1:vagueness;2:supervaluationism
53838,incollection,fodor_ja-lepore:1996a,,,1996,,Paul Churchland and State Space Semantics,Paul Churchland and State Space Semantics,,,,,,,,,145--158,145,,,,,,,,,Reprinted in \citet[155--173]{fodor_ja-lepore:2002},Reprinted in Fodor and LePore (2002),,,,,,,,,english,false,,,fodor_ja;lepore,,,1:representation;2:content_determination;3:meaning_holism
53839,incollection,fodor_ja-lepore:1996b,,,1996,,Reply to \citet{churchland_ps-churchland:1996f},Reply to Churchland and Churchland (1996),,,,,,,,,159--162,159,,,,,,,,,Reprinted in \citet[155--173]{fodor_ja-lepore:2002},Reprinted in Fodor and LePore (2002),,,,,,,,,english,false,,,fodor_ja;lepore,,,1:representation;2:content_determination;3:meaning_holism
53840,article,fodor_ja-lepore:1996c,,,1996,,The Red Herring and the Pet Fish: Why Concepts Still Can't Be Prototypes,The Red Herring and the Pet Fish: Why Concepts Still Can't Be Prototypes,,,,cognition,58,58,,,253--270,253,,,,,,,,,Reprinted in \citet[27--42]{fodor_ja-lepore:2002},Reprinted in Fodor and LePore (2002),,,,,,,,,english,false,,,fodor_ja;lepore,,,1:representation;2:concepts
53841,article,fodor_ja-lepore:1996d,,,1996,,All at Sea in Semantic Space: Churchland on Meaning Similarity,All at Sea in Semantic Space: Churchland on Meaning Similarity,,,,the-journal-of-philosophy,93,93,8,8,381--403,381,,,,,,,,,Reprinted in \citet[174--199]{fodor_ja-lepore:2002},Reprinted in Fodor and LePore (2002),,,,,,,10.2307/2564628,,english,false,,,fodor_ja;lepore,,,1:representation;2:meaning_theories;3:conceptual_role_semantics
53842,article,fodor_ja-lepore:1998,,,1998,,The Emptiness of the Lexicon: Reflections on James Pustejovsky's \emph{The Generative Lexicon},The Emptiness of the Lexicon: Reflections on James Pustejovsky's The Generative Lexicon,,,,linguistic-inquiry,29,29,2,2,269--288,269,,,,,,,,,Reprinted in \citet{bouillon_p-busa:2001} and in \citet[89--119]{fodor_ja-lepore:2002},Reprinted in Bouillon and Busa (2001) and in Fodor and LePore (2002),,,,,,,,,english,false,,,fodor_ja;lepore,,,1:linguistics;2:natural_language_processing;3:lexical_semantics
53843,article,fodor_ja-lepore:1999,,,1999,,Impossible Words?,Impossible Words?,,,,linguistic-inquiry,30,30,3,3,445--453,445,,,,,,,,,Reprinted in \citet[120--133]{fodor_ja-lepore:2002},Reprinted in Fodor and LePore (2002),,,,,,,,,english,false,,,fodor_ja;lepore,,,1:linguistics;2:lexicon
53844,article,fodor_ja-lepore:2001,,,2001,,Brandom's Burdens: Compositionality and Inferentialism,Brandom's Burdens: Compositionality and Inferentialism,,,,philosophy-and-phenomenological-research,63,63,2,2,465--481,465,,,,,,,,,Reprinted in \citet[135--154]{fodor_ja-lepore:2002},Reprinted in Fodor and LePore (2002),,,,,,,,,english,false,,,fodor_ja;lepore,,,1:representation;2:meaning
53845,article,fodor_ja-lepore:2001a,,,2001,,Why Compositionality Won't Go Away: Reflections on Horwich's `Deflationary' Theory,Why Compositionality Won't Go Away: Reflections on Horwich's ‘Deflationary' Theory,,,,ratio,14,14,4,4,350--368,350,,,,,,,,,Reprinted in \citet[43--62]{fodor_ja-lepore:2002},Reprinted in Fodor and LePore (2002),,,,,,,,,english,false,,,fodor_ja;lepore,,,1:representation;2:meaning
53846,book,fodor_ja-lepore:2002,,,2002,,The Compositionality Papers,The Compositionality Papers,The Compositionality Papers,The Compositionality Papers,,,,,,,,,,,Oxford,,,oxford-university-press,,,,,,,,,,,10.1093/oso/9780199252152.001.0001,,english,false,,,fodor_ja;lepore,,,1:language;2:compositionality
53847,incollection,fodor_ja-lepore:2002a,,,2002,,Geographical Introduction,Geographical Introduction,,,,,,,,,1--8,1,,,,,,,,,,,,,,,,,,,english,false,,,fodor_ja;lepore,,,1:representation;2:meaning_skepticism;3:indeterminacy_of_translation
53848,incollection,fodor_ja-lepore:2006,,,2006,,Analyticity Again,Analyticity Again,,,,,,,,,114--130,114,,,,,,,,,,,,,,,,,,,english,false,,,fodor_ja;lepore,,,1:representation;2:analyticity
53849,article,fodor_ja-lepore:2007,,,2007,,Brandom Beleaguered [on \citet{brandom:2007}],Brandom Beleaguered [on Brandom (2007)],,,,philosophy-and-phenomenological-research,74,74,3,3,677--691,677,,,,,,,,,,,,,,,,,,,english,false,,,fodor_ja;lepore,,,1:representation;2:meaning_theories;3:inferentialism_about_meaning
53850,book,fodor_ja-lepore:2010,,,2010,,The Metaphysics of Content,The Metaphysics of Content,,,,,,,,,,,,,Chichester,,,wiley-blackwell,,,,,,,,,,,,,english,false,,,fodor_ja;lepore,,,1:representation;2:content
53851,incollection,fodor_ja-lepore:2010a,,,2010,,Brandom Beleaguered,Brandom Beleaguered,,,,,,,,,181--193,181,,,,,,,,,,,,,,,,,,,english,false,,,fodor_ja;lepore,,,1:representation;2:meaning_theories;3:inferentialism_about_meaning
53852,article,fodor_ja-mclaughlin:1990,,,1990,,Connectionism and the Problem of Systematicity: Why Smolensky's Solution Doesn't Work [on \citet{smolensky:1988}],Connectionism and the Problem of Systematicity: Why Smolensky's Solution Doesn't Work [on Smolensky (1988)],,,,cognition,35,35,,,183--204,183,,,,,,,,,"Reprinted in \citet[331--355]{horgan_te-tienson:1991}, in \citet[199--222]{macdonald_c-macdonald:1995} and in \citet[90-111]{fodor_ja:1998a}","Reprinted in Horgan and Tienson (1991), in Macdonald and Macdonald (1995) and in Fodor (1998)",,,,,,,,,english,false,,,fodor_ja;mclaughlin_bp,,,1:psychology;2:cognitive_science;3:connectionism
53853,article,fodor_ja-pylyshyn:1981,,,1981,,How Direct is Visual Perception? Some Reflections on Gibson's `Ecological Approach',How Direct is Visual Perception? Some Reflections on Gibson's ‘Ecological Approach',,,,cognition,9,9,,,139--196,139,,,,,,,,,,,,,,,,,,,english,false,,,fodor_ja;pylyshyn,,,1:perception
53854,article,fodor_ja-pylyshyn:1988,,,1988,,Connectionism and Cognitive Architecture: A Critical Analysis,Connectionism and Cognitive Architecture: A Critical Analysis,,,,cognition,28,28,,,,,,,,,,,,,Reprinted in \citet[90--163]{macdonald_c-macdonald:1995},Reprinted in Macdonald and Macdonald (1995),,,,,,,,,english,false,,,fodor_ja;pylyshyn,,,1:psychology;2:cognitive_science;3:connectionism
53855,incollection,fodor_ja-pylyshyn:2003,,,2003,,Connexionisme et architecture cognitive,Connexionisme et architecture cognitive,,,,,,,,,269--328,269,,,,,,,,,Traduction de \citet{fodor_ja-pylyshyn:1988} par Genevi{\`e}ve Choquette,Traduction de Fodor and Pylyshyn (1988) par Geneviève Choquette,,,,,,,,,french,true,,,fodor_ja;pylyshyn,,,1:psychology;2:cognitive_science;3:connectionism
53856,book,fodor_ja-pylyshyn:2015,,,2015,,Minds without Meanings: An Essay on the Content of Concepts,Minds without Meanings: An Essay on the Content of Concepts,,,,,,,,,,,,,"Cambridge, Massachusetts",,,the-mit-press,,,,,,,,,,,10.7551/mitpress/9780262027908.001.0001,,english,false,,,fodor_ja;pylyshyn,,,1:representation;2:concepts
53857,article,fodor_ja:1965,,,1965,,Could Meaning Be an R$_m$?,Could Meaning Be an R_m?,,,,journal-of-verbal-learning-and-verbal-behavior,4,4,2,2,73--81,73,,,,,,,,,Reprinted in \citet{steinberg_dd-jacobovits:1971},Reprinted in Steinberg and Jacobovits (1971),,,,,,,10.1016/s0022-5371(65)80087-1,,english,false,,,fodor_ja,,,1:representation;2:meaning
53858,incollection,fodor_ja:1965a,,,1965,,Explanations in Psychology,Explanations in Psychology,,,,,,,,,161--179,161,,,,,,,,,,,,,,,,,,,english,false,,,fodor_ja,,,1:explanation;2:explanation_in_psychology
53859,book,fodor_ja:1968,,,1968,,Psychological Explanation: An Introduction to the Philosophy of Psychology,Psychological Explanation: An Introduction to the Philosophy of Psychology,,,,,,,,,,,,,New York,,,random-house,,,,,,,,,,,,,english,false,,,fodor_ja,,,1:psychology
53860,article,fodor_ja:1968a,,,1968,,The Appeal to Tacit Knowledge in Psychological Explanation,The Appeal to Tacit Knowledge in Psychological Explanation,,,,the-journal-of-philosophy,65,65,,,627--640,627,,,,,,,,,Reprinted in \citet[63--78]{fodor_ja:1981},Reprinted in Fodor (1981),,,,,,,,,english,false,,,fodor_ja,,,1:psychology
53861,article,fodor_ja:1970,,,1970,,Troubles about Actions,Troubles about Actions,,,,synthese,21,21,3/4,3,298--319,298,,,,,,,,,Reprinted in \citet[48--69]{davidson_d-harman:1972},Reprinted in Davidson and Harman (1972),,,,,,,,,english,false,,,fodor_ja,,,1:action
53862,book,fodor_ja:1972,,,1972,,L'explication en psychologie,L'explication en psychologie,,,,,,,,,,,,,Paris,,,seghers,,,,,,,,,,,,,french,true,,,fodor_ja,,,1:explanation;2:explanation_in_psychology
53863,article,fodor_ja:1974,,,1974,,"Special Sciences, or the Disunity of Science as a Working Hypothesis","Special Sciences, or the Disunity of Science as a Working Hypothesis",,,,synthese,28,28,,,97--115,97,,,,,,,,,Reprinted in \citet[120--133]{block_n:1980} and in \citet[127--145]{fodor_ja:1981},Reprinted in Block (1980) and in Fodor (1981),,,,,,,,,english,false,,,fodor_ja,,,1:science
53864,book,fodor_ja:1975,,,1975,,The Language of Thought,The Language of Thought,,,,,,,,,,,,,New York,,,thomas-a-crowell-co,,,,,,,,,,,,,english,false,,,fodor_ja,,,1:representation;2:mental_representation
53865,article,fodor_ja:1978,,,1978,,Propositional Attitudes,Propositional Attitudes,,,,the-monist,61,61,4,4,501--523,501,,,,,,,,,Reprinted in \citet[177--203]{fodor_ja:1981},Reprinted in Fodor (1981),,,,,,,,,english,false,,,fodor_ja,,,1:representation;2:objects_of_propositional_attitudes
53866,article,fodor_ja:1978a,,,1978,,Tom Swift and His Procedural Grandmother,Tom Swift and His Procedural Grandmother,,,,cognition,6,6,,,229--247,229,,,,,,,,,Reprinted in \citet[204--224]{fodor_ja:1981},Reprinted in Fodor (1981),,,,,,,,,english,false,,,fodor_ja,,,1:representation;2:mental_representation
53867,incollection,fodor_ja:1978b,,,1978,,Computation and Reduction,Computation and Reduction,,,,,,,,,229--260,229,,,,,,,,,Reprinted in \citet[146--175]{fodor_ja:1981},Reprinted in Fodor (1981),,,,,,,,,english,false,,,fodor_ja,,,2:functionalism;3:functionalism_in_the_philosophy_of_mind
53868,article,fodor_ja:1980,,,1980,,Methodological Solipsism Considered as a Research Strategy in Cognitive Psychology,Methodological Solipsism Considered as a Research Strategy in Cognitive Psychology,,,,behavioral-and-brain-sciences,3,3,,,63--73,63,,,,,,,,,"Reprinted in \citet[225--255]{fodor_ja:1981}, in \citet[307--338]{haugeland:1981} and \citet{boyd_ri-etal:1991}","Reprinted in Fodor (1981), in Haugeland (1981) and Boyd, Gasper, and Trout (1991)",,,,,,,,,english,false,,,fodor_ja,,,1:psychology;2:cognitive_science
53869,article,fodor_ja:1980a,,,1980,,Searle on What Only Brains Can Do,Searle on What Only Brains Can Do,,,,behavioral-and-brain-sciences,3,3,,,,,,,,,,,,,,,,,,,,,,,english,false,,,fodor_ja,,,1:skepticism;2:brains_in_a_vat
53870,article,fodor_ja:1980b,,,1980,,Replies to Commentators on \citet{fodor_ja:1980},Replies to Commentators on Fodor (1980),,,,behavioral-and-brain-sciences,3,3,,,99--109,99,,,,,,,,,,,,,,,,,,,english,false,,,fodor_ja,,,
53871,incollection,fodor_ja:1980c,,,1980,,Reply to \citet{putnam_h:1980b},Reply to Putnam (1980),,,,,,,,,,,,,,,,,,,,,,,,,,,,,english,false,,,fodor_ja,,,1:representation;2:ideas;3:innate_ideas
53872,incollection,fodor_ja:1980d,,,1980,,On the Impossibility of Acquiring `More Powerful' Structures,On the Impossibility of Acquiring ‘More Powerful' Structures,,,,,,,,,,,,,,,,,,,,,,,,,,,,,english,false,,,fodor_ja,,,1:representation;2:ideas;3:innate_ideas
53873,incollection,fodor_ja:1980e,,,1980,,Les sciences particuli{\`e}res (l'absence d'unit{\'e} de la science: une hypoth{\`e}se de travail),Les sciences particulières (l'absence d'unité de la science: une hypothèse de travail),,,,,,,,,417--440,417,,,,,,,,,"Special Sciences or: The Disunity of Science as a Working Hypothesis, 1974, trad.~P.~Jacob","Special Sciences or: The Disunity of Science as a Working Hypothesis, 1974, trad. P. Jacob",,,,,,,,,french,false,,,fodor_ja,,,1:science;2:unity_of_science
53874,book,fodor_ja:1981,,,1981,,Representations: Philosophical Essays on the Foundations of Cognitive Science,Representations: Philosophical Essays on the Foundations of Cognitive Science,Representations: Philosophical Essays on the Foundations of Cognitive Science,Representations: Philosophical Essays on the Foundations of Cognitive Science,,,,,13,13,,,,harvester_studies_in_cognitive_science,Brighton,,,harvester-press,,,,,,,,,,,,,english,false,,,fodor_ja,,,1:psychology
53875,incollection,fodor_ja:1981a,,,1981,,Introduction: Something on the State of the Art,Introduction: Something on the State of the Art,,,,,,,,,1--33,1,,,,,,,,,,,,,,,,,,,english,false,,,fodor_ja,,,1:psychology
53876,incollection,fodor_ja:1981b,,,1981,,Three Cheers for Propositional Attitudes,Three Cheers for Propositional Attitudes,,,,,,,,,100--125,100,,,,,,,,,,,,,,,,,,,english,false,,,fodor_ja,,,1:psychology
53877,incollection,fodor_ja:1981c,,,1981,,Introduction: Some Notes on What Linguistics is About,Introduction: Some Notes on What Linguistics is About,,,,,,,,,97--107,97,,,,,,,,,,,,,,,,,,,english,false,,,fodor_ja,,,1:linguistics
53878,incollection,fodor_ja:1981d,,,1981,,The Present Status of the Innateness Controversy,The Present Status of the Innateness Controversy,,,,,,,,,257--315,257,,,,,,,,,,,,,,,,,,,english,false,,,fodor_ja,,,1:psychology
53879,article,fodor_ja:1981e,,,1981,,The Mind-Body Problem,The Mind-Body Problem,,,,scientific-american,244,244,,,114--125,114,,,,,,,,,Reprinted in \citet[24--40]{warner_r-szubka:1994},Reprinted in Warner and Szubka (1994),,,,,,,,,english,false,,,fodor_ja,,,1:mind_body;2:physicalism
53880,article,fodor_ja:1982,,,1982,,Cognitive Science and the Twin-Earth Problem,Cognitive Science and the Twin-Earth Problem,,,,notre-dame-journal-of-formal-logic,23,23,1,1,98--119,98,,,,,,,,,,,,,,,,,,,english,false,,,fodor_ja,,,1:representation;2:content;3:narrow_content
53881,book,fodor_ja:1983,,,1983,,The Modularity of Mind: An Essay on Faculty Psychology,The Modularity of Mind: An Essay on Faculty Psychology,,,,,,,,,,,,,"Cambridge, Massachusetts",,,the-mit-press,,,,,,,,,,,,,english,false,,,fodor_ja,,,2:cognition
53882,incollection,fodor_ja:1983a,,,1983,,A Reply to \citet{loar:1983},A Reply to Loar (1983),,,,,,,,,644--653,644,,,,,,,,,,,,,,,,,,,english,false,,,fodor_ja,,,1:representation;2:objects_of_propositional_attitudes;3:objects_of_belief
53883,article,fodor_ja:1984,,,1984,,Observation Reconsidered,Observation Reconsidered,,,,philosophy-of-science,51,51,1,1,23--43,23,,,,,,,,,Reprinted in \citet[251--252]{fodor_ja:1990},Reprinted in Fodor (1990),,,,,,,10.1086/289162,,english,false,,,fodor_ja,,,1:perception
53884,article,fodor_ja:1984a,,,1984,,"Semantics, Wisconsin Style","Semantics, Wisconsin Style",,,,synthese,59,59,3,3,231--250,231,,,,,,,,,Reprinted in \citet[1--18]{silvers_s:1989} and in \citet[31--50]{fodor_ja:1990},Reprinted in Silvers (1989) and in Fodor (1990),,,,,,,,,english,false,,,fodor_ja,,,1:information;2:information_flow_theory
53885,article,fodor_ja:1985,,,1985,,Fodor's Guide to Mental Representation: The Intelligent Auntie's Vade-Mecum,Fodor's Guide to Mental Representation: The Intelligent Auntie's Vade-Mecum,,,,mind,94,94,,,76--100,76,,,,,,,,,Reprinted in \citet[22--50]{greenwood_jd:1991} and in \citet[3--30]{fodor_ja:1990},Reprinted in Greenwood (1991) and in Fodor (1990),,,,,,,,,english,false,,,fodor_ja,,,1:representation;2:mental_representation;3:lot
53886,article,fodor_ja:1985a,,,1985,,Pr{\'e}cis of \citet{fodor_ja:1983},Précis of Fodor (1983),,,,behavioral-and-brain-sciences,8,8,,,1--42,1,,,,,,,,,Reprinted in \citet[195--206]{fodor_ja:1990},Reprinted in Fodor (1990),,,,,,,,,english,false,,,fodor_ja,,,1:representation;2:concepts
53887,article,fodor_ja:1986,,,1986,,Individualism and Supervenience,Individualism and Supervenience,,,,proceedings-of-the-aristotelian-society-supplementary-volume,60,60,,,235--262,235,,,,,,,,,,,,,,,,,,,english,false,,,fodor_ja,,,1:representation;2:content;3:narrow_content
53888,article,fodor_ja:1986a,,,1986,,Information and Association,Information and Association,,,,notre-dame-journal-of-formal-logic,27,27,3,3,307--323,307,,,,,,,,,Reprinted in \citet[80--100]{brand_m-harnish:1986},Reprinted in Brand and Harnish (1986),,,,,,,,,english,false,,,fodor_ja,,,1:information
53889,incollection,fodor_ja:1986b,,,1986,,Banish disContent,Banish disContent,,,,,,,,,1--24,1,,,,,,,,,Reprinted in \citet{lycan:1990},Reprinted in Lycan (1990),,,,,,,,,english,false,,,fodor_ja,,,1:representation;2:meaning
53890,incollection,fodor_ja:1986c,,,1986,,The Modularity of Mind,The Modularity of Mind,,,,,,,,,,,,,,,,,,,,,,,,,,,,,english,false,,,fodor_ja,,,2:metaphysics_of_mind;3:modularity_of_mind
53891,book,fodor_ja:1986d,,,1986,,La modularit{\'e} de l'esprit.~Essai sur la psychologie des facult{\'e}s,La modularité de l'esprit. Essai sur la psychologie des facultés,,,,,,,,,,,,propositions,Paris,,,editions-de-minuit,,,Traduction de \citet{fodor_ja:1983} par Abel Gerschenfeld,Traduction de Fodor (1983) par Abel Gerschenfeld,,,,,,,,,french,true,,,fodor_ja,,,
53892,book,fodor_ja:1987,,,1987,,Psychosemantics: The Problem of Meaning in the Philosophy of Mind,Psychosemantics: The Problem of Meaning in the Philosophy of Mind,,,,,,,,,,,,,"Cambridge, Massachusetts",,,the-mit-press,,,,,,,,,,,,,english,false,,,fodor_ja,,,1:representation;2:meaning
53893,article,fodor_ja:1987a,,,1987,,A Situated Grandmother,A Situated Grandmother,,,,mind-and-language,2,2,,,,,,,,,,,,,,,,,,,,,,,english,false,,,fodor_ja,,,1:logic;2:situation_theory
53894,incollection,fodor_ja:1987b,,,1987,,Why Paramecia Don't Have Mental Representations,Why Paramecia Don't Have Mental Representations,,,,,,,,,1--23,1,,,,,,,,,,,,,,,,,,,english,false,,,fodor_ja,,,1:psychology
53895,incollection,fodor_ja:1987c,,,1987,,"Modules, Frames, Fridgeons, Sleeping Dogs, and the Music of the Spheres","Modules, Frames, Fridgeons, Sleeping Dogs, and the Music of the Spheres",,,,,,,,,139--149,139,,,,,,,,,Simultaneously published in \citet[25--36]{garfield:1987},Simultaneously published in Garfield (1987),,,,,,,,,english,false,,,fodor_ja,,,1:causation;2:causal_reasoning;3:frame_problem
53896,article,fodor_ja:1988,,,1988,,A Reply to \citet{churchland_pm:1988},A Reply to Churchland (1988),,,,philosophy-of-science,55,55,2,2,188--198,188,,,,,,,,,Reprinted in \citet[253--264]{fodor_ja:1990},Reprinted in Fodor (1990),,,,,,,,,english,false,,,fodor_ja,,,1:psychology;2:cognitive_science
53897,article,fodor_ja:1989,,,1989,,Making Mind Matter More,Making Mind Matter More,,,,philosophical-topics,17,17,1,1,59--80,59,,,,,,,,,Reprinted in \citet[137--160]{fodor_ja:1990},Reprinted in Fodor (1990),,,,,,,,,english,false,,,fodor_ja,,,
53898,article,fodor_ja:1989b,,,1989,,Review of \citet{schiffer:1987},Review of Schiffer (1987),,,,philosophy-and-phenomenological-research,49,49,,,409--423,409,,,,,,,,,Reprinted in \citet[177--193]{fodor_ja:1990},Reprinted in Fodor (1990),,,,,,,,,english,false,,,fodor_ja,,,1:representation;2:meaning
53899,incollection,fodor_ja:1989c,,,1989,,Why There \emph{Still} Has to Be a Language of Thought,Why There Still Has to Be a Language of Thought,,,,,,,,,23--46,23,,,,,,,,,,,,,,,,,,,english,false,,,fodor_ja,,,1:representation;2:mental_representation;3:lot
53900,book,fodor_ja:1990,,,1990,,A Theory of Content and Other Essays,A Theory of Content and Other Essays,A Theory of Content and Other Essays,A Theory of Content and Other Essays,,,,,,,,,,,"Cambridge, Massachusetts",,,the-mit-press,,,,,,,,,,,10.7551/mitpress/6765.001.0001,,english,false,,,fodor_ja,,,1:representation;2:content
53901,incollection,fodor_ja:1990a,,,1990,,"A Theory of Content, I: The Problem","A Theory of Content, I: The Problem",,,,,,,,,51--87,51,,,,,,,,,,,,,,,,,,,english,false,,,fodor_ja,,,1:language
53902,incollection,fodor_ja:1990b,,,1990,,"A Theory of Content, {II}: The Theory","A Theory of Content, II: The Theory",,,,,,,,,89--136,89,,,,,,,,,,,,,,,,,,,english,false,,,fodor_ja,,,1:language
53903,incollection,fodor_ja:1990c,,,1990,,"Psychosemantics, or Where Truth Conditions Come From","Psychosemantics, or Where Truth Conditions Come From",,,,,,,,,312--338,312,,,,,,,,,,,,,,,,,,,english,false,,,fodor_ja,,,
