id,entry_type,bibkey,options,shorthand,date_year,pubstate,title_latex,title_unicode,booktitle_latex,booktitle_unicode,crossref,journal_key,volume,volume_numeric,number,number_numeric,pages,start_page,eid,series_key,address,institution_key,school_key,publisher_key,type_field,edition,note_latex,note_unicode,issuetitle_latex,issuetitle_unicode,extra_note_latex,extra_note_unicode,urn,eprint,doi,url,langid,is_translation,epoch,license,author_keys,editor_keys,guesteditor_keys,keyword_keys
54584,incollection,forrest_p:2007b,,,2007,,The Tree of Life: Agency and Immortality in a Metaphysics Inspired by Quantum Theory,The Tree of Life: Agency and Immortality in a Metaphysics Inspired by Quantum Theory,,,,,,,,,301--318,301,,,,,,,,,,,,,,,,,,,english,false,,,forrest_p,,,1:persons;2:personal_identity
54585,incollection,forrest_p:2008,,,2008,,"Relativity, the Passage of Time and the Cosmic Clock","Relativity, the Passage of Time and the Cosmic Clock",,,,,,,,,245--253,245,,,,,,,,,,,,,,,,,,,english,false,,,forrest_p,,,1:space_spacetime;2:physical_time;3:simultaneity_in_relativity_theory
54586,incollection,forrest_p:2009,,,2009,,Razor Arguments,Razor Arguments,,,,,,,,,246--255,246,,,,,,,,,,,,,,,,,,,english,false,,,forrest_p,,,1:method;2:ockham_s_razor
54587,article,forrest_p:2009a,,,2009,,Vectors on Curved Space,Vectors on Curved Space,,,,dialectica,63,63,4,4,492--501,492,,,,,,,,,,,The Philosophy of Vectors,The Philosophy of Vectors,,,,,10.1111/j.1746-8361.2009.01219.x,,english,false,,,forrest_p,,leuenberger_s;blum_ph,1:properties;2:vectors
54588,incollection,forrest_p:2010,,,2010,,Can a Souffl{\'e} Rise Twice? Van Inwagen's Irresponsible Time-Travelers,Can a Soufflé Rise Twice? Van Inwagen's Irresponsible Time-Travelers,,,,,,,,,29--40,29,,,,,,,,,,,,,,,,,,,english,false,,,forrest_p,,,1:time;2:time_travel
54589,article,forrest_p:2010a,,,2010,,Mereotopology without Mereology,Mereotopology without Mereology,,,,journal-of-philosophical-logic,39,39,3,3,229--254,229,,,,,,,,,,,,,,,,,,,english,false,,,forrest_p,,,1:space_spacetime;2:logic_of_space;3:mereotopology
54590,article,forrest_p:2011,,,2011,,In Defence of Anthropomorphic Theism,In Defence of Anthropomorphic Theism,,,,european-journal-for-philosophy-of-religion,3,3,1,1,105--122,105,,,,,,,,,,,,,,,,,,,english,false,,,forrest_p,,,1:religion;2:theism
54591,book,forrest_p:2012,,,2012,,The Necessary Structure of the All-pervading Aether: Discrete or Continuous? Simple or Symmetric?,The Necessary Structure of the All-pervading Aether: Discrete or Continuous? Simple or Symmetric?,,,,,,,49,49,,,,philosophische_analyse_philosophical_analysis,Heusenstamm b.~Frankfurt,,,ontos-verlag,,,,,,,,,,,,,english,false,,,forrest_p,,,1:physics
54592,article,forrest_p:2013,,,2013,,Exemplification and Parthood,Exemplification and Parthood,,,,axiomathes,23,23,2,2,323--341,323,,,,,,,,,,,,,,,,,,,english,false,,,forrest_p,,,1:exemplification
54593,incollection,forrest_p:2014,,,2014,,Conflicting Intuitions about Space,Conflicting Intuitions about Space,,,,,,,,,117--134,117,,,,,,,,,,,,,,,,,,,english,false,,,forrest_p,,,1:space_spacetime
54594,article,forrest_p:2014a,,,2014,,Not Enough Powers [on \citet{leftow:2012}],Not Enough Powers [on Leftow (2012)],,,,european-journal-for-philosophy-of-religion,6,6,3,3,25--37,25,,,,,,,,,,,,,,,,,,,english,false,,,forrest_p,,,1:modality;2:contingency;3:divine_contingency
54595,incollection,forrest_p:2016,,,2016,,The Personal Pantheist Concept of God,The Personal Pantheist Concept of God,,,,,,,,,21--40,21,,,,,,,,,,,,,,,,,,,english,false,,,forrest_p,,,1:religion;2:pantheism
54596,article,forrest_p:2016a,,,2016,,Review of \citet{nerlich_gc:2013},Review of,,,,australasian-journal-of-philosophy,94,94,4,4,829--832,829,,,,,,,,,,,,,,,,,,,english,false,,,forrest_p,,,1:space_spacetime
54597,article,forrest_p:2016b,,,2016,,The Mereology of Structural Universals,The Mereology of Structural Universals,,,,logic-and-logical-philosophy,25,25,3,3,259--283,259,,,,,,,,,,,,,,,,,,,english,false,,,forrest_p,,,1:structuralism;2:structural_properties
54598,article,forrest_p:2017,,,2017,,Review of \citet{mulgan_t:2015},Review of Mulgan (2015),,,,the-philosophical-quarterly,67,67,267,267,412--415,412,,,,,,,,,,,,,,,,,,,english,false,,,forrest_p,,,1:religion;2:arguments_for_the_existence_of_god;3:teleological_argument
54599,article,forrest_p:2017a,,,2017,,Can Phenomenology Determine the Content of Thought?,Can Phenomenology Determine the Content of Thought?,,,,philosophical-studies,174,174,2,2,403--424,403,,,,,,,,,,,,,,,,,10.1007/s11098-016-0689-0,,english,false,,,forrest_p,,,1:representation;2:content_determination;3:content_externalism
54600,article,forrest_p:2017b,,,2017,,Are Thoughts Ever Experiences?,Are Thoughts Ever Experiences?,,,,american-philosophical-quarterly,54,54,1,1,47--60,47,,,,,,,,,,,,,,,,,,,english,false,,,forrest_p,,,1:representation;2:objects_of_propositional_attitudes;3:objects_of_belief
54601,article,forrest_p:2017c,,,2017,,Religious Faith and Intellectual Virtue [critical notice of \citet{callahan_lf-oconnor:2014}],Religious Faith and Intellectual Virtue [critical notice of Callahan and O'Connor (2014)],,,,analysis,77,77,3,3,633--642,633,,,,,,,,,,,,,,,,,,,english,false,,,forrest_p,,,1:religion;2:faith
54602,incollection,forrest_p:2017d,,,2017,,Theoretical Mereology,Theoretical Mereology,,,,,,,,,554--562,554,,,,,,,,,,,,,,,,,,,english,false,,,forrest_p,,,1:complexity;2:mereology
54603,article,forrest_pv:2022,,,2022,,Is All Phenomenology Presentational?,Is All Phenomenology Presentational?,,,,ergo,8,8,41,41,474--502,474,,,,,,,,,,,,,,,,,10.3998/ergo.2242,,english,false,,,forrest_pv,,,1:perception;2:phenomenal_properties
54604,incollection,forrester_db:2001,,,2001,,Social Justice and Welfare,Social Justice and Welfare,,,,,,,,,195--208,195,,,,,,,,,,,,,,,,,,,english,false,,,forrester_db,,,1:political_philosophy;2:justice
54605,book,forrester_j:2016,,,2016,,Thinking in Cases,Thinking in Cases,,,,,,,,,,,,,Chichester,,,wiley-blackwell,,,,,,,,,,,,,english,false,,,forrester_j,,,
54606,article,forrester_jw:1972,,,1972,,Plato's \emph{Parmenides}: The Structure of the First Hypothesis,Plato's Parmenides: The Structure of the First Hypothesis,,,,journal-of-the-history-of-philosophy,10,10,1,1,1--14,1,,,,,,,,,,,,,,,,,,,english,false,,,forrester_jw,,,1:ontology;2:being
54607,article,forrester_jw:1973,,,1973,,The Argument of the `Porphry Text',The Argument of the ‘Porphry Text',,,,journal-of-the-history-of-philosophy,11,11,4,4,537--539,537,,,,,,,,,,,,,,,,,,,english,false,,,forrester_jw,,,1:history_of_philosophy
54608,article,forrester_jw:1980,,,1980,,"``If, in thought, all composition be removed \dots''","“If, in thought, all composition be removed …”",,,,kant-studien,71,71,4,4,406--417,406,,,,,,,,,,,,,,,,,,,english,false,,,forrester_jw,,,1:complexity;2:simples
54609,article,forrester_jw:1984,,,1984,,"Gentle Murder, or the Adverbial Samaritan","Gentle Murder, or the Adverbial Samaritan",,,,the-journal-of-philosophy,81,81,4,4,193--197,193,,,,,,,,,,,,,,,,,,,english,false,,,forrester_jw,,,2:deontic_logic;3:contrary_to_duty_imperatives
54610,book,forrester_jw:1996,,,1996,,Being Good and Being Logical: Philosophical Groundwork for a New Deontic Logic,Being Good and Being Logical: Philosophical Groundwork for a New Deontic Logic,,,,,,,,,,,,,"Armouk, New York",,,me-sharpe,,,,,,,,,,,,,english,false,,,forrester_jw,,,2:deontic_logic
54611,book,forrester_m:1996,,,1996,,"Persons, Animals, and Fetuses.~An Essay in Practical Ethics","Persons, Animals, and Fetuses. An Essay in Practical Ethics",,,,,,,66,66,,,,philosophical_studies_series,Dordrecht,,,kluwer-academic-publishers,,,Published under the name ``Mary Gore Forrester'',Published under the name “Mary Gore Forrester”,,,,,,,,,english,false,,,forrester_m,,,1:ethics;2:procreation
54612,article,forrester_m:2000,,,2000,,Valuing and Akrasia,Valuing and Akrasia,,,,american-philosophical-quarterly,37,37,3,3,209--225,209,,,,,,,,,,,,,,,,,,,english,false,,,forrester_m,,,1:action;2:akrasia
54613,article,forrester_m:2002,,,2002,,Self-Deception and Valuing Truth,Self-Deception and Valuing Truth,,,,american-philosophical-quarterly,39,39,1,1,31--47,31,,,,,,,,,,,,,,,,,,,english,false,,,forrester_m,,,1:truth;2:value_of_truth
54614,article,forsberg_l-skelton:2020,,,2020,,Achievement and Enhancement,Achievement and Enhancement,,,,canadian-journal-of-philosophy,50,50,3,3,322--338,322,,,,,,,,,,,,,,,,,,,english,false,,,forsberg_l;skelton,,,1:ethics;2:transhumanism;3:human_enhancement
54615,book,forsberg_n-etal:2006,,,2006,,"Tankar Till{\""a}gnade S{\""o}ren Stenlund",Tankar Tillägnade Sören Stenlund,"Tankar Till{\""a}gnade S{\""o}ren Stenlund",Tankar Tillägnade Sören Stenlund,,,,,54,54,,,,filosofiska_studier_utgivna_av_filosofiska_foreningen_och_filosofiska_institutionen_vid_uppsala_universitet,Uppsala,,,uppsala-universitet,,,,,,,,,,,,,swedish,false,,,,forsberg_n;rider_s;segerdahl,,1:history_of_philosophy
54616,book,forsberg_n-jansson:2009,,,2009,,Acknowledging Stanley Cavell,Acknowledging Stanley Cavell,Acknowledging Stanley Cavell,Acknowledging Stanley Cavell,,,,,56,56,,,,filosofiska_studier_utgivna_av_filosofiska_foreningen_och_filosofiska_institutionen_vid_uppsala_universitet,Uppsala,,,uppsala-universitet,,,,,,,,,,,,,english,false,,,,forsberg_n;jansson_l,,1:history_of_philosophy
54617,article,forsberg_n:2015,,,2015,,A New Conception of Original Sin?,A New Conception of Original Sin?,,,,the-heythrop-journal,56,56,,,272--284,272,,,,,,,,,,,,,,,,,,,english,false,,,forsberg_n,,,1:religion;2:heaven_and_hell;3:sin
54618,article,forsberg_n:2017,,,2017,,"Thinking about a Word -- Love, for Example","Thinking about a Word – Love, for Example",,,,metaphilosophy,48,48,1/2,1,30--46,30,,,,,,,,,,,,,,,,,,,english,false,,,forsberg_n,,,1:feeling;2:friendship;3:love
54619,incollection,forsberg_n:2021,,,2021,,The Freedom that Comes with Love,The Freedom that Comes with Love,,,,,,,,,307--326,307,,,,,,,,,,,,,,,,,,,english,false,,,forsberg_n,,,1:feeling;2:friendship;3:love
54620,incollection,forsberg_n:2024,,,2024,,Iris Murdoch on Love,Iris Murdoch on Love,,,,,,,,,432--451,432,,,,,,,,,,,,,,,,,,,english,false,,,forsberg_n,,,1:feeling;2:friendship;3:love
54621,article,forschler:2012,,,2012,,From Supervenience to ``Universal Law'': How Kantian Ethics Become Heteronomous,From Supervenience to “Universal Law”: How Kantian Ethics Become Heteronomous,,,,kant-yearbook,4,4,,,49--67,49,,,,,,,,,,,,,,,,,,,english,false,,,forschler,,,1:ethics
54622,article,forschler:2017,,,2017,,Rejoinder to \citet{wall_e:2016},Rejoinder to Wall (2016),,,,metaphilosophy,48,48,4,4,572--574,572,,,,,,,,,,,,,,,,,,,english,false,,,forschler,,,1:ethics
54623,incollection,forschner:1989,,,1989,,Guter Wille und Hass der Vernunft,Guter Wille und Hass der Vernunft,,,,,,,,,66--82,66,,,,,,,,,,,,,,,,,,,german,false,,,forschner,,,1:ethics
54624,incollection,forschner:2006,,,2006,,Concept and Intuition in Kant's Philosophy of Religion,Concept and Intuition in Kant's Philosophy of Religion,,,,,,,,,43--61,43,,,,,,,,,,,,,,,,,,,english,false,,,forschner,,,1:perception;2:anschauung
54625,incollection,forschner:2009,,,2009,,Idee und Anschauung in Kants Religionsphilosophie,Idee und Anschauung in Kants Religionsphilosophie,,,,,,,,,143--164,143,,,,,,,,,,,,,,,,,,,german,false,,,forschner,,,1:perception;2:anschauung
54626,incollection,forschner:2010,,,2010,,Homo naturaliter metaphysicus.~Zu Kants `Einleitung' in die \emph{Kritik der reinen Vernunft},Homo naturaliter metaphysicus. Zu Kants ‘Einleitung' in die Kritik der reinen Vernunft,,,,,,,,,33--50,33,,,,,,,,,,,,,,,,,,,german,false,,,forschner,,,1:metaphysics;2:metametaphysics
54627,incollection,forschner:2010a,,,2010,,"Das Wesen der Erfahrungserkenntnis.~Anmerkungen zu Kants `Grunds{\""a}tzen des Verstandes'",Das Wesen der Erfahrungserkenntnis. Anmerkungen zu Kants ‘Grundsätzen des Verstandes',,,,,,,,,167--184,167,,,,,,,,,,,,,,,,,,,german,false,,,forschner,,,2:cognition
54628,incollection,forschner:2010b,,,2010,,Zur Antinomie der dynamischen Ideen,Zur Antinomie der dynamischen Ideen,,,,,,,,,285--312,285,,,,,,,,,,,,,,,,,,,german,false,,,forschner,,,1:determinism
54629,incollection,forschner:2010c,,,2010,,"Die Stufen des F{\""u}rwahrhaltens: `Vom Meinen, Wissen und Glauben'.~Mit einem Blick auf Kants Auslegung des Verh{\""a}ltnisses von Glaube und Kirche","Die Stufen des Fürwahrhaltens: ‘Vom Meinen, Wissen und Glauben'. Mit einem Blick auf Kants Auslegung des Verhältnisses von Glaube und Kirche",,,,,,,,,391--408,391,,,,,,,,,,,,,,,,,,,german,false,,,forschner,,,1:representation;2:objects_of_propositional_attitudes
54630,incollection,forschner:2011,,,2011,,"{\""U}ber die verschiedenen Bedeutungen des `Hangs zum B{\""o}sen''",Über die verschiedenen Bedeutungen des ‘Hangs zum Bösen”,,,,,,,,,71--90,71,,,,,,,,,,,,,,,,,,,german,false,,,forschner,,,1:religion;2:problem_of_evil
54631,incollection,forsdyke:2009,,,2009,,Civic Institutions,Civic Institutions,,,,,,,,,197--210,197,,,,,,,,,,,,,,,,,,,english,false,,,forsdyke,,,1:history_of_philosophy
54632,book,forsey_j:2013,,,2013,,The Aesthetics of Design,The Aesthetics of Design,,,,,,,,,,,,,Oxford,,,oxford-university-press,,,,,,,,,,,10.1093/acprof:oso/9780199964369.001.0001,,english,false,,,forsey_j,,,
54633,book,forst-etal:2009,,,2009,,Sozialphilosophie und Kritik,Sozialphilosophie und Kritik,Sozialphilosophie und Kritik,Sozialphilosophie und Kritik,,,,,,,,,,,Frankfurt a.M.,,,suhrkamp-verlag,,,,,,,,,,,,,german,false,,,,forst;jaeggi_r;saar,,1:political_philosophy
54634,incollection,forst:1998,,,1998,,Die Pflicht zur Gerechtigkeit (Kapitel 6),Die Pflicht zur Gerechtigkeit (Kapitel 6),,,,,,,,,171--190,171,,,,,,,,,,,,,,,,,,,german,false,,,forst,,,1:political_philosophy;2:justice
54635,incollection,forst:2001,,,2001,,Ethik und Moral,Ethik und Moral,,,,,,,,,344--371,344,,,,,,,,,,,,,,,,,,,german,false,,,forst,,,1:ethics
54636,article,forst:2007,,,2007,,"First Things First: Redistribution, Recognition and Justification","First Things First: Redistribution, Recognition and Justification",,,,european-journal-of-political-theory,6,6,,,305--338,305,,,,,,,,,Reprinted in \citet[303--320]{petherbridge_d:2011},Reprinted in Petherbridge (2011),,,,,,,,,english,false,,,forst,,,1:political_philosophy;2:justice
54637,incollection,forst:2007a,,,2007,,Civil Society,Civil Society,,,,,,,,,452--462,452,,,,,,,,,,,,,,,,,,,english,false,,,forst,,,1:political_philosophy
54638,incollection,forst:2008,,,2008,,Pierre Bayle's Reflexive Theory of Toleration,Pierre Bayle's Reflexive Theory of Toleration,,,,,,,,,78--113,78,,,,,,,,,,,,,,,,,,,english,false,,,forst,,,1:political_philosophy;2:political_tolerance
54639,incollection,forst:2008a,,,2008,,Toleration and Truth: Comments on Steven D.~Smith [on \citet{smith_std:2008}],Toleration and Truth: Comments on Steven D. Smith [on Smith (2008)],,,,,,,,,281--292,281,,,,,,,,,,,,,,,,,,,english,false,,,forst,,,1:political_philosophy;2:political_tolerance
54640,incollection,forst:2009,,,2009,,"Toleranz, Glaube und Vernunft.~Bayle und Kant im Vergleich","Toleranz, Glaube und Vernunft. Bayle und Kant im Vergleich",,,,,,,,,183--209,183,,,,,,,,,,,,,,,,,,,german,false,,,forst,,,1:political_philosophy;2:political_tolerance
54641,incollection,forst:2011,,,2011,,The Justification of Justice: Rawls and Habermas in Dialogue,The Justification of Justice: Rawls and Habermas in Dialogue,,,,,,,,,153--180,153,,,,,,,,,,,,,,,,,,,english,false,,,forst,,,1:political_philosophy;2:justice
54642,book,forst:2013,,,2013,,Toleration in Conflict.~Past and Present,Toleration in Conflict. Past and Present,,,,,,,,,,,,,Cambridge,,,cambridge-university-press,,,,,,,,,,,,,english,false,,,forst,,,1:political_philosophy;2:political_tolerance
54643,incollection,forst:2013a,,,2013,,The Normative Order of Justice and Peace,The Normative Order of Justice and Peace,,,,,,,,,69--89,69,,,,,,,,,,,,,,,,,,,english,false,,,forst,,,1:social_philosophy;2:war
54644,book,forst:2017,,,2017,,Normativity and Power: Analyzing Social Orders of Justification,Normativity and Power: Analyzing Social Orders of Justification,,,,,,,,,,,,,Oxford,,,oxford-university-press,,,,,,,,,,,,,english,false,,,forst,,,1:political_philosophy
54645,incollection,forst:2018,,,2018,,Human Rights in Context: A Comment on \citet{sangiovanni:2018},Human Rights in Context: A Comment on Sangiovanni (2018),,,,,,,,,200--210,200,,,,,,,,,,,,,,,,,,,english,false,,,forst,,,1:political_philosophy;2:rights;3:human_rights
54646,incollection,forst:2018a,,,2018,,Die neorepublikanische Maschine.~Zur Unabdingbarkeit des kantischen Republikanismus,Die neorepublikanische Maschine. Zur Unabdingbarkeit des kantischen Republikanismus,,,,,,,,,663--674,663,,,,,,,,,,,,,,,,,,,german,false,,,forst,,,1:political_philosophy;2:justification_of_the_state;3:republicanism
54647,incollection,forst:2020,,,2020,,The Point of Justice: On the Paradigmatic Incompatibility between Rawlsian ``Justice as Fairness'' and Luck Egalitarianism,The Point of Justice: On the Paradigmatic Incompatibility between Rawlsian “Justice as Fairness” and Luck Egalitarianism,,,,,,,,,148--162,148,,,,,,,,,,,,,,,,,,,english,false,,,forst,,,1:political_philosophy;2:justice
54648,incollection,forster_ki:1987,,,1987,,"Binding, Plausibility, and Modularity","Binding, Plausibility, and Modularity",,,,,,,,,63--82,63,,,,,,,,,,,,,,,,,,,english,false,,,forster_ki,,,2:cognition;3:cognitive_modularity
54649,incollection,forster_ki:1990,,,1990,,Lexical Processing,Lexical Processing,,,,,,,,,95--131,95,,,,,,,,,,,,,,,,,,,english,false,,,forster_ki,,,1:linguistics;2:psycholinguistics
54650,book,forster_m-gjesdal:2015,,,2015,,The Oxford Handbook of German Philosophy in the Nineteenth Century,The Oxford Handbook of German Philosophy in the Nineteenth Century,The Oxford Handbook of German Philosophy in the Nineteenth Century,The Oxford Handbook of German Philosophy in the Nineteenth Century,,,,,,,,,,oxford_handbooks,New York,,,oxford-university-press,,,,,,,,,,,10.1093/oxfordhb/9780199696543.001.0001,,english,false,,,,forster_m;gjesdal_k,,1:history_of_philosophy
54651,book,forster_m-gjesdal:2019,,,2019,,The Cambridge Companion to Hermeneutics,The Cambridge Companion to Hermeneutics,The Cambridge Companion to Hermeneutics,The Cambridge Companion to Hermeneutics,,,,,,,,,,cambridge_companions_to_philosophy,Cambridge,,,cambridge-university-press,,,,,,,,,,,10.1017/9781316888582,,english,false,,,,forster_m;gjesdal_k,,1:explanation;2:understanding;3:hermeneutics
54652,article,forster_m-saidel:1994,,,1994,,Connectionism and the Fate of Folk Psychology,Connectionism and the Fate of Folk Psychology,,,,philosophical-psychology,7,7,,,437--452,437,,,,,,,,,,,,,,,,,,,english,false,,,forster_m;saidel,,,1:psychology;2:cognitive_science;3:connectionism
54653,incollection,forster_m:1993,,,1993,,Hegel's Dialectical Method,Hegel's Dialectical Method,,,,,,,,,130--170,130,,,,,,,,,,,,,,,,,,,english,false,,,forster_m,,,1:method;2:dialectic
54654,article,forster_m:1998,,,1998,,On the Very Idea of Denying the Existence of Radically Different Conceptual Schemes,On the Very Idea of Denying the Existence of Radically Different Conceptual Schemes,,,,inquiry,41,41,2,2,133--185,133,,,,,,,,,,,,,,,,,10.1080/002017498321850,,english,false,,,forster_m,,,1:metaphysics;2:relativism;3:conceptual_relativism
54655,article,forster_m:2003,,,2003,,"Gods, Animals, and Artists: Some Problem Cases in Herder's Philosophy of Language","Gods, Animals, and Artists: Some Problem Cases in Herder's Philosophy of Language",,,,inquiry,46,46,1,1,65--96,65,,,,,,,,,,,,,,,,,,,english,false,,,forster_m,,,1:language
54656,incollection,forster_m:2004,,,2004,,The Liberal Temper in Classical German Philosophy,The Liberal Temper in Classical German Philosophy,,,,,,,,,19--48,19,,,,,,,,,,,,,,,,,,,english,false,,,forster_m,,,1:political_philosophy
54657,incollection,forster_m:2006,,,2006,,Socrates' Demand for Definitions,Socrates' Demand for Definitions,,,,,,,,,1--48,1,,,,,,,,,,,,,,,,,,,english,false,,,forster_m,,,1:explanation;2:definition
54658,incollection,forster_m:2007,,,2007,,Socrates' Profession of Ignorance,Socrates' Profession of Ignorance,,,,,,,,,1--35,1,,,,,,,,,,,,,,,,,,,english,false,,,forster_m,,,1:knowledge
54659,book,forster_m:2008,,,2008,,Kant and Skepticism,Kant and Skepticism,,,,,,,,,,,,,"Princeton, New Jersey",,,princeton-university-press,,,,,,,,,,,,,english,false,,,forster_m,,,1:skepticism
54660,incollection,forster_m:2008a,,,2008,,Das geistige Tierreich,Das geistige Tierreich,,,,,,,,,394--413,394,,,,,,,,,,,,,,,,,,,german,false,,,forster_m,,,1:animals;2:animal_cognition
54661,incollection,forster_m:2009,,,2009,,Hegel and Hermeneutics,Hegel and Hermeneutics,,,,,,,,,174--203,174,,,,,,,,,,,,,,,,,,,english,false,,,forster_m,,,1:language
54662,book,forster_m:2011,,,2011,,German Philosophy of Language: From Schlegel to Hegel and Beyond,German Philosophy of Language: From Schlegel to Hegel and Beyond,,,,,,,,,,,,,Oxford,,,oxford-university-press,,,,,,,,,,,10.1093/acprof:osobl/9780199604814.001.0001,,english,false,,,forster_m,,,1:language
54663,incollection,forster_m:2012a,,,2012,,Language,Language,,,,,,,,,263--292,263,,,,,,,,,,,,,,,,,,,english,false,,,forster_m,,,1:language
54664,incollection,forster_m:2012b,,,2012,,The History of Philosophy,The History of Philosophy,,,,,,,,,866--904,866,,,,,,,,,,,,,,,,,,,english,false,,,forster_m,,,1:history_of_philosophy;2:why_history_of_philosophy
54665,incollection,forster_m:2014,,,2014,,Schelling and Skepticism,Schelling and Skepticism,,,,,,,,,32--47,32,,,,,,,,,,,,,,,,,,,english,false,,,forster_m,,,1:skepticism
54666,incollection,forster_m:2014a,,,2014,,Romanticism and Language,Romanticism and Language,,,,,,,,,68--91,68,,,,,,,,,,,,,,,,,,,english,false,,,forster_m,,,1:language
54667,incollection,forster_m:2015,,,2015,,Herder's Doctrine of Meaning as Use,Herder's Doctrine of Meaning as Use,,,,,,,,,201--222,201,,,,,,,,,,,,,,,,,,,english,false,,,forster_m,,,1:representation;2:content
54668,incollection,forster_m:2017a,,,2017,,Herder and Human Rights,Herder and Human Rights,,,,,,,,,224--239,224,,,,,,,,,,,,,,,,,,,english,false,,,forster_m,,,1:political_philosophy;2:rights;3:human_rights
54669,book,forster_m:2018,,,2018,,Herder's Philosophy,Herder's Philosophy,,,,,,,,,,,,,Oxford,,,oxford-university-press,,,,,,,,,,,10.1093/oso/9780199588367.001.0001,,english,false,,,forster_m,,,
54670,incollection,forster_m:2018a,,,2018,,Homeric Contributions to Skepticism,Homeric Contributions to Skepticism,,,,,,,,,7--24,7,,,,,,,,,,,,,,,,,,,english,false,,,forster_m,,,1:skepticism
54671,incollection,forster_m:2019,,,2019,,The Origin and Character of Hegel's Concept of \emph{Geist},The Origin and Character of Hegel's Concept of Geist,,,,,,,,,29--54,29,,,,,,,,,,,,,,,,,,,english,false,,,forster_m,,,2:metaphysics_of_the_mind
54672,incollection,forster_m:2019a,,,2019,,Hermeneutics: Francophone Approaches,Hermeneutics: Francophone Approaches,,,,,,,,,260--285,260,,,,,,,,,,,,,,,,,,,english,false,,,forster_m,,,1:explanation;2:understanding;3:hermeneutics
54673,article,forster_ma-etal:2018,,,2018,,The Frugal Inference of Causal Relation,The Frugal Inference of Causal Relation,,,,the-british-journal-for-the-philosophy-of-science,69,69,3,3,821--848,821,,,,,,,,,,,,,,,,,10.1093/bjps/axw033,,english,false,,,forster_ma;raskutti_g;stern_re;weinberger_n,,,
54674,incollection,forster_ma-sober:2011,,,2011,,AIC Scores as Evidence -- a Bayesian Interpretation,AIC Scores as Evidence – a Bayesian Interpretation,,,,,,,,,535--552,535,,,,,,,,,,,,,,,,,,,english,false,,,forster_ma;sober,,,1:probability
54675,incollection,forster_ma:1986,,,1986,,Unification and Scientific Realism Revisited,Unification and Scientific Realism Revisited,,,,,,,,,394--405,394,,,,,,,,,,,,,,,,,,,english,false,,,forster_ma,,,1:structuralism;2:structuralism_in_the_sciences;3:structuralism_in_physics
54676,incollection,forster_ma:1988,,,1988,,The Confirmation of Common Component Causes,The Confirmation of Common Component Causes,,,,,,,,,3--9,3,,,,,,,,,,,,,,,,,,,english,false,,,forster_ma,,,1:causation
54677,incollection,forster_ma:2008,,,2008,,Prediction,Prediction,,,,,,,,,405--413,405,,,,,,,,,,,,,,,,,,,english,false,,,forster_ma,,,1:science
54678,incollection,forster_ma:2010,,,2010,,Miraculous Consilience of Quantum Mechanics,Miraculous Consilience of Quantum Mechanics,,,,,,,,,201--228,201,,,,,,,,,,,,,,,,,,,english,false,,,forster_ma,,,1:probability
54679,incollection,forster_ma:2011,,,2011,,Scientific Evidence,Scientific Evidence,,,,,,,,,179--196,179,,,,,,,,,,,,,,,,,,,english,false,,,forster_ma,,,1:science;2:confirmation
54680,incollection,forster_ma:2011a,,,2011,,The Debate between Whewell and Mill on the Nature of Scientific Induction,The Debate between Whewell and Mill on the Nature of Scientific Induction,,,,,,,,,93--116,93,,,,,,,,,,,,,,,,,,,english,false,,,forster_ma,,,1:method;2:induction
54681,article,forster_pd:1996,,,1996,,The Unity of Peirce's Theories of Truth,The Unity of Peirce's Theories of Truth,,,,british-journal-for-the-history-of-philosophy,4,4,1,1,119--147,119,,,,,,,,,,,,,,,,,,,english,false,,,forster_pd,,,1:truth;2:consensus_theory_of_truth
54682,incollection,forster_pd:1996a,,,1996,,"Unity, Theory, and Practice: F.H.~Bradley and Pragmatism","Unity, Theory, and Practice: F.H. Bradley and Pragmatism",,,,,,,,,169--194,169,,,,,,,,,,,,,,,,,,,english,false,,,forster_pd,,,
54683,incollection,forster_pd:1997,,,1997,,The Logical Foundations of Peirce's Indeterminism,The Logical Foundations of Peirce's Indeterminism,,,,,,,,,57--80,57,,,,,,,,,,,,,,,,,,,english,false,,,forster_pd,,,1:time;2:the_future;3:open_future
54684,article,forster_pd:2008,,,2008,,Neither Dogma nor Common Sense: Moore's Confidence in his `Proof of an External World',Neither Dogma nor Common Sense: Moore's Confidence in his ‘Proof of an External World',,,,british-journal-for-the-history-of-philosophy,16,16,1,1,163--195,163,,,,,,,,,,,,,,,,,,,english,false,,,forster_pd,,,1:skepticism;2:external_world_skepticism
