id,entry_type,bibkey,options,shorthand,date_year,pubstate,title_latex,title_unicode,booktitle_latex,booktitle_unicode,crossref,journal_key,volume,volume_numeric,number,number_numeric,pages,start_page,eid,series_key,address,institution_key,school_key,publisher_key,type_field,edition,note_latex,note_unicode,issuetitle_latex,issuetitle_unicode,extra_note_latex,extra_note_unicode,urn,eprint,doi,url,langid,is_translation,epoch,license,author_keys,editor_keys,guesteditor_keys,keyword_keys
92653,book,krishna_d:2011,,,2011,,Contrary Thinking: Selected Essays of Daya Krishna,Contrary Thinking: Selected Essays of Daya Krishna,Contrary Thinking: Selected Essays of Daya Krishna,Contrary Thinking: Selected Essays of Daya Krishna,,,,,,,,,,,Oxford,,,oxford-university-press,,,Edited by Jay L.~Garfield and Daniel Raveh,Edited by Jay L. Garfield and Daniel Raveh,,,,,,,10.1093/acprof:osobl/9780199795550.001.0001,,english,false,,,krishna_d,,,1:varia
92654,incollection,krishna_n:2020,,,2020,,Volunteers and Conscripts: Philippa Foot and the Amoralist,Volunteers and Conscripts: Philippa Foot and the Amoralist,,,,,,,,,111--125,111,,,,,,,,,,,,,,,,,,,english,false,,,krishna_n,,,2:value_skepticism;3:why_be_moral
92655,article,krishnamurthy:2013,,,2013,,Completing Rawls's Arguments for Equal Political Liberty and Its Fair Value: The Argument from Self-Respect,Completing Rawls's Arguments for Equal Political Liberty and Its Fair Value: The Argument from Self-Respect,,,,canadian-journal-of-philosophy,43,43,2,2,179--205,179,,,,,,,,,,,,,,,,,,,english,false,,,krishnamurthy,,,1:political_philosophy;2:autonomy
92656,incollection,krishnaprasad-etal:1989,,,1989,,On the Declarative Semantics of Inheritance Networks,On the Declarative Semantics of Inheritance Networks,,,,,,,,,1098--1103,1098,,,,,,,,,,,,,,,,,,,english,false,,,krishnaprasad;kifer;warren_ds,,,1:logic;2:nonmonotonic_logic;3:inheritance_theory
92657,incollection,krishnaprasad-kifer:1989,,,1989,,An Evidence Based Theory of Inheritance,An Evidence Based Theory of Inheritance,,,,,,,,,1093--1098,1093,,,,,,,,,,,,,,,,,,,english,false,,,krishnaprasad;kifer,,,1:logic;2:nonmonotonic_logic;3:inheritance_theory
92658,incollection,krishnaprasad-warren:1989,,,1989,,An Evidence-Based Framework for a Theory of Inheritance,An Evidence-Based Framework for a Theory of Inheritance,,,,,,,,,,,,,,,,,,,,,,,,,,,,,english,false,,,krishnaprasad;warren_ds,,,1:logic;2:nonmonotonic_logic;3:inheritance_theory
92659,UNKNOWN,krishnaprasad:1989,,,1989,,The Semantics of Inheritance Networks,The Semantics of Inheritance Networks,,,,,,,,,,,,,"Stony Brook, New York",,computer_science_department_state_university_of_new_york_at_stony_brook,,PhD dissertation,,,,,,,,,,,,english,false,,,krishnaprasad,,,1:logic;2:nonmonotonic_logic;3:inheritance_theory
92660,article,krishnasinha:2001,,,2001,,Absolute Idealism Having Pragmatic Colour: a Critique of Royce's Approach,Absolute Idealism Having Pragmatic Colour: a Critique of Royce's Approach,,,,indian-philosophical-quarterly,28,28,3,3,385--398,385,,,,,,,,,,,,,,,,,,,english,false,,,krishnasinha,,,1:metaphysics;2:idealism
92661,book,kristeller-wiener:1968,,,1968,,Renaissance Essays,Renaissance Essays,Renaissance Essays,Renaissance Essays,,,,,,,,,,,New York,,,harper-row,,,,,,,,,,,,,english,false,,,,kristeller;wiener_pp,,1:history_of_philosophy
92662,article,kristeller:1964,,,1964,,History of Philosophy and History of Ideas,History of Philosophy and History of Ideas,,,,journal-of-the-history-of-philosophy,2,2,1,1,1--14,1,,,,,,,,,,,,,,,,,,,english,false,,,kristeller,,,1:history_of_philosophy;2:why_history_of_philosophy
92663,article,kristeller:1968,,,1968,,The Myth of Renaissance Atheism and the French Tradition of Free Thought,The Myth of Renaissance Atheism and the French Tradition of Free Thought,,,,journal-of-the-history-of-philosophy,6,6,3,3,233--243,233,,,,,,,,,,,,,,,,,,,english,false,,,kristeller,,,1:religion;2:atheism
92664,incollection,kristeller:1978,,,1978,,Philosophy and Medicine in Medieval and Renaissance Italy,Philosophy and Medicine in Medieval and Renaissance Italy,,,,,,,,,29--40,29,,,,,,,,,,,,,,,,,,,english,false,,,kristeller,,,1:medicine
92665,incollection,kristeller:1988,,,1988,,Humanism,Humanism,,,,,,,,,113--137,113,,,,,,,,,,,,,,,,,,,english,false,,,kristeller,,,1:political_philosophy
92666,article,kristeller:2018,,,2018,,Referential and Perspectival Realism,Referential and Perspectival Realism,,,,spontaneous-generations-a-journal-for-the-history-and-philosophy-of-science,9,9,1,1,151--164,151,,,,,,,,,,,,,,,,,,,english,false,,,kristeller,,,1:metaphysics;2:perspectivalism
92667,article,kristensen_s:2006,,,2006,,"Merleau-Ponty, une esth{\'e}tique du mouvement","Merleau-Ponty, une esthétique du mouvement",,,,archives-de-philosophie,69,69,1,1,123--146,123,,,,,,,,,,,,,,,,,,,french,false,,,kristensen_s,,,1:aesthetics
92668,article,kristensen_s:2016,,,2016,,La reconnaissance des pratiques de sant{\'e} alternatives -- un d{\'e}fi philosophique majeur,La reconnaissance des pratiques de santé alternatives – un défi philosophique majeur,,,,philosophie-ch,,,,,,,,,,,,,,,,,,,,,,,,https://www.philosophie.ch/2016-11-07-kristensen,french,false,,cc-by-3,kristensen_s,,,
92669,article,kristensen_st:2003,,,2003,,Foi perceptive et foi expressive,Foi perceptive et foi expressive,,,,chiasmi-international,5,5,,,,,,,,,,,,,,,,,,,,,,,french,false,,,kristensen_s,,,1:religion;2:faith
92670,article,kristensen_st:2003a,,,2003,,"Recension de Jenny Slatman, l'expression au-del{\`a} de la repr{\'e}sentation.~Sur l'aisth{\'e}sis et l'esth{\'e}tique chez Merleau-Ponty","Recension de Jenny Slatman, l'expression au-delà de la représentation. Sur l'aisthésis et l'esthétique chez Merleau-Ponty",,,,chiasmi-international,5,5,,,,,,,,,,,,,,,,,,,,,,,french,false,,,kristensen_s,,,1:representation
92671,article,kristensson_po-jameson:2009,,,2009,,Five Challenges for Intelligent Text Entry Systems,Five Challenges for Intelligent Text Entry Systems,,,,the-ai-magazine,30,30,4,4,85--94,85,,,,,,,,,,,,,,,,,,,english,false,,,kristensson_po;jameson_a,,,1:ai;2:human_computer_interaction
92672,incollection,kristeva_j:1986,,,1986,,Stabat Mater,Stabat Mater,,,,,,,,,99--118,99,,,,,,,,,,,,,,,,,,,english,false,,,kristeva_j,,,1:ontology;2:matter
92673,incollection,kristjansongural:2017,,,2017,,Demand and Socially Necessary Labor-Time,Demand and Socially Necessary Labor-Time,,,,,,,,,155--168,155,,,,,,,,,,,,,,,,,,,english,false,,,kristjansongural,,,1:economics;2:labour
92674,article,kristjansson_k:2000,,,2000,,Virtue Ethics and Emotional Conflict,Virtue Ethics and Emotional Conflict,,,,american-philosophical-quarterly,37,37,3,3,193--207,193,,,,,,,,,,,,,,,,,,,english,false,,,kristjansson_k,,,1:ethics;2:virtue_ethics
92675,book,kristjansson_k:2002,,,2002,,Justifying Emotions: Pride and Jealousy,Justifying Emotions: Pride and Jealousy,,,,,,,3,3,,,,routledge_studies_in_ethics_and_moral_theory,London,,,routledge,,,,,,,,,,,10.4324/9780203165881,,english,false,,,kristjansson_k,,,1:feeling;2:pride
92676,article,kristjansson_k:2005,,,2005,,Justice and Desert-Based Emotions,Justice and Desert-Based Emotions,,,,philosophical-explorations,8,8,1,1,53--68,53,,,,,,,,,,,,,,,,,,,english,false,,,kristjansson_k,,,1:feeling;2:emotions
92677,incollection,kristjansson_k:2009,,,2009,,Emotional Optimality and Moral Force,Emotional Optimality and Moral Force,,,,,,,,,215--234,215,,,,,,,,,,,,,,,,,,,english,false,,,kristjansson_k,,,1:feeling;2:emotions;3:authenticity_of_emotions
92678,article,kristjansson_k:2010,,,2010,,The Trouble with Ambivalent Emotions,The Trouble with Ambivalent Emotions,,,,philosophy,85,85,,,485--510,485,,,,,,,,,,,,,,,,,,,english,false,,,kristjansson_k,,,1:feeling;2:emotions
92679,article,kristjansson_k:2013,,,2013,,Aristotelian Motivational Externalism,Aristotelian Motivational Externalism,,,,philosophical-studies,164,164,2,2,419--442,419,,,,,,,,,,,,,,,,,10.1007/s11098-012-9863-1,,english,false,,,kristjansson_k,,,2:desire
92680,book,kristjansson_k:2015,,,2015,,Virtues and Vices in Positive Psychology: A Philosophical Critique,Virtues and Vices in Positive Psychology: A Philosophical Critique,,,,,,,,,,,,,Cambridge,,,cambridge-university-press,,,,,,,,,,,,,english,false,,,kristjansson_k,,,1:ethics
92681,book,kristjansson_k:2015a,,,2015,,Aristotelian Character Education,Aristotelian Character Education,,,,,,,,,,,,,London,,,routledge,,,,,,,,,,,,,english,false,,,kristjansson_k,,,2:character
92682,article,kristjansson_k:2015b,,,2015,,An Aristotelian Theory of Gratitude,An Aristotelian Theory of Gratitude,,,,topoi,34,34,2,2,499--511,499,,,,,,,,,,,,,,,,,,,english,false,,,kristjansson_k,,,1:feeling;2:moral_sentiments
92683,article,kristjansson_k:2015c,,,2015,,Grief: An Aristotelian Justification of an Emotional Virtue,Grief: An Aristotelian Justification of an Emotional Virtue,,,,res-philosophica,92,92,4,4,805--828,805,,,,,,,,,,,,,,,,,,,english,false,,,kristjansson_k,,,1:feeling;2:grief
92684,article,kristjansson_k:2017,,,2017,,Awe: An Aristotelian Analysis of a non-Aristotelian Virtuous Emotion,Awe: An Aristotelian Analysis of a non-Aristotelian Virtuous Emotion,,,,philosophia,45,45,1,1,125--142,125,,,,,,,,,,,,,,,,,,,english,false,,,kristjansson_k,,,1:feeling;2:awe
92685,book,kristjansson_k:2018,,,2018,,Virtuous Emotions,Virtuous Emotions,,,,,,,,,,,,,Oxford,,,oxford-university-press,,,,,,,,,,,10.1093/oso/9780198809678.001.0001,,english,false,,,kristjansson_k,,,1:feeling;2:emotions
92686,book,kristjansson_k:2022,,,2022,,Friendship for Virtue,Friendship for Virtue,,,,,,,,,,,,,Oxford,,,oxford-university-press,,,,,,,,,,,10.1093/oso/9780192864260.001.0001,,english,false,,,kristjansson_k,,,1:feeling;2:friendship
92687,incollection,kristol_i:1997,,,1997,,"Pornography, Obscenity, and the Case for Censorship","Pornography, Obscenity, and the Case for Censorship",,,,,,,,,174--182,174,,,,,,,,,,,,,,,,,,,english,false,,,kristol_i,,,1:aesthetics;2:pornography
92688,article,kritz:1996,,,1996,,On Relations between WP-Graphs and Data Structures,On Relations between WP-Graphs and Data Structures,,,,logique-et-analyse,39,39,153/154,153,153--164,153,,,,,,,,,,,,,,,,,,,english,false,,,kritz,,,1:computation;2:data
92689,book,krivine:1971,,,1971,,Introduction to Axiomatic Set Theory,Introduction to Axiomatic Set Theory,,,,,,,34,34,,,,synthese_library,Dordrecht,,,d-reidel-publishing-co,,,"English translation of ``Th{\'e}orie axiomatique des ensembles''|,","English translation of “Théorie axiomatique des ensembles”|,",,,,,,,,,english,true,,,krivine,,,1:mathematics;2:set_theory
92690,incollection,krizan:2013,,,2013,,Elemental Structure and the Transformation of the Elements in \emph{On Generation and Corruption} 2.4,Elemental Structure and the Transformation of the Elements in On Generation and Corruption 2.4,,,,,,,,,195--224,195,,,,,,,,,,,,,,,,,,,english,false,,,krizan,,,1:ontology;2:matter
92691,article,krizan:2013a,,,2013,,Substantial Change and the Limiting Case of Aristotelian Matter,Substantial Change and the Limiting Case of Aristotelian Matter,,,,history-of-philosophy-quarterly,30,30,4,4,293--310,293,,,,,,,,,,,,,,,,,,,english,false,,,krizan,,,1:time;2:generation;3:coming_to_be
92692,article,krizan:2016,,,2016,,Prime Matter Without Extension,Prime Matter Without Extension,,,,journal-of-the-history-of-philosophy,54,54,4,4,523--546,523,,,,,,,,,,,,,,,,,,,english,false,,,krizan,,,1:ontology;2:matter;3:prime_matter
92693,incollection,krizan:2018,,,2018,,Mixing and the Formation of Homoeomers in \emph{On Generation and Corruption} 2.7,Mixing and the Formation of Homoeomers in On Generation and Corruption 2.7,,,,,,,,,187--226,187,,,,,,,,,,,,,,,,,,,english,false,,,krizan,,,1:ontology;2:mixtures
92694,book,krobath_ht:2018,,,2018,,Werte.~Elemente einer philosophischen Systematik,Werte. Elemente einer philosophischen Systematik,,,,,,,,,,,,,"W{\""u}rzburg",,,konigshausen-neumann,,,,,,,,,,,,,german,false,,,krobath_ht,,,
92695,techreport,kroch-joshi_ak:1985,,,1985,,The Linguistic Relevance of Tree Adjoining Grammar,The Linguistic Relevance of Tree Adjoining Grammar,,,,,,,ms--cis--85--16,,,,,,"Philadelphia, Pennsylvania",department_of_computer_and_information_science_university_of_pennsylvania,,,,,,,,,,,,,,,english,false,,,kroch;joshi_ak,,,1:semantics;2:interrogatives;3:tag_grammar
92696,book,kroch:1975,,,1975,,The Semantics of Scope in English,The Semantics of Scope in English,,,,,,,,,,,,,"310 Lindley Hall, Indiana University, Bloomington, Indiana 46405",,,indiana-university-linguistics-club,,,,,,,,,,,,,english,false,,,kroch,,,1:language;2:quantifiers
92697,article,kroeber_g:1968,,,1968,,Die Kategorie ``Struktur'' und der kategorische Strukturalismus,Die Kategorie “Struktur” und der kategorische Strukturalismus,,,,deutsche-zeitschrift-fur-philosophie,16,16,11,11,1310--1324,1310,,,,,,,,,,,,,,,,,,,german,false,,,kroeber_g,,,1:structuralism;2:structure
92698,incollection,kroeber_g:1991,,,1991,,History of Science in the GDR: Institutions and Programmatic Positions,History of Science in the GDR: Institutions and Programmatic Positions,,,,,,,,,49--62,49,,,,,,,,,,,,,,,,,,,english,false,,,kroeber_g,,,1:science
92699,incollection,kroeber_hl:2011,,,2011,,Handlungssteuerung und Entscheidung zur Straftat aus psychiatrischer Sicht,Handlungssteuerung und Entscheidung zur Straftat aus psychiatrischer Sicht,,,,,,,,,1165--1184,1165,,,,,,,,,,,,,,,,,,,german,false,,,kroeber_hl,,,1:action;2:motivation
92700,article,kroedel-huber:2013,,,2013,,Counterfactual Dependence and Arrow,Counterfactual Dependence and Arrow,,,,nous,47,47,3,3,453--466,453,,,,,,,,,,,,,,,,,,,english,false,,,kroedel;huber_f,,,1:causation;2:counterfactual_theories_of_causation
92701,article,kroedel-schulz:2016,,,2016,,Grounding Mental Causation,Grounding Mental Causation,,,,synthese,193,193,6,6,1909--1923,1909,,,,,,,,,,,,,,,,,,,english,false,,,kroedel;schulz_m,,,1:mind_body;2:mental_causation
92702,article,kroedel:2008,,,2008,,Mental Causation as Multiple Causation,Mental Causation as Multiple Causation,,,,philosophical-studies,139,139,1,1,125--143,125,,,,,,,,,,,,,,,,,10.1007/s11098-007-9106-z,,english,false,,,kroedel,,,1:mind_body;2:mental_causation
92703,article,kroedel:2012,,,2012,,"The Lottery Paradox, Epistemic Justification and Permissibility","The Lottery Paradox, Epistemic Justification and Permissibility",,,,analysis,72,72,1,1,57--60,57,,,,,,,,,,,,,,,,,,,english,false,,,kroedel,,,1:epistemology
92704,article,kroedel:2012a,,,2012,,Implicit Definition and the Application of Logic,Implicit Definition and the Application of Logic,,,,philosophical-studies,158,158,1,1,131--148,131,,,,,,,,,,,,,,,,,10.1007/s11098-010-9675-0,,english,false,,,kroedel,,,1:explanation;2:definition
92705,article,kroedel:2012b,,,2012,,Counterfactuals and the Epistemology of Modality,Counterfactuals and the Epistemology of Modality,,,,philosophers-imprint,12,12,12,12,,,,,,,,,,,,,,,,,,http://hdl.handle.net/2027/spo.3521354.0012.012,,http://hdl.handle.net/2027/spo.3521354.0012.012,english,false,,,kroedel,,,1:modality;2:modal_epistemology
92706,article,kroedel:2015,,,2015,,A SImple Argument for Downward Causation,A SImple Argument for Downward Causation,,,,synthese,192,192,3,3,841--858,841,,,,,,,,,,,,,,,,,,,english,false,,,kroedel,,,1:causation;2:causal_closure
92707,article,kroedel:2015a,,,2015,,Dualist Mental Causation and the Exclusion Problem,Dualist Mental Causation and the Exclusion Problem,,,,nous,49,49,2,2,357--375,357,,,,,,,,,,,,,,,,,,,english,false,,,kroedel,,,1:mind_body;2:dualism
92708,incollection,kroedel:2017,,,2017,,"Modal Knowledge, Evolution, and Counterfactuals","Modal Knowledge, Evolution, and Counterfactuals",,,,,,,,,179--196,179,,,,,,,,,,,,,,,,,,,english,false,,,kroedel,,,1:modality;2:modal_epistemology
92709,book,kroeker_e-lemmens:2021,,,2021,,Hume's \emph{An Enquiry Concerning the Principles of Morals}: A Critical Guide,Hume's An Enquiry Concerning the Principles of Morals: A Critical Guide,Hume's \emph{An Enquiry Concerning the Principles of Morals}: A Critical Guide,Hume's An Enquiry Concerning the Principles of Morals: A Critical Guide,,,,,,,,,,cambridge_critical_guides,Cambridge,,,cambridge-university-press,,,,,,,,,,,10.1017/9781108525497,,english,false,,,,kroeker_e;lemmens_w,,
92710,article,kroeker_e-schaubroeck:2013,,,2013,,Reasons of Love: An Introduction,Reasons of Love: An Introduction,,,,philosophical-explorations,16,16,3,3,280--284,280,,,,,,,,,,,,,,,,,,,english,false,,,kroeker_e;schaubroeck,,,1:feeling;2:friendship;3:love
92711,incollection,kroeker_e:2009,,,2009,,"Reid on Natural Signs, Taste and Moral Perception","Reid on Natural Signs, Taste and Moral Perception",,,,,,,,,46--66,46,,,,,,,,,,,,,,,,,,,english,false,,,kroeker_e,,,1:representation
92712,article,kroeker_e:2013,,,2013,,"Acting from a Good Conscience: Reid, Love, and Moral Worth","Acting from a Good Conscience: Reid, Love, and Moral Worth",,,,history-of-philosophy-quarterly,30,30,4,4,333--348,333,,,,,,,,,,,,,,,,,,,english,false,,,kroeker_e,,,1:feeling;2:friendship;3:love
92713,article,kroeker_e:2018,,,2018,,Reid's Non-Humean Theory of Moral Motives,Reid's Non-Humean Theory of Moral Motives,,,,pacific-philosophical-quarterly,99,99,,,205--224,205,,,,,,,,,,,,,,,,,,,english,false,,,kroeker_e,,,1:action;2:motivation
92714,incollection,kroeker_e:2019,,,2019,,Reasons for Love,Reasons for Love,,,,,,,,,277--287,277,,,,,,,,,,,,,,,,,,,english,false,,,kroeker_e,,,1:feeling;2:friendship;3:love
92715,incollection,kroemer_r:2012,,,2012,,Are we Still Babylonians? The Structure of the Foundations of Mathematics from a Wimsattian Perspective,Are we Still Babylonians? The Structure of the Foundations of Mathematics from a Wimsattian Perspective,,,,,,,,,189--206,189,,,,,,,,,,,,,,,,,,,english,false,,,kroemer_r,,,1:science;2:experimentation
92716,article,kroener:1950,,,1950,,Zur Logik von J.~Piaget,Zur Logik von J. Piaget,,,,dialectica,4,4,13,13,49--64,49,,,,,,,,,,,,,,,,,10.1111/j.1746-8361.1950.tb01002.x,,german,false,,,kroener,,,1:psychology
92717,article,kroener:1950a,,,1950,,Besprechung von \citet{czezowski:1949},Besprechung von Czeẓowski (1949),,,,dialectica,4,4,13,13,79,79,,,,,,,,,,,,,,,,,10.48106/dial.v4.i13.11,,german,false,,,kroener,,,1:psychology
92718,article,kroener:1950b,,,1950,,Besprechung von \citet{bochenski:1949},Besprechung von Bocheński (1949),,,,dialectica,4,4,13,13,78--79,78,,,,,,,,,,,,,,,,,10.48106/dial.v4.i13.10,,german,false,,,kroener,,,1:logic;2:history_of_logic
92719,article,kroener:1953a,,,1953,,Besprechung von \citet{selvaggi:1953},Besprechung von Selvaggi (1953),,,,dialectica,7,7,28,28,349--370,349,,,,,,,,,,,,,,,,,10.1111/j.1746-8361.1953.tb01389.x,,german,false,,,kroener,,,1:physics
92720,article,kroener:1954,,,1954,,Besprechung von \citet{pauli_w:1952},Besprechung von,,,,dialectica,8,8,30,30,173--179,173,,,,,,,,,,,,,,,,,10.1111/j.1746-8361.1954.tb01132.x,,german,false,,,kroener,,,1:probability
92721,article,kroener:1954a,,,1954,,Besprechung von \citet{dingler:1952},Besprechung von Dingler (1952),,,,dialectica,8,8,31,31,258--267,258,,,,,,,,,,,,,,,,,10.1111/j.1746-8361.1954.tb01139.x,,german,false,,,kroener,,,1:mathematics;2:geometry
92722,article,kroener:1954b,,,1954,,Besprechung von \citet{klemmt:1952},Besprechung von Klemmt (1952),,,,dialectica,8,8,32,32,364,364,,,,,,,,,,,,,,,,,10.1111/j.1746-8361.1954.tb01270.x,,german,false,,,kroener,,,1:history_of_philosophy
92723,article,kroener:1954c,,,1954,,Besprechung von \citet{feigl-brodbeck:1953},Besprechung von Feigl and Brodbeck (1953),,,,dialectica,8,8,32,32,365,365,,,,,,,,,,,,,,,,,10.48106/dial.v8.i32.06,,german,false,,,kroener,,,1:science
92724,article,kroener:1956,,,1956,,Besprechung von \citet{vansteenberghen:1952},Besprechung von van Steenberghen (1952),,,,dialectica,10,10,38,38,180--183,180,,,,,,,,,,,,,,,,,10.1111/j.1746-8361.1956.tb00336.x,,german,false,,,kroener,,,1:ontology
92725,book,kroes-bakker:1992,,,1992,,Technological Development and Science in the Industrial Age: New Perspectives on the Science-Technology Relationship,Technological Development and Science in the Industrial Age: New Perspectives on the Science-Technology Relationship,Technological Development and Science in the Industrial Age: New Perspectives on the Science-Technology Relationship,Technological Development and Science in the Industrial Age: New Perspectives on the Science-Technology Relationship,,,,,144,144,,,,boston_studies_in_the_philosophy_of_science,Dordrecht,,,kluwer-academic-publishers,,,,,,,,,,,,,english,false,,,,kroes;bakker_m,,1:technology
92726,article,kroes-meijers:2006,,,2006,,The Dual Nature of Technical Artefacts,The Dual Nature of Technical Artefacts,,,,studies-in-history-and-philosophy-of-science,37,37,1,1,1--4,1,,,,,,,,,,,,,,,,,,,english,false,,,kroes;meijers_a,,,2:extrinsic_entities;3:artefacts
92727,book,kroes:1985,,,1985,,Time: Its Structure and Role in Physical Theories,Time: Its Structure and Role in Physical Theories,,,,,,,179,179,,,,synthese_library,Dordrecht,,,d-reidel-publishing-co,,,,,,,,,,,,,english,false,,,kroes,,,1:time
92728,incollection,kroes:1989,,,1989,,Philosophy of Science and the Technological Dimension of Science,Philosophy of Science and the Technological Dimension of Science,,,,,,,,,375--382,375,,,,,,,,,,,,,,,,,,,english,false,,,kroes,,,1:science
92729,incollection,kroes:1994,,,1994,,"Science, Technology and Experiments; The Natural versus the Artificial","Science, Technology and Experiments; The Natural versus the Artificial",,,,,,,,,431--440,431,,,,,,,,,,,,,,,,,,,english,false,,,kroes,,,1:technology
92730,article,kroes:2006,,,2006,,Coherence of Structural and Functional Descriptions of Technical Artefacts,Coherence of Structural and Functional Descriptions of Technical Artefacts,,,,studies-in-history-and-philosophy-of-science,37,37,1,1,137--151,137,,,,,,,,,,,,,,,,,,,english,false,,,kroes,,,2:extrinsic_entities;3:artefacts
92731,incollection,kroes:2009,,,2009,,Engineering Design,Engineering Design,,,,,,,,,112--117,112,,,,,,,,,,,,,,,,,,,english,false,,,kroes,,,1:science
92732,incollection,kroes:2021,,,2021,,Engineering Design,Engineering Design,,,,,,,,,289--299,289,,,,,,,,,,,,,,,,,,,english,false,,,kroes,,,1:science;2:technology;3:engineering
92733,article,kroesbergen:2015,,,2015,,`Superstition' as a Contemplative Term: A Wittgensteinian Perspective,‘Superstition' as a Contemplative Term: A Wittgensteinian Perspective,,,,international-journal-for-philosophy-of-religion,77,77,2,2,105--122,105,,,,,,,,,,,,,,,,,,,english,false,,,kroesbergen,,,1:religion
92734,incollection,kroetke_w:2000,,,2000,,The Humanity of the Human Person in Karl Barth's Anthropology,The Humanity of the Human Person in Karl Barth's Anthropology,,,,,,,,,159--176,159,,,,,,,,,,,,,,,,,,,english,false,,,kroetke_w,,,1:persons
92735,incollection,kroetke_w:2015,,,2015,,Die Attribute Gottes in der neueren deutschsprachigen evangelischen Dogmatik,Die Attribute Gottes in der neueren deutschsprachigen evangelischen Dogmatik,,,,,,,,,35--48,35,,,,,,,,,,,,,,,,,,,german,false,,,kroetke_w,,,1:religion;2:divine_attributes
92736,incollection,krogh_c-herrestad:1996,,,1996,,Getting Personal: Some Notes on the Relationship Between Personal and Impersonal Obligation,Getting Personal: Some Notes on the Relationship Between Personal and Impersonal Obligation,,,,,,,,,134--153,134,,,,,,,,,,,,,,,,,,,english,false,,,krogh_c;herrestad_h,,,2:deontic_logic
92737,incollection,krogh_c-jones:1999,,,1999,,Protocol Breaches and Violation Flaws,Protocol Breaches and Violation Flaws,,,,,,,,,265--274,265,,,,,,,,,,,,,,,,,,,english,false,,,krogh_c;jones_aji,,,2:deontic_logic;3:prima_facie_obligation
92738,incollection,krogh_c:1999,,,1999,,Abstract: On the Role of Action Logics and Deontic Logics in Specifying Protocols,Abstract: On the Role of Action Logics and Deontic Logics in Specifying Protocols,,,,,,,,,28--29,28,,,,,,,,,,,,,,,,,,,english,false,,,krogh_c,,,2:deontic_logic
92739,incollection,krogh_t:2015,,,2015,,Jean Bodin: The Modern State Comes into Being,Jean Bodin: The Modern State Comes into Being,,,,,,,,,43--60,43,,,,,,,,,,,,,,,,,,,english,false,,,krogh_t,,,1:political_philosophy
92740,incollection,krohmal-emanuel:2007,,,2007,,Tiers Without Tears: The Ethics of a Two-Tier Health Care System,Tiers Without Tears: The Ethics of a Two-Tier Health Care System,,,,,,,,,175--189,175,,,,,,,,,,,,,,,,,,,english,false,,,krohmal;emanuel_ej,,,1:medicine;2:medical_ethics
92741,incollection,krohn_w:1985,,,1985,,Edgar Zilsel zur Methodologie einer exakten Geisteswissenschaft,Edgar Zilsel zur Methodologie einer exakten Geisteswissenschaft,,,,,,,,,257--274,257,,,,,,,,,,,,,,,,,,,german,false,,,krohn_w,,,1:social_sciences;2:humanities
92742,book,krohn_w:2006,,,2006,,"{\""A}sthetik in der Wissenschaft.~Interdisziplin{\""a}rer Diskurs {\""u}ber das Gestalten und Darstellen von Wissen",Ästhetik in der Wissenschaft. Interdisziplinärer Diskurs über das Gestalten und Darstellen von Wissen,"{\""A}sthetik in der Wissenschaft.~Interdisziplin{\""a}rer Diskurs {\""u}ber das Gestalten und Darstellen von Wissen",Ästhetik in der Wissenschaft. Interdisziplinärer Diskurs über das Gestalten und Darstellen von Wissen,,,,,7,7,,,,zeitschrift_f_u_r_a_sthetik_und_allgemeine_kunstwissenschaft_sonderheft,Hamburg,,,felix-meiner-verlag,,,,,,,,,,,,,german,false,,,,krohn_w,,1:aesthetics
92743,incollection,krohne_h:2003,,,2003,,Individual Differences in Emotional Reactions and Coping,Individual Differences in Emotional Reactions and Coping,,,,,,,,,698--725,698,,,,,,,,,,,,,,,,,,,english,false,,,krohne_h,,,1:feeling;2:emotions
92744,UNKNOWN,krohs_m:1994,,,1994,,Neodarwinistische und symbiogenetische Evolutionstheorie: philosophische und wissenschaftliche Analyse einer aktuellen Kontroverse in der Evolutionsbiologie,Neodarwinistische und symbiogenetische Evolutionstheorie: philosophische und wissenschaftliche Analyse einer aktuellen Kontroverse in der Evolutionsbiologie,,,,,,,,,,,,,Fribourg,,d_e_partement_de_philosophie_universit_e_de_fribourg,,Travail de licence,,,,,,,,,,,,german,false,,,krohs_m,,,
