id,entry_type,bibkey,options,shorthand,date_year,pubstate,title_latex,title_unicode,booktitle_latex,booktitle_unicode,crossref,journal_key,volume,volume_numeric,number,number_numeric,pages,start_page,eid,series_key,address,institution_key,school_key,publisher_key,type_field,edition,note_latex,note_unicode,issuetitle_latex,issuetitle_unicode,extra_note_latex,extra_note_unicode,urn,eprint,doi,url,langid,is_translation,epoch,license,author_keys,editor_keys,guesteditor_keys,keyword_keys
92374,article,kremer_m:1988,,,1988,,Logic and Meaning: The Philosophical Significance of the Sequent Calculus,Logic and Meaning: The Philosophical Significance of the Sequent Calculus,,,,mind,97,97,,,50--72,50,,,,,,,,,,,,,,,,,,,english,false,,,kremer_m,,,1:vagueness
92375,article,kremer_m:1988a,,,1988,,Kripke and the Logic of Truth,Kripke and the Logic of Truth,,,,journal-of-philosophical-logic,17,17,3,3,225--278,225,,,,,,,,,,,,,,,,,,,english,false,,,kremer_m,,,1:truth;2:axiomatic_theories_of_truth
92376,incollection,kremer_m:1990,,,1990,,Paradox and Reference,Paradox and Reference,,,,,,,,,33--48,33,,,,,,,,,,,,,,,,,,,english,false,,,kremer_m,,,1:argumentation;2:paradoxes
92377,article,kremer_m:1991,,,1991,,Set-Theoretic Realism and Arithmetic,Set-Theoretic Realism and Arithmetic,,,,philosophical-studies,64,64,3,3,253--271,253,,,,,,,,,,,,,,,,,10.1007/bf00365001,,english,false,,,kremer_m,,,1:mathematics;2:set_theory
92378,article,kremer_m:1994,,,1994,,The Argument of `On Denoting',The Argument of ‘On Denoting',,,,the-philosophical-review,103,103,2,2,249--297,249,,,,,,,,,,,,,,,,,,,english,false,,,kremer_m,,,1:reference;2:definite_descriptions;3:on_denoting
92379,article,kremer_m:1997,,,1997,,Contextualism and Holism in the early Wittgenstein: From Prototractatus to Tractatus,Contextualism and Holism in the early Wittgenstein: From Prototractatus to Tractatus,,,,philosophical-topics,25,25,2,2,87--120,87,,,,,,,,,,,,,,,,,,,english,false,,,kremer_m,,,1:representation;2:content_determination;3:content_contextualism
92380,article,kremer_m:1997a,,,1997,,Marti on Descriptions in Carnap's S2,Marti on Descriptions in Carnap's S2,,,,journal-of-philosophical-logic,26,26,6,6,629--634,629,,,,,,,,,,,,,,,,,,,english,false,,,kremer_m,,,1:reference;2:definite_descriptions
92381,article,kremer_m:2000a,,,2000,,Wilson on Kripke's Wittgenstein,Wilson on Kripke's Wittgenstein,,,,philosophy-and-phenomenological-research,60,60,3,3,571--584,571,,,,,,,,,,,,,,,,,,,english,false,,,kremer_m,,,1:reference;2:rigidity
92382,article,kremer_m:2006,,,2006,,Logicist Responses to Kant: (Early) Frege and (Early) Russell,Logicist Responses to Kant: (Early) Frege and (Early) Russell,,,,philosophical-topics,34,34,1/2,1,163--188,163,,,,,,,,,,,,,,,,,,,english,false,,,kremer_m,,,1:history_of_philosophy
92383,article,kremer_m:2007,,,2007,,Read on Identity and Harmony -- A Friendly Correction and Simplification,Read on Identity and Harmony – A Friendly Correction and Simplification,,,,analysis,67,67,2,2,157--159,157,,,,,,,,,,,,,,,,,,,english,false,,,kremer_m,,,1:identity
92384,article,kremer_m:2008,,,2008,,Soames on Russell's Logic: A Reply,Soames on Russell's Logic: A Reply,,,,philosophical-studies,139,139,2,2,209--212,209,,,,,,,,,,,,,,,,,10.1007/s11098-007-9113-0,,english,false,,,kremer_m,,,1:logic
92385,incollection,kremer_m:2010a,,,2010,,Representation or Inference: Must We Choose? should we?,Representation or Inference: Must We Choose? should we?,,,,,,,,,227--246,227,,,,,,,,,,,,,,,,,,,english,false,,,kremer_m,,,1:representation;2:meaning_theories;3:inferentialism_about_meaning
92386,incollection,kremer_m:2013,,,2013,,What is the Good of Philosophical History?,What is the Good of Philosophical History?,,,,,,,,,294--325,294,,,,,,,,,,,,,,,,,,,english,false,,,kremer_m,,,1:history_of_philosophy;2:why_history_of_philosophy
92387,article,kremer_m:2017,,,2017,,Ryle's ``Intellectualist Legend'' in Historical Context,Ryle's “Intellectualist Legend” in Historical Context,,,,journal-for-the-history-of-analytical-philosophy,5,5,5,5,,,,,,,,,,,,,,,,,,,,,english,false,,,kremer_m,,,
92388,article,kremer_m:2017a,,,2017,,A Capacity to Get Things Right: Gilbert Ryle on Knowledge,A Capacity to Get Things Right: Gilbert Ryle on Knowledge,,,,european-journal-of-philosophy,25,25,1,1,25--46,25,,,,,,,,,,,,,,,,,,,english,false,,,kremer_m,,,1:knowledge
92389,incollection,kremer_m:2021,,,2021,,Gilbert Ryle on Skill as Knowledge-How,Gilbert Ryle on Skill as Knowledge-How,,,,,,,,,100--112,100,,,,,,,,,,,,,,,,,,,english,false,,,kremer_m,,,1:knowledge;2:knowing_how
92390,article,kremer_p-kremer:2003,,,2003,,Some Supervaluation-Based Consequence Relations,Some Supervaluation-Based Consequence Relations,,,,journal-of-philosophical-logic,32,32,3,3,225--224,224,,,,,,,,,,,,,,,,,,,english,false,,,kremer_p;kremer_m,,,1:logic;2:entailment;3:logical_consequence
92391,article,kremer_p-urquhart:2008,,,2008,,Supervaluation Fixed-Point Logics of Truth,Supervaluation Fixed-Point Logics of Truth,,,,journal-of-philosophical-logic,37,37,5,5,407--440,407,,,,,,,,,,,,,,,,,,,english,false,,,kremer_p;urquhart,,,1:truth;2:logic_of_truth
92392,article,kremer_p:1989,,,1989,,Relevant Predication: Grammatical Characterizations,Relevant Predication: Grammatical Characterizations,,,,journal-of-philosophical-logic,18,18,4,4,349--382,349,,,,,,,,,,,,,,,,,,,english,false,,,kremer_p,,,1:properties;2:universals
92393,article,kremer_p:1993,,,1993,,Quantifying Over Propositions in Relevance Logic: Nonaxiomatizability of Primary Interpretations of $\forall P$ and $\exists P$,Quantifying Over Propositions in Relevance Logic: Nonaxiomatizability of Primary Interpretations of ∀ P and ∃ P,,,,the-journal-of-symbolic-logic,58,58,1,1,334--349,334,,,,,,,,,,,,,,,,,,,english,false,,,kremer_p,,,1:ontology;2:quantification;3:propositional_quantifiers
92394,article,kremer_p:1993a,,,1993,,The Gupta-Belnap Systems $S''$ and $S*$ are Not Axiomatizable,The Gupta-Belnap Systems S” and S* are Not Axiomatizable,,,,notre-dame-journal-of-formal-logic,34,34,4,4,583--596,583,,,,,,,,,,,,,,,,,,,english,false,,,kremer_p,,,1:truth;2:revision_theory_of_truth
92395,article,kremer_p:1997,,,1997,,"Dunn's Relevant Predication, Real Properties, and Identity","Dunn's Relevant Predication, Real Properties, and Identity",,,,erkenntnis,47,47,1,1,37--65,37,,,,,,,,,,,,,,,,,,,english,false,,,kremer_p,,,1:properties;2:universals
92396,article,kremer_p:1997a,,,1997,,Propositional Quantification in the Topological Semantics for {S4},Propositional Quantification in the Topological Semantics for S4,,,,notre-dame-journal-of-formal-logic,38,38,2,2,295--312,295,,,,,,,,,,,,,,,,,,,english,false,,,kremer_p,,,1:ontology;2:quantification;3:propositional_quantifiers
92397,article,kremer_p:1997b,,,1997,,On the Complexity of Propositional Quantification in Intuitionistic Logic,On the Complexity of Propositional Quantification in Intuitionistic Logic,,,,the-journal-of-symbolic-logic,62,62,2,2,529--544,529,,,,,,,,,,,,,,,,,,,english,false,,,kremer_p,,,1:ontology;2:quantification;3:propositional_quantifiers
92398,article,kremer_p:1997c,,,1997,,Defining Relevant Implication in Propositionally Quantified S4,Defining Relevant Implication in Propositionally Quantified S4,,,,the-journal-of-symbolic-logic,62,62,4,4,1057--1069,1057,,,,,,,,,,,,,,,,,,,english,false,,,kremer_p,,,1:logic;2:modal_logic
92399,unpublished,kremer_p:1998,,,1998,,Relevant Identity: A Technical Result,Relevant Identity: A Technical Result,,,,,,,,,,,,,,,,,,,"Unpublished manuscript, Yale University","Unpublished manuscript, Yale University",,,,,,,,,english,false,,,kremer_p,,,1:identity;2:logic_of_identity;3:relevant_identity
92400,unpublished,kremer_p:1998a,,,1998,,Dynamic Topological Logic,Dynamic Topological Logic,,,,,,,,,,,,,,,,,,,"Unpublished manuscript, Yale University","Unpublished manuscript, Yale University",,,,,,,,,english,false,,,kremer_p,,,1:time;2:tense_logic;3:dynamic_logic
92401,article,kremer_p:1999,,,1999,,Relevant Identity,Relevant Identity,,,,journal-of-philosophical-logic,28,28,2,2,190--222,190,,,,,,,,,,,,,,,,,,,english,false,,,kremer_p,,,1:identity;2:logic_of_identity;3:relevant_identity
92402,incollection,kremer_p:2000,,,2000,,On the ``Semantics'' for Languages with their own Truth Predicates,On the “Semantics” for Languages with their own Truth Predicates,,,,,,,,,217--246,217,,,,,,,,,,,,,,,,,,,english,false,,,kremer_p,,,1:truth;2:logic_of_truth
92403,article,kremer_p:2009,,,2009,,Comparing Fixed-Point and Revision Theories of Truth,Comparing Fixed-Point and Revision Theories of Truth,,,,journal-of-philosophical-logic,38,38,4,4,363--403,363,,,,,,,,,,,,,,,,,,,english,false,,,kremer_p,,,1:truth;2:logic_of_truth
92404,article,kremer_p:2010,,,2010,,How Truth Behaves When There's No Vicious Reference,How Truth Behaves When There's No Vicious Reference,,,,journal-of-philosophical-logic,39,39,4,4,344--367,344,,,,,,,,,,,,,,,,,,,english,false,,,kremer_p,,,1:truth;2:logic_of_truth
92405,article,kremer_p:2014,,,2014,,Quantified Modal Logic on the Rational Line,Quantified Modal Logic on the Rational Line,,,,the-review-of-symbolic-logic,7,7,3,3,439--454,439,,,,,,,,,,,,,,,,,,,english,false,,,kremer_p,,,1:logic;2:modal_logic;3:predicate_modal_logic
92406,article,kremer_p:2014a,,,2014,,Indeterminacy of Fair Infinite Lotteries,Indeterminacy of Fair Infinite Lotteries,,,,synthese,191,191,8,8,1757--1760,1757,,,,,,,,,,,,,,,,,,,english,false,,,kremer_p,,,1:knowledge;2:reliabilism;3:lottery_paradox
92407,book,kremer_r:1920,,,1920,,Le n{\'e}o-r{\'e}alisme am{\'e}ricain,Le néo-réalisme américain,,,,,,,,,,,,,Paris,,,felix-alcan-editeur,,,,,,,,,,,,,french,false,,,kremer_r,,,1:perception
92408,book,kremer_r:1928,,,1928,,La th{\'e}orie de la connaissance chez les n{\'e}o-r{\'e}alistes anglais,La théorie de la connaissance chez les néo-réalistes anglais,,,,,,,,,,,,,Paris,,,librairie-philosophique-jean-vrin,,,,,,,,,,,,,french,false,,,kremer_r,,,1:epistemology
92409,incollection,kremer_rl:1992,,,1992,,From Psychophysics to Phenomenalism: Mach and Hering on Color Vision,From Psychophysics to Phenomenalism: Mach and Hering on Color Vision,,,,,,,,,147--174,147,,,,,,,,,,,,,,,,,,,english,false,,,kremer_rl,,,1:perception;2:colours
92410,article,kremer_t:1959,,,1959,,The Significance of Solipsism,The Significance of Solipsism,,,,proceedings-of-the-aristotelian-society,60,60,,,35--60,35,,,,,,,,,,,,,,,,,,,english,false,,,kremer_t,,,1:metaphysics;2:perspectivalism;3:first_personalism
92411,article,kremermarietti:1957,,,1957,,Y a-t-il une philosophie de la composition?,Y a-t-il une philosophie de la composition?,,,,les-etudes-philosophiques,12,12,3,3,312--317,312,,,,,,,,,,,,,,,,,,,french,false,,,kremermarietti,,,1:aesthetics;2:music
92412,incollection,kremermarietti:1990,,,1990,,Self-Interpretation-in-Existence and Its Legitimation,Self-Interpretation-in-Existence and Its Legitimation,,,,,,,,,233--238,233,,,,,,,,,,,,,,,,,,,english,false,,,kremermarietti,,,1:ethics;2:meaning_of_life
92413,incollection,kremermarietti:1994,,,1994,,Peirce's Epistemology as a Generalized Theory of Language,Peirce's Epistemology as a Generalized Theory of Language,,,,,,,,,109--122,109,,,,,,,,,,,,,,,,,,,english,false,,,kremermarietti,,,1:epistemology
92414,book,kremermarietti:2001,,,2001,,La philosophie cognitive,La philosophie cognitive,,,,,,,,,,,,epist_e_mologie_et_philosophie_des_sciences,Paris,,,l-harmattan,,,,,,,,,,,,,french,false,,,kremermarietti,,,
92415,book,kremermarietti:2005a,,,2005,,"{\'E}pist{\'e}mologiques, philosophiques, anthropologiques","Épistémologiques, philosophiques, anthropologiques",,,,,,,,,,,,epist_e_mologie_et_philosophie_des_sciences,Paris,,,l-harmattan,,,,,,,,,,,,,french,false,,,kremermarietti,,,1:epistemology
92416,incollection,kremermarietti:2009,,,2009,,Jean Wahl the Precursor: Kierkegaard and Existentialism,Jean Wahl the Precursor: Kierkegaard and Existentialism,,,,,,,,,23--30,23,,,,,,,,,,,,,,,,,,,english,false,,,kremermarietti,,,1:metaphysics;2:existentialism
92417,incollection,kremermarietti:2009a,,,2009,,Jean Wahl the Precursor,Jean Wahl the Precursor,,,,,,,,,335--340,335,,,,,,,,,,,,,,,,,,,english,false,,,kremermarietti,,,
92418,incollection,kremermarietti:2010,,,2010,,Jean Wahl and the Renewal of Metaphysics,Jean Wahl and the Renewal of Metaphysics,,,,,,,,,97--110,97,,,,,,,,,,,,,,,,,,,english,false,,,kremermarietti,,,1:metaphysics
92419,book,kremermarietti:2011,,,2011,,Les ressorts du symbolique,Les ressorts du symbolique,,,,,,,,,,,,ouverture_philosophique,Paris,,,l-harmattan,,,,,,,,,,,,,french,false,,,kremermarietti,,,1:aesthetics
92420,book,kremermarietti:2013,,,2013,,Libert{\'e} de dire,Liberté de dire,,,,,,,,,,,,commentaires_philosophiques,Paris,,,l-harmattan,,,,,,,,,,,,,french,false,,,kremermarietti,,,1:political_philosophy;2:freedom_of_speech
92421,incollection,kremm_d-schafer:2018,,,2018,,Metaethical Quietism,Metaethical Quietism,,,,,,,,,643--658,643,,,,,,,,,,,,,,,,,,,english,false,,,kremm_d;schafer_k,,,1:ethics;2:metaethics
92422,article,kremm_d:2018,,,2018,,Expressing Our Attitudes [Critical Notice of \citet{schroeder_m:2015}],Expressing Our Attitudes [Critical Notice of Schroeder (2015)],,,,analysis,78,78,1,1,139--150,139,,,,,,,,,,,,,,,,,,,english,false,,,kremm_d,,,1:representation;2:expressivism_re_representation
92423,book,kremnitzer_m-etal:2020,,,2020,,Proportionality in Action: Comparative and Empirical Perspectives on the Judicial Practice,Proportionality in Action: Comparative and Empirical Perspectives on the Judicial Practice,Proportionality in Action: Comparative and Empirical Perspectives on the Judicial Practice,Proportionality in Action: Comparative and Empirical Perspectives on the Judicial Practice,,,,,,,,,,cambridge_studies_in_constitutional_law,Cambridge,,,cambridge-university-press,,,,,,,,,,,10.1017/9781108596268,,english,false,,,,kremnitzer_m;steiner_t;lang_a,,
92424,article,krenger_a:2014,,,2014,,"Schopenhauer {\""u}ber das Objekt der Kunst",Schopenhauer über das Objekt der Kunst,,,,arete,1,1,,,,,,,,,,,,,,,,,,,,,,,german,false,,,krenger_a,,,
92425,techreport,kreppe:1988,,,1988,,A Blissymbolics Translation Program,A Blissymbolics Translation Program,,,,,,,lp--88--10,,,,,,Amsterdam,institute_for_language_logic_and_information_university_of_amsterdam,,,,,,,,,,,,,,,english,false,,,kreppe,,,1:linguistics
92426,book,kreps-wallace:1997,,,1997,,Advances in Economics and Econometrics: Seventh World Congress of the Econometric Society,Advances in Economics and Econometrics: Seventh World Congress of the Econometric Society,Advances in Economics and Econometrics: Seventh World Congress of the Econometric Society,Advances in Economics and Econometrics: Seventh World Congress of the Econometric Society,,,,,,,,,,,Cambridge,,,cambridge-university-press,,,,,,,,,,,,,english,false,,,,kreps;wallace_k,,1:economics
92427,book,kreps:1988,,,1988,,Notes on the Theory of Choice,Notes on the Theory of Choice,,,,,,,,,,,,,"Boulder, Colorado",,,westview-press,,,,,,,,,,,,,english,false,,,kreps,,,1:decision_theory;2:preference;3:utility
92428,book,kreps:1990,,,1990,,A Course in Microeconomic Theory,A Course in Microeconomic Theory,,,,,,,,,,,,,"Princeton, New Jersey",,,princeton-university-press,,,,,,,,,,,,,english,false,,,kreps,,,1:decision_theory;2:preference;3:utility
92429,book,kreps:1990a,,,1990,,Game Theory and Economic Modelling,Game Theory and Economic Modelling,,,,,,,,,,,,,Oxford,,,oxford-university-press,,,,,,,,,,,,,english,false,,,kreps,,,1:decision_theory;2:game_theory
92430,incollection,kreps:2014,,,2014,,Virtuality and Humanity,Virtuality and Humanity,,,,,,,,,712--726,712,,,,,,,,,,,,,,,,,,,english,false,,,kreps,,,1:ai;2:virtual_reality
92431,incollection,kresic_a:1979,,,1979,,Political Dictatorship: The Conflict of Politics and Society,Political Dictatorship: The Conflict of Politics and Society,,,,,,,,,121--138,121,,,,,,,,,,,,,,,,,,,english,false,,,kresic_a,,,1:political_philosophy;2:marxism;3:praxis
92432,incollection,kress_e:2020,,,2020,,"Aristotle on Spontaneous Generation, Spontaneity and Natural Processes","Aristotle on Spontaneous Generation, Spontaneity and Natural Processes",,,,,,,,,157--204,157,,,,,,,,,,,,,,,,,,,english,false,,,kress_e,,,1:time;2:becoming
92433,incollection,kress_k:2010,,,2010,,Coherence,Coherence,,,,,,,,,521--538,521,,,,,,,,,,,,,,,,,,,english,false,,,kress_k,,,1:law
92434,article,kretchmar_s:1972,,,1972,,Ontological Possibilities: Sport as Play,Ontological Possibilities: Sport as Play,,,,philosophic-exchange,3,3,,,113--122,113,,,,,,,,,,,,,,,,http://hdl.handle.net/20.500.12648/3178,,http://hdl.handle.net/20.500.12648/3178,english,false,,,kretchmar_s,,,1:social_philosophy;2:sport
92435,incollection,kretchmar_s:2014,,,2014,,The Philosophy of Sport and Analytic Philosophy,The Philosophy of Sport and Analytic Philosophy,,,,,,,,,41--51,41,,,,,,,,,,,,,,,,,,,english,false,,,kretchmar_s,,,1:social_philosophy;2:sport
92436,incollection,kretchmar_s:2015,,,2015,,Formalism and Sport,Formalism and Sport,,,,,,,,,11--21,11,,,,,,,,,,,,,,,,,,,english,false,,,kretchmar_s,,,1:social_philosophy;2:sport
92437,article,kretschmann:1931,,,1931,,The Problem of Gravitation in Aristotle and the New Physics,The Problem of Gravitation in Aristotle and the New Physics,,,,the-journal-of-philosophy,28,28,10,10,260--267,260,,,,,,,,,,,,,,,,,,,english,false,,,kretschmann,,,1:space_spacetime;2:gravitation
92438,book,kretzmann-etal:1982,,,1982,,The Cambridge History of Later Mediaeval Philosophy: from the Rediscovery of Aristotle to the Disintegration of Scholasticism 1100--1600,The Cambridge History of Later Mediaeval Philosophy: from the Rediscovery of Aristotle to the Disintegration of Scholasticism 1100–1600,The Cambridge History of Later Mediaeval Philosophy: from the Rediscovery of Aristotle to the Disintegration of Scholasticism 1100--1600,The Cambridge History of Later Mediaeval Philosophy: from the Rediscovery of Aristotle to the Disintegration of Scholasticism 1100–1600,,,,,,,,,,,Cambridge,,,cambridge-university-press,,,,,,,,,,,,,english,false,,,,kretzmann;kenny_a;pinborg;stump_e,,1:history_of_philosophy
92439,book,kretzmann-stump:1988,,,1988,,The Cambridge Translations of Medieval Philosophical Texts.~Volume I: Logic and the Philosophy of Language,The Cambridge Translations of Medieval Philosophical Texts. Volume I: Logic and the Philosophy of Language,The Cambridge Translations of Medieval Philosophical Texts.~Volume I: Logic and the Philosophy of Language,The Cambridge Translations of Medieval Philosophical Texts. Volume I: Logic and the Philosophy of Language,,,,,,,,,,,Cambridge,,,cambridge-university-press,,,,,,,,,,,,,english,false,,,,kretzmann;stump_e,,1:history_of_philosophy
92440,article,kretzmann:1965,,,1965,,On Rose's `Cartesian Circle' \citep{rose_le:1965},"On Rose's ‘Cartesian Circle' (Rose, 1965)",,,,philosophy-and-phenomenological-research,26,26,1,1,90--92,90,,,,,,,,,,,,,,,,,,,english,false,,,kretzmann,,,1:metaphysics
92441,article,kretzmann:1966,,,1966,,Omniscience and Immutability,Omniscience and Immutability,,,,the-journal-of-philosophy,63,63,,,409--421,409,,,,,,,,,,,,,,,,,,,english,false,,,kretzmann,,,1:religion;2:divine_attributes;3:divine_omniscience
92442,incollection,kretzmann:1974,,,1974,,Aristotle on Spoken Sound Significant by Convention,Aristotle on Spoken Sound Significant by Convention,,,,,,,,,3--22,3,,,,,,,,,,,,,,,,,,,english,false,,,kretzmann,,,1:representation;2:metaphysics_of_words;3:ontology_of_words
92443,article,kretzmann:1976,,,1976,,Aristotle on the Instant of Change,Aristotle on the Instant of Change,,,,proceedings-of-the-aristotelian-society-supplementary-volume,50,50,,,90--114,90,,,,,,,,,,,,,,,,,,,english,false,,,kretzmann,,,1:time;2:change;3:instant_of_change
92444,incollection,kretzmann:1976a,,,1976,,Incipit / Desinit,Incipit / Desinit,,,,,,,,,101--136,101,,,,,,,,,,,,,,,,,,,english,false,,,kretzmann,,,1:time;2:change;3:instant_of_change
92445,article,kretzmann:1977,,,1977,,Socrates is Whiter than Plato begins to be White,Socrates is Whiter than Plato begins to be White,,,,nous,11,11,1,1,3--15,3,,,,,,,,,,,,,,,,,,,english,false,,,kretzmann,,,1:time;2:change;3:instant_of_change
92446,book,kretzmann:1982,,,1982,,Infinity and Continuity in Ancient and Medieval Thought,Infinity and Continuity in Ancient and Medieval Thought,Infinity and Continuity in Ancient and Medieval Thought,Infinity and Continuity in Ancient and Medieval Thought,,,,,,,,,,,"Ithaca, New York",,,cornell-university-press,,,,,,,,,,,,,english,false,,,,kretzmann,,1:history_of_philosophy
92447,incollection,kretzmann:1982a,,,1982,,"Syncategoremata, Exponibilia, Sophismata","Syncategoremata, Exponibilia, Sophismata",,,,,,,,,211--245,211,,,,,,,,,,,,,,,,,,,english,false,,,kretzmann,,,1:exemplification;2:copula
92448,incollection,kretzmann:1982b,,,1982,,"Continuity, Contrariety, Contradiction and Change","Continuity, Contrariety, Contradiction and Change",,,,,,,,,270--296,270,,,,,,,,,,,,,,,,,,,english,false,,,kretzmann,,,1:time;2:change;3:instant_of_change
92449,incollection,kretzmann:1983,,,1983,,"Abraham, Isaac, and Euthyphro: God and the Basis of Morality","Abraham, Isaac, and Euthyphro: God and the Basis of Morality",,,,,,,,,,,,,,,,,,,,,,,,,,,,,english,false,,,kretzmann,,,1:explanation;2:euthyphro
92450,incollection,kretzmann:1984a,,,1984,,\emph{Nos Ipsi Principia Sumus}: Boethius and the Basis of Contingency,Nos Ipsi Principia Sumus: Boethius and the Basis of Contingency,,,,,,,,,23--52,23,,,,,,,,,,,,,,,,,,,english,false,,,kretzmann,,,1:religion;2:divine_attributes;3:divine_omniscience
92451,book,kretzmann:1988,,,1988,,Meaning and Inference in Medieval Philosophy -- Studies in Memory of Jan Pinborg,Meaning and Inference in Medieval Philosophy – Studies in Memory of Jan Pinborg,Meaning and Inference in Medieval Philosophy -- Studies in Memory of Jan Pinborg,Meaning and Inference in Medieval Philosophy – Studies in Memory of Jan Pinborg,,,,,32,32,,,,synthese_historical_library,Dordrecht,,,kluwer-academic-publishers,,,,,,,,,,,,,english,false,,,,kretzmann,,1:logic;2:history_of_logic
92452,incollection,kretzmann:1988a,,,1988,,\emph{Tu scis hoc esse omne quod est hoc}: Richard Kilvington and the Logic of Knowledge,Tu scis hoc esse omne quod est hoc: Richard Kilvington and the Logic of Knowledge,,,,,,,,,225--246,225,,,,,,,,,,,,,,,,,,,english,false,,,kretzmann,,,1:knowledge
92453,article,kretzmann:1988b,,,1988,,God Among the Causes of Moral Evil: The Hardening of Hearts and Spiritual Blinding,God Among the Causes of Moral Evil: The Hardening of Hearts and Spiritual Blinding,,,,philosophical-topics,16,16,2,2,189--214,189,,,,,,,,,,,,,,,,,,,english,false,,,kretzmann,,,1:religion;2:problem_of_evil
92454,incollection,kretzmann:1989,,,1989,,Reason in Mystery,Reason in Mystery,,,,,,,,,15--39,15,,,,,,,,,,,,,,,,,,,english,false,,,kretzmann,,,1:religion
92455,incollection,kretzmann:1989a,,,1989,,Trinity and Transcendentals,Trinity and Transcendentals,,,,,,,,,,,,,,,,,,,,,,,,,,,,,english,false,,,kretzmann,,,1:ontology;2:being;3:transcendentals
92456,incollection,kretzmann:1992a,,,1992,,Evidence Against Anti-Evidentialism,Evidence Against Anti-Evidentialism,,,,,,,,,17--38,17,,,,,,,,,,,,,,,,,,,english,false,,,kretzmann,,,1:religion
92457,incollection,kretzmann:1993a,,,1993,,Resurrection Resurrected: Comments on \citet{collins_ay:1993},Resurrection Resurrected: Comments on Collins (1993),,,,,,,,,141--150,141,,,,,,,,,,,,,,,,,,,english,false,,,kretzmann,,,1:religion;2:immortality;3:resurrection
92458,incollection,kretzmann:1994,,,1994,,"Mystical Perception: St Teresa, William Alston, and the Broadminded Atheist","Mystical Perception: St Teresa, William Alston, and the Broadminded Atheist",,,,,,,,,65--90,65,,,,,,,,,,,,,,,,,,,english,false,,,kretzmann,,,1:religion;2:religious_experience;3:mysticism
92459,incollection,kretzmann:1997a,,,1997,,Creation without Creationism,Creation without Creationism,,,,,,,,,118--144,118,,,,,,,,,,,,,,,,,,,english,false,,,kretzmann,,,1:religion;2:divine_creation
92460,incollection,kreutel-mann:2003,,,2003,,Analyzing Bids in Dialogue Macrogame Theory using Discourse Obligations,Analyzing Bids in Dialogue Macrogame Theory using Discourse Obligations,,,,,,,,,59--66,59,,,,,,,,,,,,,,,,,,,english,false,,,kreutel;mann_wc,,,1:linguistics;2:dialogue;3:dialogue_interpretation
92461,incollection,kreutel-matheson:2002,,,2002,,From Dialogue Acts to Dialogue Act Offers: Building Discourse Structure as an Argumentative Process,From Dialogue Acts to Dialogue Act Offers: Building Discourse Structure as an Argumentative Process,,,,,,,,,85--92,85,,,,,,,,,,,,,,,,,,,english,false,,,kreutel;matheson_co,,,1:pragmatics
92462,incollection,kreutz:2010,,,2010,,Le statut de l'aspect,Le statut de l'aspect,,,,,,,,,111--130,111,,,,,,,,,,,,,,,,,,,french,false,,,kreutz,,,1:exemplification;2:qua_objects
92463,article,kreutzer:2010,,,2010,,Review of \citet{graedel-etal:2007},Review of Grädel et al. (2007),,,,the-bulletin-of-symbolic-logic,16,16,3,3,406--407,406,,,,,,,,,,,,,,,,,,,english,false,,,kreutzer,,,1:logic;2:model_theory;3:finite_model_property
92464,incollection,kreuz-etal:1998,,,1998,,The Use of Exaggeration in Discourse: Cognitive and Social Facets,The Use of Exaggeration in Discourse: Cognitive and Social Facets,,,,,,,,,91--111,91,,,,,,,,,,,,,,,,,,,english,false,,,kreuz;kassler;coppenrath_l,,,1:psychology
92465,incollection,kreuzer_j:1993,,,1993,,Et ecce est ante nos.~Zur Kritik der Sprache bei Augustinus,Et ecce est ante nos. Zur Kritik der Sprache bei Augustinus,,,,,,,,,31--46,31,,,,,,,,,,,,,,,,,,,german,false,,,kreuzer_j,,,1:language
92466,incollection,kreuzer_j:1994,,,1994,,Vom Abgrund des Wissens.~Denken und Mystik beiTauler,Vom Abgrund des Wissens. Denken und Mystik beiTauler,,,,,,,,,633--652,633,,,,,,,,,,,,,,,,,,,german,false,,,kreuzer_j,,,1:epistemology
