id,entry_type,bibkey,options,shorthand,date_year,pubstate,title_latex,title_unicode,booktitle_latex,booktitle_unicode,crossref,journal_key,volume,number,pages,start_page,eid,series_key,address,institution_key,school_key,publisher_key,type_field,edition,note_latex,note_unicode,issuetitle_latex,issuetitle_unicode,extra_note_latex,extra_note_unicode,urn,eprint,doi,url,langid,is_translation,epoch,license,author_keys,editor_keys,guesteditor_keys,keyword_keys
132879,incollection,portmore:2018,,,2018,,Telelogical Reasons,Telelogical Reasons,,,,,,,764--783,764,,,,,,,,,,,,,,,,,,,english,false,,,portmore,,,
132880,book,portmore:2019,,,2019,,Opting for the Best: Oughts and Options,Opting for the Best: Oughts and Options,,,,,,,,,,,Oxford,,,oxford-university-press,,,,,,,,,,,10.1093/oso/9780190945350.001.0001,,english,false,,,portmore,,,1:decision_theory
132881,incollection,portmore:2019a,,,2019,,"Control, Attitudes, and Accountability","Control, Attitudes, and Accountability",,,,,,,7--32,7,,,,,,,,,,,,,,,,,,,english,false,,,portmore,,,1:action
132882,book,portmore:2020,,,2020,,The Oxford Handbook of Consequentialism,The Oxford Handbook of Consequentialism,The Oxford Handbook of Consequentialism,The Oxford Handbook of Consequentialism,,,,,,,,oxford_handbooks,Oxford,,,oxford-university-press,,,,,,,,,,,10.1093/oxfordhb/9780190905323.001.0001,,english,false,,,,portmore,,1:ethics;2:metaethics;3:ethical_consequentialism
132883,book,portner-partee:2002,,,2002,,Formal Semantics.~The Essential Readings,Formal Semantics. The Essential Readings,Formal Semantics.~The Essential Readings,Formal Semantics. The Essential Readings,,,,,,,,linguistics_the_essential_readings,Oxford,,,blackwell-publishers,,,,,,,,,,,,,english,false,,,,portner;partee,,1:linguistics
132884,incollection,portner-rubinstein:2016,,,2016,,Extreme and Non-extreme Deontic Modals,Extreme and Non-extreme Deontic Modals,,,,,,,256--282,256,,,,,,,,,,,,,,,,,,,english,false,,,portner;rubinstein_ay,,,1:modality;2:deontic_modality
132885,article,portner-yabushita:1998,,,1998,,The Semantics and Pragmatics of Topic Phrases,The Semantics and Pragmatics of Topic Phrases,,,,linguistics-and-philosophy,21,2,117--157,117,,,,,,,,,,,,,,,,,,,english,false,,,portner;yabushita,,,1:representation;2:aboutness;3:topic_in_pragmatics
132886,incollection,portner-zanuttini:2005,,,2005,,The Semantics of Norminal Exclamatives,The Semantics of Norminal Exclamatives,,,,,,,57--70,57,,,,,,,,,,,,,,,,,,,english,false,,,portner;zanuttini_r,,,1:reference;2:definite_descriptions
132887,incollection,portner:1991,,,1991,,Gerunds and Types of Events,Gerunds and Types of Events,,,,,,,189--208,189,,,,,,,,,"Available from CLC Publications, Department of Linguistics, Morrill Hall, Cornell University, Ithaca, NY 14853-4701","Available from CLC Publications, Department of Linguistics, Morrill Hall, Cornell University, Ithaca, NY 14853-4701",,,,,,,,,english,false,,,portner,,,1:ontology;2:events
132888,UNKNOWN,portner:1992,,,1992,,Situation Theory and the Semantics of Propositional Expressions,Situation Theory and the Semantics of Propositional Expressions,,,,,,,,,,,"Amherst, Massachusetts",,linguistics_department_university_of_massachusetts,,PhD dissertation,,,,,,,,,,,,english,false,,,portner,,,1:representation;2:objects_of_propositional_attitudes;3:propositions
132889,unpublished,portner:1993,,,1993,,The Semantics of Finiteness and Mood in English,The Semantics of Finiteness and Mood in English,,,,,,,,,,,,,,,,,"Unpublished manuscript, Department of Linguistics, Georgetown University","Unpublished manuscript, Department of Linguistics, Georgetown University",,,,,,,,,english,false,,,portner,,,1:semantics
132890,article,portner:1997,,,1997,,"The Semantics of Mood, Complementation, and Conversational Force","The Semantics of Mood, Complementation, and Conversational Force",,,,natural-language-semantics,5,2,167--212,167,,,,,,,,,,,,,,,,,,,english,false,,,portner,,,1:modality;2:modals
132891,article,portner:1998,,,1998,,The Progressive in Modal Semantics,The Progressive in Modal Semantics,,,,language,74,4,760--787,760,,,,,,,,,,,,,,,,,10.2307/417002,,english,false,,,portner,,,1:exemplification;2:aspect_in_linguistics;3:progressive_tense
132892,article,portner:2003,,,2003,,The (Temporal) Semantics and (Modal) Pragmatics of the Perfect,The (Temporal) Semantics and (Modal) Pragmatics of the Perfect,,,,linguistics-and-philosophy,26,4,459--510,459,,,,,,,,,,,,,,,,,,,english,false,,,portner,,,1:linguistics
132893,book,portner:2005,,,2005,,What is Meaning? Fundamentals of Formal Semantics,What is Meaning? Fundamentals of Formal Semantics,,,,,,,,,,,Oxford,,,blackwell-publishers,,,,,,,,,,,,,english,false,,,portner,,,1:representation;2:meaning
132894,article,portner:2007,,,2007,,Imperatives and Modals,Imperatives and Modals,,,,natural-language-semantics,15,4,351--383,351,,,,,,,,,,,,,,,,,,,english,false,,,portner,,,1:language
132895,incollection,portner:2011,,,2011,,Perfect and Progressive,Perfect and Progressive,,,,,,,1217--1261,1217,,,,,,,,,,,,,,,,,,,english,false,,,portner,,,1:exemplification;2:aspect_in_linguistics;3:progressive_tense
132896,incollection,portner:2011a,,,2011,,Verbal Mood,Verbal Mood,,,,,,,1262--1291,1262,,,,,,,,,,,,,,,,,,,english,false,,,portner,,,1:exemplification;2:aspect_in_linguistics
132897,book,portner:2018,,,2018,,Mood,Mood,,,,,,,,,,,Oxford,,,oxford-university-press,,,,,,,,,,,,,english,false,,,portner,,,1:modality;2:counterfactuals;3:subjunctive_mood
132898,incollection,portner:2018a,,,2018,,Commitment to Priorities,Commitment to Priorities,,,,,,,296--316,296,,,,,,,,,,,,,,,,,,,english,false,,,portner,,,1:pragmatics;2:speech_acts
132899,book,porz_r-etal:2007,,,2007,,Gekauftes Gewissen? Zur Rolle der Bioethik in Institutionen,Gekauftes Gewissen? Zur Rolle der Bioethik in Institutionen,Gekauftes Gewissen? Zur Rolle der Bioethik in Institutionen,Gekauftes Gewissen? Zur Rolle der Bioethik in Institutionen,,,,,,,,,Paderborn,,,mentis-verlag,,,,,,,,,,,,,ngerman,false,,,,porz_r;rehmannsutter;scully_jl;zimmermannacklin,,1:ethics;2:bioethics
132900,book,porz_r:2008,,,2008,,Zwischen Entscheidung und Entfremdung.~Patientenperspektiven in der Gendiagnostik und Albert Camus' Konzepte zum Absurden.~Eine empirisch-ethische Interviewstudie,Zwischen Entscheidung und Entfremdung. Patientenperspektiven in der Gendiagnostik und Albert Camus' Konzepte zum Absurden. Eine empirisch-ethische Interviewstudie,,,,,,,,,,,Paderborn,,,mentis-verlag,,,,,,,,,,,,,ngerman,false,,,porz_r,,,1:ethics;2:bioethics
132901,incollection,porzel-gurevych:2003,,,2003,,Contextual Coherence in Natural Language Processing,Contextual Coherence in Natural Language Processing,,,,,,,272--285,272,,,,,,,,,,,,,,,,,,,english,false,,,porzel;gurevych_i,,,1:pragmatics;2:context
132902,book,posamentier-lehmann:2023,,,2023,,Pi: A Biography of the World's Most Mysterious Number,Pi: A Biography of the World's Most Mysterious Number,,,,,,,,,,,"Amherst, New York",,,prometheus-books,,,,,,,,,,,,,english,false,,,posamentier;lehmann_i,,,
132903,book,posamentier:2022,,,2022,,The Secret Lives of Numbers: Numerals and Their Pecularities in Mathematics and Beyond,The Secret Lives of Numbers: Numerals and Their Pecularities in Mathematics and Beyond,,,,,,,,,,,"Amherst, New York",,,prometheus-books,,,,,,,,,,,,,english,false,,,posamentier,,,
132904,incollection,posch:2011,,,2011,,Hegel and the Sciences,Hegel and the Sciences,,,,,,,177--202,177,,,,,,,,,,,,,,,,,,,english,false,,,posch,,,1:science
132905,incollection,posch:2018,,,2018,,Der Hauptgegensatz von Natur und Geschichte bei Heinrich Rickert,Der Hauptgegensatz von Natur und Geschichte bei Heinrich Rickert,,,,,,,3665--3676,3665,,,,,,,,,,,,,,,,,,,ngerman,false,,,posch,,,1:history
132906,incollection,poscher:2012,,,2012,,Ambiguity and Vagueness in Legal Interpretation,Ambiguity and Vagueness in Legal Interpretation,,,,,,,128--144,128,,,,,,,,,,,,,,,,,,,english,false,,,poscher,,,1:vagueness;2:legal_reasoning
132907,incollection,poscher:2015,,,2015,,"Hermeneutics, Jurisprudence and Law","Hermeneutics, Jurisprudence and Law",,,,,,,451--465,451,,,,,,,,,,,,,,,,,,,english,false,,,poscher,,,1:law
132908,incollection,poscher:2016,,,2016,,An Intentionalist Account of Vagueness: A Legal Perspective,An Intentionalist Account of Vagueness: A Legal Perspective,,,,,,,65--94,65,,,,,,,,,,,,,,,,,,,english,false,,,poscher,,,1:vagueness
132909,incollection,poscher:2019,,,2019,,Hermeneutics and Law,Hermeneutics and Law,,,,,,,326--353,326,,,,,,,,,,,,,,,,,,,english,false,,,poscher,,,1:explanation;2:understanding;3:hermeneutics
132910,incollection,poschmann_c:2018,,,2018,,Focus on Repetition: On the Role of Focus and Repetition in Echo Questions,Focus on Repetition: On the Role of Focus and Repetition in Echo Questions,,,,,,,295--328,295,,,,,,,,,,,,,,,,,,,english,false,,,poschmann_c,,,
132911,incollection,posegga-schmitt:1999,,,1999,,Implementing Semantic Tableaux,Implementing Semantic Tableaux,,,,,,,581--630,581,,,,,,,,,,,,,,,,,,,english,false,,,posegga;schmitt_ph,,,1:logic;2:natural_deduction;3:tableaux
132912,article,poser_h:1969b,,,1969,,Review of \citet{pape_i:1966},Review of Pape (1966),,,,studia-leibnitiana,1,3,227--234,227,,,,,,,,,,,,,,,,,,,english,false,,,poser_h,,,1:modality
132913,article,poser_h:1971,,,1971,,Das Scheitern des logischen Positivismus an modaltheoretischen Problemen,Das Scheitern des logischen Positivismus an modaltheoretischen Problemen,,,,studium-generale,24,,1522--1535,1522,,,,,,,,,,,,,,,,,,,ngerman,false,,,poser_h,,,1:metaphysics;2:empiricism
132914,article,poser_h:1971a,,,1971,,Philosophiegeschichte und rationale Rekonstruktion Wert und Grenze einer Methode,Philosophiegeschichte und rationale Rekonstruktion Wert und Grenze einer Methode,,,,studia-leibnitiana,3,1,67--76,67,,,,,,,,,,,,,,,,,,,ngerman,false,,,poser_h,,,1:history_of_philosophy;2:what_is_history_of_philosophy
132915,incollection,poser_h:1972,,,1972,,"Der M{\""o}glichkeitsbegriff Meinongs",Der Möglichkeitsbegriff Meinongs,,,,,,,187--204,187,,,,,,,,,,,,,,,,,,,ngerman,false,,,poser_h,,,1:modality;2:possible_worlds
132916,incollection,poser_h:1975a,,,1975,,Der Wissenschaftsbegriff der Mathematik,Der Wissenschaftsbegriff der Mathematik,,,,,,,17--33,17,,,,,,,,,,,,,,,,,,,ngerman,false,,,poser_h,,,1:mathematics
132917,article,poser_h:1979,,,1979,,"Die Bedeutung des Begriffs `{\""A}hnlichkeit' in der Metaphysik Christian Wolffs",Die Bedeutung des Begriffs ‘Ähnlichkeit' in der Metaphysik Christian Wolffs,,,,studia-leibnitiana,11,1,62--81,62,,,,,,,,,,,,,,,,,,,ngerman,false,,,poser_h,,,1:properties;2:resemblance
132918,incollection,poser_h:1981,,,1981,,"Zum Verh{\""a}ltnis von Beobachtung und Theorie bei Descartes, Spinoza und Leibniz","Zum Verhältnis von Beobachtung und Theorie bei Descartes, Spinoza und Leibniz",,,,,,,117--146,117,,,,,,,,,,,,,,,,,,,ngerman,false,,,poser_h,,,1:science;2:experimentation
132919,incollection,poser_h:1988,,,1988,,The Failure of Logical Positivism to Cope with Problems of Modal Theory,The Failure of Logical Positivism to Cope with Problems of Modal Theory,,,,,,,311--327,311,,,,,,,,,,,,,,,,,,,english,false,,,poser_h,,,1:modality
132920,incollection,poser_h:1988b,,,1988,,"Mathematische Weltbilder.~Begr{\""u}ndungen mathematischer Rationalit{\""a}t",Mathematische Weltbilder. Begründungen mathematischer Rationalität,,,,,,,289--309,289,,,,,,,,,,,,,,,,,,,ngerman,false,,,poser_h,,,1:mathematics
132921,incollection,poser_h:1997,,,1997,,"Ist eine wissenschaftliche Weltanschauung m{\""o}glich?",Ist eine wissenschaftliche Weltanschauung möglich?,,,,,,,538--556,538,,,,,,,,,,,,,,,,,,,ngerman,false,,,poser_h,,,1:metaphilosophy
132922,book,poser_h:2003,,,2003,,"Ren{\'e} Descartes: Eine Einf{\""u}hrung",René Descartes: Eine Einführung,,,,,,,,,,,Stuttgart,,,reclam,,,,,,,,,,,,,ngerman,false,,,poser_h,,,1:history_of_philosophy
132923,incollection,poser_h:2004a,,,2004,,"``Da ich wider Vermuthen gantz nat{\""u}rlich auf die vorher bestimmte Harmonie des Herrn von Leibnitz gef{\""u}hret ward, so habe ich dieselbe beybehalten''.~Christian Wolffs Rezeption der pr{\""a}stabilierten Harmonie","“Da ich wider Vermuthen gantz natürlich auf die vorher bestimmte Harmonie des Herrn von Leibnitz geführet ward, so habe ich dieselbe beybehalten”. Christian Wolffs Rezeption der prästabilierten Harmonie",,,,,,,49--64,49,,,,,,,,,,,,,,,,,,,ngerman,false,,,poser_h,,,1:mind_body
132924,incollection,poser_h:2011a,,,2011,,Die Mechanisierung menschlicher Arbeit,Die Mechanisierung menschlicher Arbeit,,,,,,,1086--1098,1086,,,,,,,,,,,,,,,,,,,ngerman,false,,,poser_h,,,1:political_philosophy
132925,book,poser_h:2012,,,2012,,"Wissenschaftstheorie.~Eine philosophische Einf{\""u}hrung",Wissenschaftstheorie. Eine philosophische Einführung,,,,,,,,,,,Stuttgart,,,reclam,,2,,,,,,,,,,,ngerman,false,,,poser_h,,,1:science
132926,incollection,poser_h:2012a,,,2012,,Knowledge of Ignorance: On the Problem of the Development and the Assessment of Technology,Knowledge of Ignorance: On the Problem of the Development and the Assessment of Technology,,,,,,,369--412,369,,,,,,,,,,,,,,,,,,,english,false,,,poser_h,,,1:epistemology
132927,unpublished,poser_w:1994,,,1994,,The Structural Typology of Phonological Writing,The Structural Typology of Phonological Writing,,,,,,,,,,,,,,,,,"Unpublished manuscript, Stanford University","Unpublished manuscript, Stanford University",,,,,,,,,english,false,,,poser_w,,,1:linguistics
132928,unpublished,poser_w:1999,,,1999,,A Sorting Tool and Issues in Sorting,A Sorting Tool and Issues in Sorting,,,,,,,,,,,,,,,,,Unpublished manuscript,Unpublished manuscript,,,,,,,,,english,false,,,poser_w,,,1:computation
132929,book,posey_k:2023,,,2023,,"Centering Epistemic Injustice: Epistemic Labor, Willful Ignorance, and Knowing Across Hermeneutical Divides","Centering Epistemic Injustice: Epistemic Labor, Willful Ignorance, and Knowing Across Hermeneutical Divides",,,,,,,,,,,"Lanham, Maryland",,,lexington-books,,,,,,,,,,,,,english,false,,,posey_k,,,
132930,incollection,posick-mcbride:2017,,,2017,,Biological Criminology,Biological Criminology,,,,,,,28--32,28,,,,,,,,,,,,,,,,,,,english,false,,,posick;mcbride_ma,,,1:law;3:criminology
132931,article,poslajko:2014,,,2014,,Review of \citet{edwards_do:2014},Review of Edwards (2014),,,,polish-journal-of-philosophy,8,1,98--100,98,,,,,,,,,,,,,,,,,,,english,false,,,poslajko,,,1:properties
132932,article,poslajko:2014a,,,2014,,Review of \citet{edwards_do:2014},Review of Edwards (2014),,,,polish-journal-of-philosophy,8,1,98--100,98,,,,,,,,,,,,,,,,,,,english,false,,,poslajko,,,1:properties
132933,incollection,posner_ea-vermeule:2017,,,2017,,Demystifying Schmitt,Demystifying Schmitt,,,,,,,612--628,612,,,,,,,,,,,,,,,,,,,english,false,,,posner_ea;vermeule_a,,,1:political_philosophy
132934,book,posner_ea:2000,,,2000,,Law and Social Norms,Law and Social Norms,,,,,,,,,,,"Cambridge, Massachusetts",,,harvard-university-press,,,,,,,,,,,,,english,false,,,posner_ea,,,1:law
132935,incollection,posner_ea:2005,,,2005,,Contract Theory,Contract Theory,,,,,,,138--147,138,,,,,,,,,,,,,,,,,,,english,false,,,posner_ea,,,1:law
132936,article,posner_jb:1978,,,1978,,Coma and other states of consciousness: the differential diagnosis of brain death,Coma and other states of consciousness: the differential diagnosis of brain death,,,,annals-of-the-new-york-academy-of-sciences,315,,215--227,215,,,,,,,,,,,,,,,,,,,english,false,,,posner_jb,,,2:consciousness
132937,book,posner_ml-etal:1991,,,1991,,Contemporary Approaches to Cognitive Psychology,Contemporary Approaches to Cognitive Psychology,Contemporary Approaches to Cognitive Psychology,Contemporary Approaches to Cognitive Psychology,,,,,,,,,?,,,rishi-publications,,,,,,,,,,,,,english,false,,,,posner_ml;dwivedi_b;singh_i,,1:psychology;2:cognitive_science
132938,incollection,posner_ml-klein:1973,,,1973,,On the Functions of Consciousness,On the Functions of Consciousness,,,,,,,,,,,,,,,,,,,,,,,,,,,english,false,,,posner_ml;klein_rm,,,2:consciousness
132939,incollection,posner_ml-rothbart:1992,,,1992,,Attentional Mechanisms and Conscious Experience,Attentional Mechanisms and Conscious Experience,,,,,,,91--111,91,,,,,,,,,,,,,,,,,,,english,false,,,posner_ml;rothbart_mk,,,2:attention
132940,incollection,posner_ml-snyder:1975,,,1975,,Attention and cognitive control,Attention and cognitive control,,,,,,,,,,,,,,,,,,,,,,,,,,,english,false,,,posner_ml;snyder_c,,,2:attention
132941,book,posner_ml:1989,,,1989,,Foundations of Cognitive Science,Foundations of Cognitive Science,Foundations of Cognitive Science,Foundations of Cognitive Science,,,,,,,,,"Cambridge, Massachusetts",,,the-mit-press,,,,,,,,,,,,,english,false,,,,posner_ml,,1:psychology;2:cognitive_science
132942,incollection,posner_ml:1989a,,,1989,,Preface,Preface,,,,,,,ix--xiv,9,,,,,,,,,,,,,,,,,,,english,false,,,posner_ml,,,1:psychology;2:cognitive_science
132943,incollection,posner_ml:1991,,,1991,,Recent Experimental Studies of Conscious and Unconscious Processes,Recent Experimental Studies of Conscious and Unconscious Processes,,,,,,,,,,,,,,,,,,,,,,,,,,,english,false,,,posner_ml,,,2:consciousness
132944,article,posner_ml:1994,,,1994,,Attention: The Mechanisms of Consciousness,Attention: The Mechanisms of Consciousness,,,,proceedings-of-the-national-academy-of-sciences-of-the-usa,91,,7398--7403,7398,,,,,,,,,,,,,,,,,,,english,false,,,posner_ml,,,2:attention
132945,incollection,posner_r:1976,,,1976,,Discourse as a Means to Enlightenment,Discourse as a Means to Enlightenment,,,,,,,641--660,641,,,,,,,,,,,,,,,,,,,english,false,,,posner_r,,,1:argumentation;2:informal_logic
132946,incollection,posner_r:1980,,,1980,,Semantics and Pragmatics of Sentence Connectives in Natural Language,Semantics and Pragmatics of Sentence Connectives in Natural Language,,,,,,,169--203,169,,,,,,,,,,,,,,,,,,,english,false,,,posner_r,,,1:representation;2:speaker_meaning
132947,incollection,posner_r:1980a,,,1980,,Types of Dialogue -- The Use of Microstructures for the Classification of Texts,Types of Dialogue – The Use of Microstructures for the Classification of Texts,,,,,,,111--136,111,,,,,,,,,,,,,,,,,,,english,false,,,posner_r,,,1:science
132948,book,posner_ra:1981,,,1981,,The Economics of Justice,The Economics of Justice,,,,,,,,,,,"Cambridge, Massachusetts",,,harvard-university-press,,,,,,,,,,,,,english,false,,,posner_ra,,,1:law
132949,incollection,posner_ra:1985,,,1985,,Comment on ``On the Economic Theory of Crime'' [on \citet{klevorick:1985}],Comment on “On the Economic Theory of Crime” [on Klevorick (1985)],,,,,,,310--312,310,,,,,,,,,,,,,,,,,,,english,false,,,posner_ra,,,1:law
132950,book,posner_ra:1992,,,1992,,Sex and Reason,Sex and Reason,,,,,,,,,,,"Cambridge, Massachusetts",,,harvard-university-press,,,,,,,,,,,,,english,false,,,posner_ra,,,1:social_philosophy;2:sex
132951,incollection,posner_ra:2004,,,2004,,"Torture, Terrorism, and Interrogation","Torture, Terrorism, and Interrogation",,,,,,,291--298,291,,,,,,,,,,,,,,,,,,,english,false,,,posner_ra,,,1:political_philosophy;2:torture
132952,incollection,posner_ra:2005,,,2005,,"Orwell versus Huxley: Economics, Technology, Privacy, and Satire","Orwell versus Huxley: Economics, Technology, Privacy, and Satire",,,,,,,183--211,183,,,,,,,,,,,,,,,,,,,english,false,,,posner_ra,,,1:economics
132953,incollection,posner_ra:2010,,,2010,,Rorty on Law and Public Policy,Rorty on Law and Public Policy,,,,,,,433--442,433,,,,,,,,,,,,,,,,,,,english,false,,,posner_ra,,,1:law
132954,article,pospesel_g:2025,,,2025,,Moral Saints,Moral Saints,,,,philosophie-ch,,,,,,,,,,,,,,,,,,,,,,https://www.philosophie.ch/2025-03-09-pospesel,english,false,,,pospesel_g,,,
132955,article,pospesel_h:1972,,,1972,,Scepticism and Modal Logic,Scepticism and Modal Logic,,,,logique-et-analyse,15,59/60,653--664,653,,,,,,,,,,,,,,,,,,,english,false,,,pospesel_h,,,1:skepticism
132956,article,possard_m:2020,,,2020,,The Human-Machine Relationship in Digital Accounting,The Human-Machine Relationship in Digital Accounting,,,,philosophie-ch,,,,,,,,,,,,,,,,,,,,,,https://www.philosophie.ch/2020-12-28-possard,english,false,,,possard_m,,,
132957,article,possard_m:2022,,,2022,,"``Ideomotorische Assimilation'' -- oder: {\""U}ber das Leben im Zeitalter der {\""o}konomischen Entscheidungsfindung.",“Ideomotorische Assimilation” – oder: Über das Leben im Zeitalter der ökonomischen Entscheidungsfindung.,,,,philosophie-ch,,,,,,,,,,,,,,,,,,,,,,https://www.philosophie.ch/2022-11-15-possard,ngerman,false,,,possard_m,,,
132958,article,possard_m:2023,,,2023,,Zwischen Kleben und Verstehen: Ziviler Ungehorsam der Klimaaktivist:innen und ihre juristischen und philosophischen Dissonanzen,Zwischen Kleben und Verstehen: Ziviler Ungehorsam der Klimaaktivist:innen und ihre juristischen und philosophischen Dissonanzen,,,,philosophie-ch,,,,,,,,,,,,,,,,,,,,,,https://www.philosophie.ch/2023-09-01-possard,ngerman,false,,,possard_m,,,
132959,article,possard_m:2024,,,2024,,Bilanzen und das Problem mit der Wahrheit,Bilanzen und das Problem mit der Wahrheit,,,,philosophie-ch,,,,,,,,,,,,,,,,,,,,,,https://www.philosophie.ch/2024-06-10-possard,ngerman,false,,,possard_m,,,
132960,article,possard_m:2024a,,,2024,,Ein Essay: Immanuel Kant und Whistleblowing?,Ein Essay: Immanuel Kant und Whistleblowing?,,,,philosophie-ch,,,,,,,,,,,,,,,,,,,,,,https://www.philosophie.ch/2024-09-07-possard,ngerman,false,,,possard_m,,,
132961,article,possati:2013,,,2013,,Si l'action est comme le texte.~La fondation du social et le principe d'analogie chez Ric{\oe}ur,Si l'action est comme le texte. La fondation du social et le principe d'analogie chez Ricœur,,,,dialogue-revue-canadienne-de-philosophie-canadian-philosophical-review,52,3,477--490,477,,,,,,,,,,,,,,,,,,,french,false,,,possati,,,1:argumentation;2:analogy
132962,book,possati:2022,,,2022,,Software as Hermeneutics: A Philosophical and Historical Study,Software as Hermeneutics: A Philosophical and Historical Study,,,,,,,,,,,London,,,palgrave-macmillan,,,,,,,,,,,10.1007/978-3-030-63610-4,,english,false,,,possati,,,1:computation
132963,incollection,posselt-seitz:2020,,,2020,,Relativism and Poststructuralism,Relativism and Poststructuralism,,,,,,,133--144,133,,,,,,,,,,,,,,,,,,,english,false,,,posselt;seitz_s,,,1:metaphysics;2:relativism
132964,incollection,possen:2010,,,2010,,The Exemplarity of Socrates in \emph{The Sickness Unto Death},The Exemplarity of Socrates in The Sickness Unto Death,,,,,,,377--390,377,,,,,,,,,,,,,,,,,,,english,false,,,possen,,,1:history_of_philosophy
132965,article,possin:1986,,,1986,,The Case against Stich's Syntactic Theory of Mind,The Case against Stich's Syntactic Theory of Mind,,,,philosophical-studies,49,3,405--418,405,,,,,,,,,,,,,,,,,10.1007/bf00355526,,english,false,,,possin,,,
132966,article,post_e:1921,,,1921,,Introduction to a General Theory of Elementary Propositions,Introduction to a General Theory of Elementary Propositions,,,,american-journal-of-mathematics,43,,163--185,163,,,,,,,,,Reprinted in \citet{vanheijenoort:1967},Reprinted in,,,,,,,,,english,false,,,post_e,,,1:logic;2:history_of_logic
132967,article,post_e:1936,,,1936,,Finite Combinatory Processes.~Formulation I,Finite Combinatory Processes. Formulation I,,,,the-journal-of-symbolic-logic,1,,103--105,103,,,,,,,,,Reprinted in \citet[289--304]{davis_m:1965},Reprinted in Davis (1965),,,,,,,,,english,false,,,post_e,,,1:mathematics
132968,incollection,post_e:1941,,,1941,,Absolutely unsolvable problems and relatively undecidable propositions -- account of an anticipation,Absolutely unsolvable problems and relatively undecidable propositions – account of an anticipation,,,,,,,338--433,338,,,,,,,,,,,,,,,,,,,english,false,,,post_e,,,1:mathematics
132969,article,post_e:1944,,,1944,,Recursively Enumerable Sets of Positive Integers and Their Decision Problem,Recursively Enumerable Sets of Positive Integers and Their Decision Problem,,,,bulletin-of-the-american-mathematical-society,50,,284--316,284,,,,,,,,,Reprinted in \citet[305--337]{davis_m:1965},Reprinted in Davis (1965),,,,,,,,,english,false,,,post_e,,,1:mathematics;2:arithmetic
132970,article,post_e:1947,,,1947,,Recursive Unsolvability of a Problem of Thue,Recursive Unsolvability of a Problem of Thue,,,,the-journal-of-symbolic-logic,12,,1--11,1,,,,,,,,,Reprinted in \citet[305--337]{davis_m:1965},Reprinted in Davis (1965),,,,,,,,,english,false,,,post_e,,,1:mathematics;2:arithmetic
132971,incollection,post_e:1972,,,1972,,Introduction {\`a} une th{\'e}orie g{\'e}n{\'e}rale des propositions {\'e}l{\'e}mentaires,Introduction à une théorie générale des propositions élémentaires,,,,,,,29--53,29,,,,,,,,,Traduction de \citet{post_e:1921},Traduction de Post (1921),,,,,,,,,french,true,,,post_e,,,1:logic;2:history_of_logic
132972,incollection,post_ej:1967,,,1967,,General Covariance in Electromagnetism,General Covariance in Electromagnetism,,,,,,,102--123,102,,,,,,,,,,,,,,,,,,,english,false,,,post_ej,,,1:physics
132973,incollection,post_ej:1973,,,1973,,Comments on `The Formal Representation of Physical Quantities' [\citet{vanfraassen:1973d}],Comments on ‘The Formal Representation of Physical Quantities' [van Fraassen (1973)],,,,,,,210--213,210,,,,,,,,,,,,,,,,,,,english,false,,,post_ej,,,1:properties;2:quantities
132974,article,post_h:1971,,,1971,,"Correspondance, Invariance and Heuristics: In Praise of Conservative Induction","Correspondance, Invariance and Heuristics: In Praise of Conservative Induction",,,,studies-in-history-and-philosophy-of-science,2,3,213--255,213,,,,,,,,,Reprinted in \citet[1--44]{french_s-kamminga:1993},Reprinted in French and Kamminga (1993),,,,,,,,,english,false,,,post_h,,,1:quantum_mechanics
132975,incollection,post_h:1976,,,1976,,Novel Predictions as a Criterion of Merit,Novel Predictions as a Criterion of Merit,,,,,,,493--496,493,,,,,,,,,,,,,,,,,,,english,false,,,post_h,,,1:method;2:induction
132976,incollection,post_h:1978,,,1978,,Objectivism vs Sociologism,Objectivism vs Sociologism,,,,,,,311--320,311,,,,,,,,,,,,,,,,,,,english,false,,,post_h,,,1:science;2:scientific_realism;3:scientific_progress
