id,entry_type,bibkey,options,shorthand,date_year,pubstate,title_latex,title_unicode,booktitle_latex,booktitle_unicode,crossref,journal_key,volume,number,pages,start_page,eid,series_key,address,institution_key,school_key,publisher_key,type_field,edition,note_latex,note_unicode,issuetitle_latex,issuetitle_unicode,extra_note_latex,extra_note_unicode,urn,eprint,doi,url,langid,is_translation,epoch,license,author_keys,editor_keys,guesteditor_keys,keyword_keys
132297,incollection,poli:2011,,,2011,,"Ontological Categories, Latents and the Irrational","Ontological Categories, Latents and the Irrational",,,,,,,153--164,153,,,,,,,,,,,,,,,,,,,english,false,,,poli,,,1:metaphysics;2:ontological_categories
132298,incollection,poli:2017,,,2017,,Aristotle's Theory of Wholes,Aristotle's Theory of Wholes,,,,,,,56--62,56,,,,,,,,,,,,,,,,,,,english,false,,,poli,,,1:complexity;2:unity;3:wholes
132299,article,policki:1983,,,1983,,Zum Problem des Beweises Ex Motu der Existenz Gottes,Zum Problem des Beweises Ex Motu der Existenz Gottes,,,,logique-et-analyse,26,101,37--50,37,,,,,,,,,,,,,,,,,,,ngerman,false,,,policki,,,1:religion;2:arguments_for_the_existence_of_god;3:cosmological_argument
132300,incollection,polidoro_p:2017,,,2017,,The Reasonable's the Limit,The Reasonable's the Limit,,,,,,,181--200,181,,,,,,,,,,,,,,,,,,,english,false,,,polidoro_p,,,1:history_of_philosophy
132301,article,poliferno:1961,,,1961,,Decision Algorithms for Some Functional Calculi with Modality,Decision Algorithms for Some Functional Calculi with Modality,,,,logique-et-analyse-ns,4,15/16,138--153,138,,,,,,,,,,,,,,,,,,,english,false,,,poliferno,,,1:logic;2:modal_logic
132302,article,poliferno:1964,,,1964,,Correction to a Paper on Modal Logic,Correction to a Paper on Modal Logic,,,,logique-et-analyse,7,25/26,32--33,32,,,,,,,,,,,,,,,,,,,english,false,,,poliferno,,,1:logic;2:modal_logic
132303,incollection,polikarov-ginev:1992,,,1992,,Remarks on Logical Empiricism and Some of A.J.~Ayer's Achievements: Some Fifty Years Later,Remarks on Logical Empiricism and Some of A.J. Ayer's Achievements: Some Fifty Years Later,,,,,,,407--424,407,,,,,,,,,,,,,,,,,,,english,false,,,polikarov;ginev,,,1:history_of_philosophy
132304,incollection,polikarov:1974,,,1974,,The Divergent-Convergent Method -- A Heuristic Approach to Problem-Solving,The Divergent-Convergent Method – A Heuristic Approach to Problem-Solving,,,,,,,211--234,211,,,,,,,,,,,,,,,,,,,english,false,,,polikarov,,,1:method;2:scientific_method
132305,article,polikarov:1993,,,1993,,Is there an Incommensurability between Superseding Theories? On the Validity of the Incommensurability Thesis,Is there an Incommensurability between Superseding Theories? On the Validity of the Incommensurability Thesis,,,,journal-for-general-philosophy-of-science-zeitschrift-fur-allgemeine-wissenschaftstheorie,24,1,127--146,127,,,,,,,,,,,,,,,,,,,english,false,,,polikarov,,,1:science;2:theory_change
132306,incollection,polikarov:1995,,,1995,,Some Questions Concerning Limitations of the Range of Validity of Kuhn's Model of the History of Science,Some Questions Concerning Limitations of the Range of Validity of Kuhn's Model of the History of Science,,,,,,,235--240,235,,,,,,,,,,,,,,,,,,,english,false,,,polikarov,,,1:science;2:history_of_science
132307,article,polin:1951,,,1951,,Principes d'une {\'e}ducation morale ``cynique'',Principes d'une éducation morale “cynique”,,,,dialectica,5,18,206--212,206,,,,,,,,,,,,,,,,,10.1111/j.1746-8361.1951.tb01050.x,,french,false,,,polin,,,1:pedagogy
132308,incollection,polin:1970,,,1970,,Les fondements de l'obligation politique,Les fondements de l'obligation politique,,,,,,,186--193,186,,,,,,,,,,,,,,,,,,,english,false,,,polin,,,1:political_philosophy;2:authority;3:political_obligation
132309,incollection,polin:1976a,,,1976,,{\^E}tre et Ordre,Être et Ordre,,,,,,,38--48,38,,,,,,,,,,,,,,,,,,,french,false,,,polin,,,1:ontology;2:being
132310,incollection,polin:1978,,,1978,,Farewell to the Philosophy of History,Farewell to the Philosophy of History,,,,,,,201--218,201,,,,,,,,,,,,,,,,,,,english,false,,,polin,,,1:history
132311,incollection,polis:1993,,,1993,,The Mentality of Morality: Phenomenological and Psychiatric Approaches,The Mentality of Morality: Phenomenological and Psychiatric Approaches,,,,,,,217--225,217,,,,,,,,,,,,,,,,,,,english,false,,,polis,,,1:ethics;2:evolutionary_ethics;3:debunking_of_ethical_norms
132312,incollection,polis:1996,,,1996,,The Destructive Passions of Life and the Soul: An Interdisciplinary View,The Destructive Passions of Life and the Soul: An Interdisciplinary View,,,,,,,117--120,117,,,,,,,,,,,,,,,,,,,english,false,,,polis,,,1:feeling;2:passions
132313,book,polistena_g:2016,,,2016,,Diacronia.~Appunti per una ontologia tel tempo,Diacronia. Appunti per una ontologia tel tempo,,,,,,,,,,filosofie,Milano,,,mimesis-edizioni,,,,,,,,,,,,,italian,false,,,polistena_g,,,1:time;2:nature_of_time
132314,article,politakis-weiss:1984,,,1984,,Using Empirical Analysis to Refine Expert System Knowledge Bases,Using Empirical Analysis to Refine Expert System Knowledge Bases,,,,artificial-intelligence,22,1,23--48,23,,,,,,,,,,,,,,,,,,,english,false,,,politakis;weiss_sm,,,1:information;2:knowledge_representation;3:knowledge_acquisition
132315,article,politi_v:2015,,,2015,,"Natural Kinds, Causes and Domains: Khalidi on How Science Classifies Things [Review of \citet{khalidi_ma:2013}]","Natural Kinds, Causes and Domains: Khalidi on How Science Classifies Things [Review of Khalidi (2013)]",,,,studies-in-history-and-philosophy-of-science,54,,132--137,132,,,,,,,,,,,,,,,,,,,english,false,,,politi_v,,,1:causation;2:natural_kinds
132316,incollection,politis_v-su:2017,,,2017,,"The Concept of \emph{ousia} in \emph{Metaphysics} Alpha, Beta, and Gamma","The Concept of ousia in Metaphysics Alpha, Beta, and Gamma",,,,,,,257--276,257,,,,,,,,,,,,,,,,,,,english,false,,,politis_v;su_j,,,2:substance
132317,incollection,politis_v:1993,,,1993,,The Primacy of Self-Love in the \emph{Nicomachean Ethics},The Primacy of Self-Love in the Nicomachean Ethics,,,,,,,153--174,153,,,,,,,,,,,,,,,,,,,english,false,,,politis_v,,,1:feeling;2:friendship;3:love
132318,article,politis_v:1997,,,1997,,The Apriority of the Starting-Point of Kant's Transcendental Epistemology,The Apriority of the Starting-Point of Kant's Transcendental Epistemology,,,,international-journal-of-philosophical-studies,5,2,255--284,255,,,,,,,,,,,,,,,,,,,english,false,,,politis_v,,,1:epistemology
132319,article,politis_v:2003,,,2003,,Aristotle on \emph{Aporia} and Searching in Metaphysics,Aristotle on Aporia and Searching in Metaphysics,,,,proceedings-of-the-boston-area-colloquium-in-ancient-philosophy,18,,145--182,145,,,,,,,,,,,,,,,,,,,english,false,,,politis_v,,,2:priority;3:archai
132320,book,politis_v:2004,,,2004,,Aristotle and the \emph{Metaphysics},Aristotle and the Metaphysics,,,,,,,,,,routledge_philosophy_guidebook,London,,,routledge,,,,,,,,,,,,,english,false,,,politis_v,,,1:metaphysics
132321,incollection,politis_v:2004a,,,2004,,Aporia and Searching in the Early Plato,Aporia and Searching in the Early Plato,,,,,,,303--318,303,,,,,,,,,Reprinted in \citet[88--109]{judson-karasmanis:2006},Reprinted in Judson and Karasmanis (2006),,,,,,,,,english,false,,,politis_v,,,1:method;2:aporetic_method
132322,article,politis_v:2005,,,2005,,What Enables Us to Search for the Essence of Things? [a critical response to \citet{charles_d:2000}],What Enables Us to Search for the Essence of Things? [a critical response to Charles (2000)],,,,international-journal-of-philosophical-studies,13,2,245--269,245,,,,,,,,,,,,,,,,,,,english,false,,,politis_v,,,2:essence
132323,incollection,politis_v:2005a,,,2005,,Non-Subjective Idealism in Plato (\emph{Sophist} 248e-249d),Non-Subjective Idealism in Plato (Sophist 248e-249d),,,,,,,14--38,14,,,,,,,,,,,,,,,,,,,english,false,,,politis_v,,,1:metaphysics;2:idealism
132324,incollection,politis_v:2007,,,2007,,The Aporia in the Charmides about Reflexive Knowledge and the Contribution to its Solution in the Sun Analogy of the Republic,The Aporia in the Charmides about Reflexive Knowledge and the Contribution to its Solution in the Sun Analogy of the Republic,,,,,,,231--250,231,,,,,,,,,,,,,,,,,,,english,false,,,politis_v,,,1:knowledge;2:self_knowledge;3:introspection
132325,incollection,politis_v:2007a,,,2007,,Is Socrates Paralyzed by his State of \emph{Aporia}? \emph{Meno} 79e7-80d4,Is Socrates Paralyzed by his State of Aporia? Meno 79e7-80d4,,,,,,,268--272,268,,,,,,,,,,,,,,,,,,,english,false,,,politis_v,,,1:history_of_philosophy
132326,incollection,politis_v:2010,,,2010,,Explanation and Essence in Plato's \emph{Phaedo},Explanation and Essence in Plato's Phaedo,,,,,,,62--114,62,,,,,,,,,,,,,,,,,,,english,false,,,politis_v,,,1:method;2:elenchos
132327,book,politis_v:2015,,,2015,,The Structure of Enquiry in Plato's Early Dialogues,The Structure of Enquiry in Plato's Early Dialogues,,,,,,,,,,,Cambridge,,,cambridge-university-press,,,,,,,,,,,10.1017/cbo9781107705746,,english,false,,,politis_v,,,1:history_of_philosophy
132328,incollection,politis_v:2017,,,2017,,\emph{Aporia} and Sceptical Argument in Plato's Early Dialogues,Aporia and Sceptical Argument in Plato's Early Dialogues,,,,,,,48--66,48,,,,,,,,,,,,,,,,,,,english,false,,,politis_v,,,1:method;2:aporetic_method
132329,book,politis_v:2021,,,2021,,Plato's Essentialism: Reinterpreting the Theory of Forms,Plato's Essentialism: Reinterpreting the Theory of Forms,,,,,,,,,,,Cambridge,,,cambridge-university-press,,,,,,,,,,,10.1017/9781108986243,,english,false,,,politis_v,,,
132330,incollection,politis_v:2021a,,,2021,,Metametaphysics in Plato and Aristotle,Metametaphysics in Plato and Aristotle,,,,,,,13--22,13,,,,,,,,,,,,,,,,,,,english,false,,,politis_v,,,1:metaphysics;2:metametaphysics
132331,book,polito:2004,,,2004,,The Sceptical Road.~Aenesidemus' Appropriation of Heraclitus,The Sceptical Road. Aenesidemus' Appropriation of Heraclitus,,,,,,96,,,,philosophia_antiqua,Leiden,,,ej-brill,,,,,,,,,,,,,english,false,,,polito,,,1:skepticism;2:ancient_skepticism
132332,incollection,polito:2006,,,2006,,"Matter, Medicine, and the Mind: Asclepiades vs.~Epicurus","Matter, Medicine, and the Mind: Asclepiades vs. Epicurus",,,,,,,285--336,285,,,,,,,,,,,,,,,,,,,english,false,,,polito,,,
132333,incollection,polito:2013,,,2013,,Asclepiades of Bithynia and Heraclides Ponticus: Medical Platonism?,Asclepiades of Bithynia and Heraclides Ponticus: Medical Platonism?,,,,,,,118--138,118,,,,,,,,,,,,,,,,,,,english,false,,,polito,,,1:history_of_philosophy
132334,book,poljakova:2013,,,2013,,"Differente Plausibilit{\""a}ten",Differente Plausibilitäten,,,,,,,,,,,Berlin,,,de-gruyter,,,,,,,,,,,,,ngerman,false,,,poljakova,,,1:epistemology
132335,article,poljansek_t:2018,,,2018,,"Technologischer Fortschritt als schrittweise Selbstentm{\""u}ndigung des Menschen",Technologischer Fortschritt als schrittweise Selbstentmündigung des Menschen,,,,philosophie-ch,,,,,,,,,,,,,,,,,,,,,,https://www.philosophie.ch/2018-08-20-poljansek,ngerman,false,,,poljansek_t,,,
132336,incollection,polk:1996,,,1996,,Reasoning Matters: Mental Models and Soar,Reasoning Matters: Mental Models and Soar,,,,,,,401--406,401,,,,,,,,,,,,,,,,,,,english,false,,,polk,,,1:psychology;2:cognitive_psychology;3:cognitive_architecture
132337,incollection,polkinghorne_de:1983,,,1983,,The Reductions and Existence: Bases for Epistemology,The Reductions and Existence: Bases for Epistemology,,,,,,,283--292,283,,,,,,,,,,,,,,,,,,,english,false,,,polkinghorne_de,,,1:rationality;2:intuition_as_a_faculty;3:phenomenological_reduction
132338,incollection,polkinghorne_de:1990,,,1990,,Psychology after Philosophy,Psychology after Philosophy,,,,,,,92--115,92,,,,,,,,,,,,,,,,,,,english,false,,,polkinghorne_de,,,1:psychology
132339,book,polkinghorne_jc:1994,,,1994,,The Quantum World,The Quantum World,,,,,,,,,,,London,,,longman,,,,,,,,,,,,,english,false,,,polkinghorne_jc,,,1:quantum_mechanics
132340,incollection,polkinghorne_jc:1995,,,1995,,The Metaphysics of Divine Action,The Metaphysics of Divine Action,,,,,,,147--156,147,,,,,,,,,Reprinted in \citet[97--110]{shults_fl-etal:2009},"Reprinted in Shults, Murphy, and Russell (2009)",,,,,,,,,english,false,,,polkinghorne_jc,,,1:causation;2:causal_closure;3:miracles
132341,book,polkinghorne_jc:2002,,,2002,,Quantum Theory.~A Very Short Introduction,Quantum Theory. A Very Short Introduction,,,,,,,,,,very_short_introductions,Oxford,,,oxford-university-press,,,,,,,,,,,,,english,false,,,polkinghorne_jc,,,1:quantum_mechanics
132342,incollection,polkinghorne_jc:2006,,,2006,,Christianity and Science,Christianity and Science,,,,,,,57--70,57,,,,,,,,,,,,,,,,,,,english,false,,,polkinghorne_jc,,,1:religion;2:science_and_religion
132343,article,polkinghorne_jc:2009,,,2009,,Mind and Matter:A Physicist's View,Mind and Matter:A Physicist's View,,,,philosophical-investigations,32,2,105--112,105,,,,,,,,,,,,,,,,,,,english,false,,,polkinghorne_jc,,,1:mind_body
132344,book,polkinghorne_jc:2011,,,2011,,Meaning in Mathematics,Meaning in Mathematics,Meaning in Mathematics,Meaning in Mathematics,,,,,,,,,Oxford,,,oxford-university-press,,,,,,,,,,,,,english,false,,,,polkinghorne_jc,,1:mathematics
132345,incollection,polkinghorne_jc:2011a,,,2011,,Mathematical Reality,Mathematical Reality,,,,,,,27--34,27,,,,,,,,,,,,,,,,,,,english,false,,,polkinghorne_jc,,,1:mathematics;2:nature_of_mathematics;3:mathematical_realism
132346,incollection,polkinghorne_jc:2011b,,,2011,,Reply [to \citet{leng:2011}],Reply [to Leng (2011)],,,,,,,39--40,39,,,,,,,,,,,,,,,,,,,english,false,,,polkinghorne_jc,,,1:mathematics;2:nature_of_mathematics;3:mathematical_realism
132347,incollection,polkinghorne_jc:2011c,,,2011,,Comment [on \citet{detlefsen_m:2011b}],Comment [on Detlefsen (2011)],,,,,,,95--96,95,,,,,,,,,,,,,,,,,,,english,false,,,polkinghorne_jc,,,1:method;3:discovery_in_mathematics
132348,incollection,polkinghorne_jc:2012,,,2012,,Doubt and Commitment in Science and Beyond,Doubt and Commitment in Science and Beyond,,,,,,,23--30,23,,,,,,,,,,,,,,,,,,,english,false,,,polkinghorne_jc,,,1:skepticism
132349,incollection,polkinghorne_jc:2013,,,2013,,Mathematics and Natural Theology,Mathematics and Natural Theology,,,,,,,449--458,449,,,,,,,,,,,,,,,,,,,english,false,,,polkinghorne_jc,,,1:religion;2:theology;3:natural_theology
132350,incollection,polkowski-semeniukpolkowska:2006,,,2006,,Mereology in Approximate Reasoning About Concepts,Mereology in Approximate Reasoning About Concepts,,,,,,,79--100,79,,,,,,,,,,,,,,,,,,,english,false,,,polkowski;semeniukpolkowska,,,1:ontology
132351,incollection,polkowski:2014,,,2014,,Mereology in Engineering and Computer Science,Mereology in Engineering and Computer Science,,,,,,,217--292,217,,,,,,,,,,,,,,,,,,,english,false,,,polkowski,,,1:complexity;2:mereology
132352,article,polkowski:2015,,,2015,,Mereology and Uncertainty,Mereology and Uncertainty,,,,logic-and-logical-philosophy,24,4,449--468,449,,,,,,,,,,,,,,,,,,,english,false,,,polkowski,,,1:complexity;2:mereology
132353,article,pollack_jb:1990,,,1990,,Recursive Distributed Representations,Recursive Distributed Representations,,,,artificial-intelligence,46,1/2,77--105,77,,,,,,,,,,,,,,,,,,,english,false,,,pollack_jb,,,1:psychology;2:cognitive_science;3:connectionism
132354,article,pollack_jb:1993,,,1993,,On Wings of Knowledge: A Review of \citet{newell_a:1992},On Wings of Knowledge: A Review of Newell (1992),,,,artificial-intelligence,59,1/2,355--369,355,,,,,,,,,,,,,,,,,,,english,false,,,pollack_jb,,,1:ai;2:robotics
132355,incollection,pollack_jb:1995,,,1995,,The Induction of Dynamical Recognizers,The Induction of Dynamical Recognizers,,,,,,,283--312,283,,,,,,,,,,,,,,,,,,,english,false,,,pollack_jb,,,1:perception;2:vision
132356,techreport,pollack_me-etal:1982,,,1982,,User Participation in the Reasoning Processes of Expert Systems,User Participation in the Reasoning Processes of Expert Systems,,,,,,ms--cis--82--10,,,,,"Philadelphia, Pennsylvania",department_of_computer_and_information_science_university_of_pennsylvania,,,,,"A short version of this report appears in the Proceedings of the National Conference on Artificial Intelligence, 1982","A short version of this report appears in the Proceedings of the National Conference on Artificial Intelligence, 1982",,,,,,,,,english,false,,,pollack_me;hirschberg_j;webber_bl,,,1:computation;2:computer_science
132357,article,pollack_me-horty:1999,,,1999,,There's More to Life than Making Plans,There's More to Life than Making Plans,,,,the-ai-magazine,20,4,71--84,71,,,,,,,,,,,,,,,,,,,english,false,,,pollack_me;horty,,,1:ai
132358,unpublished,pollack_me-moore:1992,,,1992,,Towards a Process-Based Analysis of Referring Expressions,Towards a Process-Based Analysis of Referring Expressions,,,,,,,,,,,,,,,,,"Unpublished manuscript, Computer Science Department, University of Pittsburgh","Unpublished manuscript, Computer Science Department, University of Pittsburgh",,,,,,,,,english,false,,,pollack_me;moore_jd,,,1:pragmatics;2:discourse;3:discourse_analysis
132359,incollection,pollack_me-ringuette:1990,,,1990,,Introducing the \textsc{Tileworld}: Experimentally Evaluating Agent Architectures,Introducing the Tileworld: Experimentally Evaluating Agent Architectures,,,,,,,183--189,183,,,,,,,,,,,,,,,,,,,english,false,,,pollack_me;ringuette_m,,,1:action;2:planning
132360,techreport,pollack_me:1986,,,1986,,Inferring Domain Plans in Question-Answering,Inferring Domain Plans in Question-Answering,,,,,,403,,,,,"Menlo Park, California",sri_international,,,,,,,,,,,,,,,english,false,,,pollack_me,,,1:action;2:planning
132361,incollection,pollack_me:1986a,,,1986,,A Model of Plan Inference That Distinguishes Between the Beliefs of Actors and Observers,A Model of Plan Inference That Distinguishes Between the Beliefs of Actors and Observers,,,,,,,207--215,207,,,,,,,,,Reprinted in \citet[279--295]{georgeff-lansky:1987},Reprinted in Georgeff and Lansky (1987),,,,,,,,,english,false,,,pollack_me,,,1:action;2:planning
132362,misc,pollack_me:1989,,,1989,,Plan Recognition Beyond \textsc{strips},Plan Recognition Beyond strips,Plan Recognition Beyond \textsc{strips},Plan Recognition Beyond strips,,,,,,,,,,,,,,,,,,,,,,,,,english,false,,,pollack_me,,,1:action;2:planning
132363,incollection,pollack_me:1990,,,1990,,Plans as Complex Mental Attitudes,Plans as Complex Mental Attitudes,,,,,,,77--103,77,,,,,,,,,,,,,,,,,,,english,false,,,pollack_me,,,1:action;2:planning
132364,article,pollack_me:1991,,,1991,,Overloading Intentions for Efficient Practical Reasoning,Overloading Intentions for Efficient Practical Reasoning,,,,nous,25,,513--536,513,,,,,,,,,,,,,,,,,,,english,false,,,pollack_me,,,1:action;2:intention
132365,article,pollack_me:1992,,,1992,,The Uses of Plans,The Uses of Plans,,,,artificial-intelligence,57,1,43--68,43,,,,,,,,,,,,,,,,,,,english,false,,,pollack_me,,,1:action;2:planning
132366,incollection,pollack_me:1998,,,1998,,On Individual Reasoning Strategies on Multi-Agent Interaction,On Individual Reasoning Strategies on Multi-Agent Interaction,,,,,,,157--164,157,,,,,,,,,,,,,,,,,,,english,false,,,pollack_me,,,1:action;2:collective_action
132367,incollection,pollackmilgate:2019,,,2019,,Romantic Views of Language,Romantic Views of Language,,,,,,,37--59,37,,,,,,,,,,,,,,,,,,,english,false,,,pollackmilgate,,,1:language
132368,article,pollard_b:2005,,,2005,,Naturalizing the Space of Reasons,Naturalizing the Space of Reasons,,,,international-journal-of-philosophical-studies,13,1,69--82,69,,,,,,,,,,,,,,,,,,,english,false,,,pollard_b,,,1:epistemology;2:justification;3:reasons_for_belief
132369,article,pollard_b:2006,,,2006,,Explaining Actions with Habits,Explaining Actions with Habits,,,,american-philosophical-quarterly,43,1,57--69,57,,,,,,,,,,,,,,,,,,,english,false,,,pollard_b,,,1:action;2:habit
132370,incollection,pollard_b:2010,,,2010,,Habitual Actions,Habitual Actions,,,,,,,74--81,74,,,,,,,,,,,,,,,,,,,english,false,,,pollard_b,,,1:action;2:habit
132371,incollection,pollard_b:2011,,,2011,,"Identification, Psychology, and Habits","Identification, Psychology, and Habits",,,,,,,81--97,81,,,,,,,,,,,,,,,,,,,english,false,,,pollard_b,,,1:action
132372,incollection,pollard_cj-moshier:1990,,,1990,,Unifying Partial Descriptions of Sets,Unifying Partial Descriptions of Sets,,,,,,,,,,,,,,,,,,,,,,,,,,,english,false,,,pollard_cj;moshier_md,,,1:information
132373,incollection,pollard_cj-sag:1983,,,1983,,Reflexives and Reciprocals in English: An Alternative to the Binding Theory,Reflexives and Reciprocals in English: An Alternative to the Binding Theory,,,,,,,189--203,189,,,,,,,,,,,,,,,,,,,english,false,,,pollard_cj;sag,,,1:language;2:reciprocal_constructions
132374,book,pollard_cj-sag:1987,,,1987,,Information-Based Syntax and Semantics,Information-Based Syntax and Semantics,,,,,,,,,,,"Stanford, California",,,csli-publications,,,,,,,,,,,,,english,false,,,pollard_cj;sag,,,1:linguistics;2:grammar;3:hpsg
132375,book,pollard_cj-sag:1994,,,1994,,Head-Driven Phrase Structure Grammar,Head-Driven Phrase Structure Grammar,,,,,,,,,,,"Chicago, Illinois",,,university-of-chicago-press,,,,,,,,,,,,,english,false,,,pollard_cj;sag,,,1:linguistics;2:grammar;3:hpsg
132376,inproceedings,pollard_cj:1986,,,1986,,Phrase Structure Grammar without Metarules,Phrase Structure Grammar without Metarules,Phrase Structure Grammar without Metarules,Phrase Structure Grammar without Metarules,,,,,,,,,"Stanford, California",,,stanford-linguistics-association,,,,,,,,,,,,,english,false,,,pollard_cj,,,1:linguistics;2:grammar;3:gpsg
132377,incollection,pollard_cj:1988,,,1988,,Categorial Grammar and Phrase Structure Grammar: An Excursion on the Syntax-Semantics Frontier,Categorial Grammar and Phrase Structure Grammar: An Excursion on the Syntax-Semantics Frontier,,,,,,,391--416,391,,,,,,,,,,,,,,,,,,,english,false,,,pollard_cj,,,1:linguistics;2:categorial_grammar
132378,article,pollard_cj:2015,,,2015,,Agnostic Hyperintensional Semantics,Agnostic Hyperintensional Semantics,,,,synthese,192,3,535--562,535,,,,,,,,,,,,,,,,,,,english,false,,,pollard_cj,,,1:representation;2:hyperintensionality
132379,article,pollard_deb:1975,,,1975,,Fiction and Modality,Fiction and Modality,,,,philosophy-and-phenomenological-research,35,,472--483,472,,,,,,,,,,,,,,,,,,,english,false,,,pollard_deb,,,1:aesthetics;2:fiction
132380,incollection,pollard_e:2013,,,2013,,The Place of \emph{jus post bellum} in Just War Considerations,The Place of jus post bellum in Just War Considerations,,,,,,,93--104,93,,,,,,,,,,,,,,,,,,,english,false,,,pollard_e,,,1:political_philosophy;2:war;3:just_war
132381,incollection,pollard_rm:2013,,,2013,,A Cooperative Correspondence: The Letters of Gregory the Great,A Cooperative Correspondence: The Letters of Gregory the Great,,,,,,,291--314,291,,,,,,,,,,,,,,,,,,,english,false,,,pollard_rm,,,1:history_of_philosophy
132382,article,pollard_s-martin:1996,,,1996,,Closed Bases and Closure Logic,Closed Bases and Closure Logic,,,,the-monist,79,1,117--127,117,,,,,,,,,,,,,,,,,,,english,false,,,pollard_s;martin_nm,,,1:epistemology;2:epistemic_closure
132383,article,pollard_s:1985,,,1985,,A Pecularity of the Empty Set,A Pecularity of the Empty Set,,,,the-southern-journal-of-philosophy,23,,355--360,355,,,,,,,,,,,,,,,,,,,english,false,,,pollard_s,,,1:mathematics;2:set_theory
132384,article,pollard_s:1986,,,1986,,Identity Criteria,Identity Criteria,,,,logique-et-analyse,29,115,373--380,373,,,,,,,,,,,,,,,,,,,english,false,,,pollard_s,,,1:identity;2:individuation
132385,article,pollard_s:1986a,,,1986,,Plural Quantification and the Iterative Conception of Set,Plural Quantification and the Iterative Conception of Set,,,,philosophy-research-archives,12,,579--587,579,,,,,,,,,,,,,,,,,,,english,false,,,pollard_s,,,1:mathematics;2:set_theory;3:nature_of_sets
132386,article,pollard_s:1988,,,1988,,More Axioms for the Set-Theoretic Hierarchy,More Axioms for the Set-Theoretic Hierarchy,,,,logique-et-analyse,31,121/122,85--88,85,,,,,,,,,,,,,,,,,,,english,false,,,pollard_s,,,1:mathematics;2:set_theory
132387,book,pollard_s:1990,,,1990,,Philosophical Introduction to Set Theory,Philosophical Introduction to Set Theory,,,,,,,,,,,"Notre Dame, Indiana",,,university-of-notre-dame-press,,,,,,,,,,,,,english,false,,,pollard_s,,,1:mathematics;2:set_theory
132388,article,pollard_s:1996,,,1996,,"Sets, Wholes, and Limited Pluralities","Sets, Wholes, and Limited Pluralities",,,,philosophia-mathematica,4,1,42--58,42,,,,,,,,,,,,,,,,,,,english,false,,,pollard_s,,,1:mathematics;2:set_theory
132389,article,pollard_s:1997,,,1997,,Who Needs Mereology?,Who Needs Mereology?,,,,philosophia-mathematica,5,1,65--70,65,,,,,,,,,,,,,,,,,,,english,false,,,pollard_s,,,1:complexity;2:mereology
132390,article,pollard_s:1997a,,,1997,,Review of \citet{smullyan_rm-fitting:1996},Review of Smullyan and Fitting (1996),,,,notre-dame-journal-of-formal-logic,38,,475--480,475,,,,,,,,,,,,,,,,,,,english,false,,,pollard_s,,,1:mathematics;2:set_theory
132391,article,pollard_s:2002,,,2002,,The Expressive Truth Conditions of Two-Valued Logic,The Expressive Truth Conditions of Two-Valued Logic,,,,notre-dame-journal-of-formal-logic,43,4,221--230,221,,,,,,,,,,,,,,,,,,,english,false,,,pollard_s,,,1:truth;2:excluded_middle;3:bivalence
132392,article,pollard_s:2013,,,2013,,Mathematics and the Good Life,Mathematics and the Good Life,,,,philosophia-mathematica,21,1,93--109,93,,,,,,,,,,,,,,,,,,,english,false,,,pollard_s,,,1:mathematics
132393,article,pollard_s:2013a,,,2013,,\emph{Dianoia} Left and Right,Dianoia Left and Right,,,,philosophia-mathematica,21,3,309--322,309,,,,,,,,,,,,,,,,,,,english,false,,,pollard_s,,,1:mathematics
132394,book,pollard_s:2022,,,2022,,"Ernst Schr{\""o}der on Algebra and Logic",Ernst Schröder on Algebra and Logic,,,,,,,,,,synthese_library,Dordrecht,,,springer,,,,,,,,,,,10.1007/978-3-031-05671-0,,english,false,,,pollard_s,,,1:logic;2:history_of_logic
132395,incollection,pollatsek-rayner:1989,,,1989,,Reading,Reading,,,,,,,401--436,401,,,,,,,,,,,,,,,,,,,english,false,,,pollatsek;rayner_k,,,1:linguistics
