id,entry_type,bibkey,options,shorthand,date_year,pubstate,title_latex,title_unicode,booktitle_latex,booktitle_unicode,crossref,journal_key,volume,number,pages,start_page,eid,series_key,address,institution_key,school_key,publisher_key,type_field,edition,note_latex,note_unicode,issuetitle_latex,issuetitle_unicode,extra_note_latex,extra_note_unicode,urn,eprint,doi,url,langid,is_translation,epoch,license,author_keys,editor_keys,guesteditor_keys,keyword_keys
186287,article,zobrist_m:2008,,,2008,,"Kants Lehre vom h{\""o}chsten Gut und die Frage moralischer Motivation",Kants Lehre vom höchsten Gut und die Frage moralischer Motivation,,,,kant-studien,99,3,285--311,285,,,,,,,,,,,,,,,,,,,ngerman,false,,,zobrist_m,,,2:the_good
186288,book,zobrist_m:2011,,,2011,,"Subjekt und Subjektivit{\""a}t in Kants theoretischer Philosophie.~Eine Untersuchung zu den transzendentalphilosophischen Problemen des Selbstbewusstseins und Daseinsbewusstseins",Subjekt und Subjektivität in Kants theoretischer Philosophie. Eine Untersuchung zu den transzendentalphilosophischen Problemen des Selbstbewusstseins und Daseinsbewusstseins,,,,,,163,,,,kantstudien_erg_a_nzungshefte,Berlin,,,de-gruyter,,,,,,,,,,,,,ngerman,false,,,zobrist_m,,,1:metaphysics;2:perspectivalism;3:subjectivity
186289,incollection,zock-adorni:1996,,,1996,,Introduction,Introduction,,,,,,,1--16,1,,,,,,,,,,,,,,,,,,,english,false,,,zock;adorni,,,1:linguistics;2:linguistics_as_a_science;3:mathematical_linguistics
186290,book,zock-sabah:1988,,,1988,,Advances in Natural Language Generation: an Interdisciplinary Perspective,Advances in Natural Language Generation: an Interdisciplinary Perspective,Advances in Natural Language Generation: an Interdisciplinary Perspective,Advances in Natural Language Generation: an Interdisciplinary Perspective,,,,,,,,,"Norwood, New Jersey",,,ablex-publishing-co,,,,,,,,,,,,,english,false,,,,zock;sabah_g,,1:linguistics
186291,book,zoeller:1984,,,1984,,"Theoretische Gegenstandsbeziehung bei Kant.~Zur systematischen Bedeutung der Termini ``objektive Realit{\""a}t'' und ``objektive G{\""u}ltigkeit'' in der \emph{Kritik der reinen Vernunft}",Theoretische Gegenstandsbeziehung bei Kant. Zur systematischen Bedeutung der Termini “objektive Realität” und “objektive Gültigkeit” in der Kritik der reinen Vernunft,,,,,,117,,,,kantstudien_erg_a_nzungshefte,Berlin,,,de-gruyter,,,,,,,,,,,,,ngerman,false,,,zoeller,,,1:metaphysics;2:perspectivalism;3:objectivity_in_representation
186292,article,zoeller:1992,,,1992,,Lichtenberg and Kant on the Subject of Thinking,Lichtenberg and Kant on the Subject of Thinking,,,,journal-of-the-history-of-philosophy,30,3,417--441,417,,,,,,,,,,,,,,,,,,,english,false,,,zoeller,,,1:epistemology;2:cogito
186293,incollection,zoeller:1992a,,,1992,,The Austrian Way of Ideas: Contents and Objects of Presentations in the Brentano School,The Austrian Way of Ideas: Contents and Objects of Presentations in the Brentano School,,,,,,,341--354,341,,,,,,,,,,,,,,,,,,,english,false,,,zoeller,,,1:representation;2:ideas
186294,incollection,zoeller:1995a,,,1995,,Changing the Appearances: Fichte's Transcendental Theory of Practical Self-Determination,Changing the Appearances: Fichte's Transcendental Theory of Practical Self-Determination,,,,,,,929--942,929,,,,,,,,,,,,,,,,,,,english,false,,,zoeller,,,1:persons;2:self;3:noumenal_self
186295,incollection,zoeller:1999,,,1999,,Schopenhauer on the Self,Schopenhauer on the Self,,,,,,,18--43,18,,,,,,,,,,,,,,,,,,,english,false,,,zoeller,,,1:persons;2:self
186296,incollection,zoeller:2000,,,2000,,"German Realism: The Self-Limitation of Idealist Thinking in Fichte, Schelling, and Schopenhauer","German Realism: The Self-Limitation of Idealist Thinking in Fichte, Schelling, and Schopenhauer",,,,,,,200--218,200,,,,,,,,,,,,,,,,,,,english,false,,,zoeller,,,1:metaphysics;2:idealism
186297,incollection,zoeller:2001,,,2001,,Die Bestimmung der Bestimmung des Menschen bei Mendelssohn und Kant,Die Bestimmung der Bestimmung des Menschen bei Mendelssohn und Kant,,,,,,,476--490,476,,,,,,,,,,,,,,,,,,,ngerman,false,,,zoeller,,,1:social_sciences;2:anthropology
186298,incollection,zoeller:2003,,,2003,,Das Absolute und seine Erscheinung,Das Absolute und seine Erscheinung,,,,,,,165--182,165,,,,,,,,,,,,,,,,,,,ngerman,false,,,zoeller,,,1:metaphysics;2:the_absolute
186299,article,zoeller:2008,,,2008,,Kant and the Problem of Existential Judgment: Critical Comments [on \citet{martin_wm:2006}],Kant and the Problem of Existential Judgment: Critical Comments [on Martin (2006)],,,,philosophical-studies,137,1,121--134,121,,,,,,,,,,,,,,,,,10.1007/s11098-007-9175-z,,english,false,,,zoeller,,,1:pragmatics;2:judgement
186300,incollection,zoeller:2009,,,2009,,"Aufkl{\""a}rung {\""u}ber Aufkl{\""a}rung.~Kants Konzeption des selbst{\""a}ndigen, {\""o}ffentlichen und gemeinschaftlichen Gebrauchs der Vernunft","Aufklärung über Aufklärung. Kants Konzeption des selbständigen, öffentlichen und gemeinschaftlichen Gebrauchs der Vernunft",,,,,,,82--99,82,,,,,,,,,,,,,,,,,,,ngerman,false,,,zoeller,,,1:history_of_philosophy
186301,incollection,zoeller:2010,,,2010,,In der Begrenzung zeigt sich der Meister.~Der metaphysische Minimalismus der \emph{Kritik der reinen Vernunft},In der Begrenzung zeigt sich der Meister. Der metaphysische Minimalismus der Kritik der reinen Vernunft,,,,,,,19--35,19,,,,,,,,,,,,,,,,,,,ngerman,false,,,zoeller,,,1:metaphysics;2:transcendental_idealism;3:transcendental_illusion
186302,incollection,zoeller:2011,,,2011,,"Eine ``Wissenschaft f{\""u}r G{\""o}tter''.~Die Lebenswissenschaften aus der Sicht Kants",Eine “Wissenschaft für Götter”. Die Lebenswissenschaften aus der Sicht Kants,,,,,,,877--892,877,,,,,,,,,,,,,,,,,,,ngerman,false,,,zoeller,,,1:biology;2:life
186303,incollection,zoeller:2012,,,2012,,Schopenhauer's Fairy Tale about Fichte: The Origin of \emph{The World as Will and Representation} in German Idealism,Schopenhauer's Fairy Tale about Fichte: The Origin of The World as Will and Representation in German Idealism,,,,,,,385--402,385,,,,,,,,,,,,,,,,,,,english,false,,,zoeller,,,1:history_of_philosophy
186304,incollection,zoeller:2013,,,2013,,Idee und Notwendigkeit einer Metaphysik der Sitten,Idee und Notwendigkeit einer Metaphysik der Sitten,,,,,,,11--24,11,,,,,,,,,,,,,,,,,,,ngerman,false,,,zoeller,,,1:ethics
186305,incollection,zoeller:2014,,,2014,,"Libertas civilis -- Zur politischen Pr{\""a}gung von Freiheit und Autonomie bei Kant",Libertas civilis – Zur politischen Prägung von Freiheit und Autonomie bei Kant,,,,,,,329--338,329,,,,,,,,,,,,,,,,,,,ngerman,false,,,zoeller,,,1:political_philosophy;2:liberty
186306,incollection,zoeller:2014b,,,2014,,"{\""A}sthetische Welt- und Willenserkenntnis.~Schopenhauers Kunst- und Musikphilosophie im dritten Buch der \emph{Welt als Wille und Vorstellung} (W I , \S\S 43-52)","Ästhetische Welt- und Willenserkenntnis. Schopenhauers Kunst- und Musikphilosophie im dritten Buch der Welt als Wille und Vorstellung (W I , 43-52)",,,,,,,119--136,119,,,,,,,,,,,,,,,,,,,ngerman,false,,,zoeller,,,1:aesthetics
186307,incollection,zoeller:2014d,,,2014,,Church and State: Schelling's Political Philosophy of Religion,Church and State: Schelling's Political Philosophy of Religion,,,,,,,200--215,200,,,,,,,,,,,,,,,,,,,english,false,,,zoeller,,,1:religion
186308,incollection,zoeller:2017,,,2017,,Conditions of Objectivity.~Kant's Critical Conception of Transcendental Logic,Conditions of Objectivity. Kant's Critical Conception of Transcendental Logic,,,,,,,3--28,3,,,,,,,,,,,,,,,,,,,english,false,,,zoeller,,,1:logic;2:nature_of_logic;3:transcendental_logic
186309,book,zoeller:2018,,,2018,,Philosophie des 19.~Jahrhunderts.~Von Kant bis Nietzsche,Philosophie des 19. Jahrhunderts. Von Kant bis Nietzsche,,,,,,,,,,,"M{\""u}nchen",,,ch-beck,,,,,,,,,,,,,ngerman,false,,,zoeller,,,1:history_of_philosophy
186310,incollection,zoeller:2018a,,,2018,,Schopenhauer's System of Freedom,Schopenhauer's System of Freedom,,,,,,,276--295,276,,,,,,,,,,,,,,,,,,,english,false,,,zoeller,,,1:determinism;2:free_will
186311,incollection,zoeller:2018b,,,2018,,``Inborn Freedom''.~Kant's Republicanism and Its Historico-Systematic Context,“Inborn Freedom”. Kant's Republicanism and Its Historico-Systematic Context,,,,,,,693--712,693,,,,,,,,,,,,,,,,,,,english,false,,,zoeller,,,1:political_philosophy;2:justification_of_the_state;3:republicanism
186312,incollection,zoglauer:1997,,,1997,,"Normenkonflikte.~Zum Problem deontischer Widerspr{\""u}che in Normensystemen",Normenkonflikte. Zum Problem deontischer Widersprüche in Normensystemen,,,,,,,403--411,403,,,,,,,,,,,,,,,,,,,ngerman,false,,,zoglauer,,,1:rationality;2:disagreement;3:moral_dilemmas
186313,book,zoglauer:2008,,,2008,,"Einf{\""u}hrung in die formale Logik f{\""u}r Philosophen",Einführung in die formale Logik für Philosophen,,,,,,,,,,,"G{\""o}ttingen",,,vandenhoeck-ruprecht,,4,,,,,,,,,,,ngerman,false,,,zoglauer,,,1:logic;2:logic_course
186314,article,zoglauer:2022,,,2022,,Streit um die Wahrheit,Streit um die Wahrheit,,,,philosophie-ch,,,,,,,,,,,,,,,,,,,,,,https://www.philosophie.ch/2022-10-31-zoglauer,ngerman,false,,,zoglauer,,,
186315,book,zohar_d-marshall:1990,,,1990,,The Quantum Self,The Quantum Self,,,,,,,,,,,New York,,,william-morrow-company,,,,,,,,,,,,,english,false,,,zohar_d;marshall_in,,,1:persons;2:self
186316,article,zohar_d:1995,,,1995,,A Quantum-Mechanical Model of Consciousness and the Emergence of `I',A Quantum-Mechanical Model of Consciousness and the Emergence of ‘I',,,,minds-and-machines,5,,597--607,597,,,,,,,,,,,,,,,,,,,english,false,,,zohar_d,,,2:consciousness
186317,incollection,zohar_d:1996,,,1996,,Consciousness and Bose-Einstein Condensates,Consciousness and Bose-Einstein Condensates,,,,,,,,,,,,,,,,,,,,,,,,,,,english,false,,,zohar_d,,,2:consciousness
186318,incollection,zohar_d:2014,,,2014,,Risking and Protecting Lives: Soldiers and Opposing Civilians,Risking and Protecting Lives: Soldiers and Opposing Civilians,,,,,,,155--171,155,,,,,,,,,,,,,,,,,,,english,false,,,zohar_d,,,1:social_philosophy;2:war
186319,incollection,zohar_n:2017,,,2017,,"Peace, Justice and Religious Humanism.~A Jewish Perspective","Peace, Justice and Religious Humanism. A Jewish Perspective",,,,,,,143--158,143,,,,,,,,,,,,,,,,,,,english,false,,,zohar_n,,,1:social_philosophy;2:war
186320,article,zollman-smead:2010,,,2010,,Plasticity and Language: An Example of the Baldwin Effect?,Plasticity and Language: An Example of the Baldwin Effect?,,,,philosophical-studies,147,1,7--21,7,,,,,,,,,,,,,,,,,10.1007/s11098-009-9447-x,,english,false,,,zollman;smead_r,,,1:language
186321,article,zollman:2009,,,2009,,Optimal Publishing Strategies,Optimal Publishing Strategies,,,,episteme,6,2,185--199,185,,,,,,,,,,,,,,,,,,,english,false,,,zollman,,,1:metaphilosophy;2:philosophy_as_a_discipline
186322,article,zollman:2013,,,2013,,Network Epistemology: Communication in Epistemic Communities,Network Epistemology: Communication in Epistemic Communities,,,,philosophy-compass,8,1,15--27,15,,,,,,,,,,,,,,,,,,,english,false,,,zollman,,,1:epistemology;2:collective_epistemology
186323,article,zollman:2015,,,2015,,Modeling the Social Consequences of Testimonial Norms,Modeling the Social Consequences of Testimonial Norms,,,,philosophical-studies,172,9,2371--2383,2371,,,,,,,,,,,,,,,,,10.1007/s11098-014-0416-7,,english,false,,,zollman,,,1:epistemology;2:testimony
186324,article,zollman:2018,,,2018,,The Credit Economy and the Economic Rationality of Science,The Credit Economy and the Economic Rationality of Science,,,,the-journal-of-philosophy,115,1,5--33,5,,,,,,,,,,,,,,,,,,,english,false,,,zollman,,,1:economics
186325,incollection,zollman:2018a,,,2018,,Learning to Collaborate,Learning to Collaborate,,,,,,,65--77,65,,,,,,,,,,,,,,,,,,,english,false,,,zollman,,,1:science;2:sociology_of_science
186326,incollection,zollo-core:1999,,,1999,,Automatically Extracting Grounding Tags from {BF} Tags,Automatically Extracting Grounding Tags from BF Tags,,,,,,,109--114,109,,,,,,,,,,,,,,,,,,,english,false,,,zollo;core,,,1:pragmatics;2:discourse;3:discourse_structure
186327,incollection,zollo:1999,,,1999,,A study of Human Dialogue Strategies in the Presence of Speech Recognition Errors,A study of Human Dialogue Strategies in the Presence of Speech Recognition Errors,,,,,,,132--139,132,,,,,,,,,,,,,,,,,,,english,false,,,zollo,,,1:pragmatics;2:discourse;3:discourse_analysis
186328,book,zolo:1989,,,1989,,Reflexive Epistemology: The Philosophical Legacy of Otto Neurath,Reflexive Epistemology: The Philosophical Legacy of Otto Neurath,,,,,,118,,,,boston_studies_in_the_philosophy_of_science,Dordrecht,,,d-reidel-publishing-co,,,,,,,,,,,,,english,false,,,zolo,,,1:epistemology
186329,incollection,zoltowski_a:1931,,,1931,,"The Problem of Knowledge in Modern Times, its Terms and its Solution","The Problem of Knowledge in Modern Times, its Terms and its Solution",,,,,,,421--425,421,,,,,,,,,,,,,,,,,,,english,false,,,zoltowski_a,,,1:epistemology
186330,article,zong:2011,,,2011,,Retention of Indexical Belief and the Notion of Psychological Continuity,Retention of Indexical Belief and the Notion of Psychological Continuity,,,,the-philosophical-quarterly,61,244,608--623,608,,,,,,,,,,,,,,,,,,,english,false,,,zong,,,1:representation;2:de_se;3:egocentric_beliefs
186331,incollection,zonneveld:2006,,,2006,,Science in Mind: Exploring the Language of the Logos,Science in Mind: Exploring the Language of the Logos,,,,,,,21--38,21,,,,,,,,,,,,,,,,,,,english,false,,,zonneveld,,,1:political_philosophy
186332,incollection,zonneveld:2007,,,2007,,Science and the Human Phenomenon: Markings From a Cosmic Orphan,Science and the Human Phenomenon: Markings From a Cosmic Orphan,,,,,,,125--136,125,,,,,,,,,,,,,,,,,,,english,false,,,zonneveld,,,
186333,book,zonta-grezzi:2018,,,2018,,Terminologia filosofica tra oriente e occidente,Terminologia filosofica tra oriente e occidente,Terminologia filosofica tra oriente e occidente,Terminologia filosofica tra oriente e occidente,,,,126,,,,lessico_intellettuale_europeo,Firenze,,,casa-editrice-leo-s-olschki,,,,,,,,,,,,,italian,false,,,,zonta;grezzi_p,,1:history_of_philosophy
186334,incollection,zonta:1998,,,1998,,"Syriac, Hebrew and Latin Encyclopedias in the 13th Century: A Comparative Approach to ``Medieval Philosophies''","Syriac, Hebrew and Latin Encyclopedias in the 13th Century: A Comparative Approach to “Medieval Philosophies”",,,,,,,922--928,922,,,,,,,,,,,,,,,,,,,english,false,,,zonta,,,1:metaphilosophy
186335,incollection,zonta:2009,,,2009,,Textual Traditions,Textual Traditions,,,,,,,60--87,60,,,,,,,,,,,,,,,,,,,english,false,,,zonta,,,1:history_of_philosophy
186336,article,zonta:2011,,,2011,,"About Todros Todrosi's Medieval Hebrew Translation of al-F{\={a}}r{\={a}}b{\={i}}'s Lost Long Commentary/Gloss-Commentary on Aristotle's Topics, Book VIII","About Todros Todrosi's Medieval Hebrew Translation of al-Fārābī's Lost Long Commentary/Gloss-Commentary on Aristotle's Topics, Book VIII",,,,history-and-philosophy-of-logic,32,1,37--45,37,,,,,,,,,,,,,,,,,,,english,false,,,zonta,,,1:logic;2:history_of_logic
186337,book,zorgbibe:2004,,,2004,,Les paradoxes de la loi: saint Augustin et Kierkegaard,Les paradoxes de la loi: saint Augustin et Kierkegaard,,,,,,,,,,ouverture_philosophique,Paris,,,l-harmattan,,,,,,,,,,,,,french,false,,,zorgbibe,,,1:religion
186338,incollection,zori_c:2018,,,2018,,Symbolizing Imperial Affiliation in Death: Case Studies from the Inka Empire (AD 1400--1532),Symbolizing Imperial Affiliation in Death: Case Studies from the Inka Empire (AD 1400–1532),,,,,,,43--59,43,,,,,,,,,,,,,,,,,,,english,false,,,zori_c,,,1:time;2:death
186339,incollection,zori_dm:2018,,,2018,,Viking Death: Pre-Christian Rites of Passage and Funerary Feasting,Viking Death: Pre-Christian Rites of Passage and Funerary Feasting,,,,,,,327--341,327,,,,,,,,,,,,,,,,,,,english,false,,,zori_dm,,,1:time;2:death
186340,book,zorn_dp:2018,,,2018,,"Einf{\""u}hrung in die Philosophie",Einführung in die Philosophie,,,,,,100,,,,rote_reihe,Frankfurt a.M.,,,vittorio-klostermann,,,,,,,,,,,,,ngerman,false,,,zorn_dp,,,1:metaphilosophy
186341,UNKNOWN,zosso_b:2000,,,2000,,"Autonomie und Alterit{\""a}t: zur Bedeutung von Immanuel Kant, Lawrence Kohlberg und Emmanuel Levinas f{\""u}r die Moralerziehung","Autonomie und Alterität: zur Bedeutung von Immanuel Kant, Lawrence Kohlberg und Emmanuel Levinas für die Moralerziehung",,,,,,,,,,,Fribourg,,d_e_partement_de_philosophie_universit_e_de_fribourg,,Travail de licence,,,,,,,,,,,,ngerman,false,,,zosso_b,,,
186342,incollection,zotov:2004,,,2004,,Phenomenology as a Fact of Cultural History,Phenomenology as a Fact of Cultural History,,,,,,,627--636,627,,,,,,,,,,,,,,,,,,,english,false,,,zotov,,,1:social_philosophy;2:culture
186343,incollection,zotov:2005,,,2005,,Ontological Intentions of Twentieth-Century Transcendentalism,Ontological Intentions of Twentieth-Century Transcendentalism,,,,,,,105--118,105,,,,,,,,,,,,,,,,,,,english,false,,,zotov,,,
186344,incollection,zotov:2007,,,2007,,Artificial Intelligence: The Role of Phenomenology in the Organization of Interdisciplinary Researches,Artificial Intelligence: The Role of Phenomenology in the Organization of Interdisciplinary Researches,,,,,,,179--188,179,,,,,,,,,,,,,,,,,,,english,false,,,zotov,,,1:ai
186345,incollection,zoubir-murji:2020,,,2020,,Beyond Marxism Versus Cultural Studies: Critical Theories of Racism and Political Action from Migrant Workers to Black Lives Matter,Beyond Marxism Versus Cultural Studies: Critical Theories of Racism and Political Action from Migrant Workers to Black Lives Matter,,,,,,,28--37,28,,,,,,,,,,,,,,,,,,,english,false,,,zoubir;murji_k,,,1:political_philosophy;2:discrimination;3:racism
186346,incollection,zouhar_m:2004,,,2004,,Unbound Anaphora and the Anaphoric Meaning of ``The'',Unbound Anaphora and the Anaphoric Meaning of “The”,,,,,,,299,299,,,,,,,,,,,,,,,,,,,english,false,,,zouhar_m,,,1:reference;2:anaphora
186347,article,zouhar_m:2007,,,2007,,"Definite Descriptions, Reference, and Inference","Definite Descriptions, Reference, and Inference",,,,theoria,73,1,28--45,28,,,,,,,,,,,,,,,,,,,english,false,,,zouhar_m,,,1:reference;2:definite_descriptions
186348,article,zouhar_m:2009,,,2009,,On the Notion of Rigidity for General Terms,On the Notion of Rigidity for General Terms,,,,grazer-philosophische-studien,78,,207--229,207,,,,,,,,,,,,,,,,,,,english,false,,,zouhar_m,,,1:properties;2:property_designators
186349,incollection,zouhar_m:2014,,,2014,,On Underdetermination of Contextualism,On Underdetermination of Contextualism,,,,,,,291--312,291,,,,,,,,,,,,,,,,,,,english,false,,,zouhar_m,,,1:representation;2:content_determination;3:content_contextualism
186350,book,zourabichvili:2003,,,2003,,Le vocabulaire de Deleuze,Le vocabulaire de Deleuze,,,,,,,,,,vocabulaire_de_dots,Paris,,,ellipses,,,,,,,,,,,,,french,false,,,zourabichvili,,,1:dictionary
186351,incollection,zovko_j:2014,,,2014,,The Human Sciences and Moral Judgment,The Human Sciences and Moral Judgment,,,,,,,131--144,131,,,,,,,,,,,,,,,,,,,english,false,,,zovko_j,,,1:ethics
186352,incollection,zovko_j:2015,,,2015,,Zwischen Hermeneutik und Dialektik,Zwischen Hermeneutik und Dialektik,,,,,,,119--131,119,,,,,,,,,,,,,,,,,,,ngerman,false,,,zovko_j,,,1:history_of_philosophy
186353,book,zovko_me-dillon:2023,,,2023,,Tourism and Culture in Philosophical Perspective,Tourism and Culture in Philosophical Perspective,,,,,,,,,,,Berlin,,,springer,,,,,,,,,,,10.1007/978-3-031-36659-8,,english,false,,,zovko_me;dillon_jm,,,
186354,article,zovko_me:2010,,,2010,,Der systematische Zusammenhang der Philosophie in Kants \emph{Kritik der Urteilskraft},Der systematische Zusammenhang der Philosophie in Kants Kritik der Urteilskraft,,,,deutsche-zeitschrift-fur-philosophie,58,4,629--645,629,,,,,,,,,,,,,,,,,,,ngerman,false,,,zovko_me,,,1:metaphysics;2:transcendental_idealism
186355,incollection,zovko_me:2018,,,2018,,Poetry and Play in Kant's \emph{Critique of Judgment},Poetry and Play in Kant's Critique of Judgment,,,,,,,3159--3168,3159,,,,,,,,,,,,,,,,,,,english,false,,,zovko_me,,,1:aesthetics;2:fiction;3:poetry
186356,incollection,zowislo:2002,,,2002,,"Three Models of the Human Dynamic Towards Integrity: Eliade, Jung, Wilber","Three Models of the Human Dynamic Towards Integrity: Eliade, Jung, Wilber",,,,,,,145--158,145,,,,,,,,,,,,,,,,,,,english,false,,,zowislo,,,1:ethics
186357,incollection,zowislo:2009,,,2009,,The Existential Overcoming of Phenomenology in Hans Blumenberg's Philosophy of Life and Myth,The Existential Overcoming of Phenomenology in Hans Blumenberg's Philosophy of Life and Myth,,,,,,,309--324,309,,,,,,,,,,,,,,,,,,,english,false,,,zowislo,,,1:religion;2:islam
